Unnamed: 0,de,uk,TRANSLATION,BLEURT_Score,UK
186.0,Beantworten Sie die Frage!,Дайте відповідь на питання!,Wie lautet die Antwort?,-0.9121274948120117,
187.0,Beeil dich! Sonst verpasst du noch den Zug.,"Хутко, бо не встигнеш на потяг.","Schnell, sonst schaffen Sie's nicht.",-1.0760526657104492,
188.0,Beeilen Sie sich! Sonst verpassen Sie noch den Zug.,"Хутко, бо не встигнете на потяг.","Schnell, sonst schaffen Sie's nicht.",-0.8453995585441589,
189.0,Beeilen wir uns lieber!,Нам краще поспiшити.,Wir sollten besser pinkeln.,-1.340918779373169,
190.0,"Beeilt euch, Leute!","Покваптеся, хлопці.","Beeilt euch, Jungs.",-0.5355780124664307,
191.0,"Beeilt euch, sonst verpasst ihr den Zug.","Покваптеся, бо спізнитеся на потяг.","Beeilt euch, denn ihr kommt zum Zug.",-0.155689999461174,
192.0,Beeilt euch! Sonst verpasst ihr noch den Zug.,"Хутко, бо не встигнете на потяг.","Schnell, sonst schaffen Sie's nicht.",-0.8683693408966064,
193.0,Beethoovens „Ode an die Freude“ ist die offizielle Hymne der Europäischen Union.,«Ода до радості» Бетховена - офіційний гімн Європейського союзу.,„ Zum Glück “ist Beethovens offizielle Nationalhymne der Europäischen Union.,-0.6829483509063721,
194.0,Befreit Bolivien!,Свободу Болівії!,Boliviens Freiheit!,-0.14142145216464996,
195.0,Beginnen Sie noch einmal.,Почніть знову.,Fangen Sie wieder an.,-0.9277622699737549,
196.0,Bei dem dichten Nebel war die Straße kaum zu sehen.,Через густий туман на дорозі була погана видимість.,Der dichte Nebel auf dem Weg führte zu schlechten Sichtverhältnissen.,-0.48098552227020264,
197.0,Beide sind am Leben.,Вони обидва живі.,Sie sind beide am Leben.,0.887931227684021,
198.0,Beide sind am Leben.,Обидва живі.,Beide sind am Leben.,0.9178433418273926,
199.0,Beide sind tot.,Вони обидва мертві.,Beide sind tot.,0.9172898530960083,
200.0,Beide sind tot.,Вони обидві мертві.,Beide sind tot.,0.9172898530960083,
201.0,Bei einem Brand benutzen Sie bitte die Treppe.,"У разі пожежі, користуйтеся сходами.","Wenn es brennt, verwendet man Treppen.",-0.8607107400894165,
202.0,Beißt dein Hund?,Твій собака кусається?,Ist dein Hund beißend?,0.9004096388816833,
203.0,Bei uns ist alles in Ordnung.,У нас все гаразд.,Es geht uns gut.,-1.2211629152297974,
204.0,Beleidigen Sie mich nicht!,Не ображайте мене.,Verletzen Sie mich nicht.,-0.27165478467941284,
205.0,Belgien ist nicht so groß wie Frankreich.,"Бельгія не така велика, як Франція.",Belgien ist nicht so groß wie Frankreich.,0.9052225351333618,
206.0,Belgrad ist die Hauptstadt von Serbien.,Белград - столиця Сербії.,"Belgrad, die Hauptstadt Serbiens",0.21487626433372498,
207.0,Belgrad ist die Hauptstadt von Serbien.,Белград - це столиця Сербії.,Belgrad ist die Hauptstadt Serbiens.,0.35161417722702026,
208.0,Benehmen Sie sich nicht wie ein Kind!,"Не поводьтеся, як дитина.",Nicht wie ein Kind handeln.,-0.4756721258163452,
209.0,Benimm dich anständig.,Поводься чемно.,Sei nett.,-1.1219353675842285,
210.0,Benimm dich nicht wie ein Kind!,"Не поводься, як дитина.",Benimm dich nicht wie ein Kind.,0.7723048329353333,
211.0,Berlin ist eine deutsche Stadt.,Берлін - німецьке місто.,Berlin ist eine deutsche Stadt.,0.8912298679351807,
212.0,Besser ein Vogel in der Hand als zehn in der Luft.,"Краще синиця в жмені, ніж журавель в небі.",Besser ein Junge in einer Handvoll als ein Kranich im Himmel.,-0.1732764095067978,
213.0,Besser.,Так ліпше.,So ist es besser.,-0.08619517087936401,
214.0,Betreibst du irgendwelche Sportarten?,Ти займаєшся якими-небудь видами спорту?,Machst du irgendeine Art von Sport?,-0.5520364046096802,
215.0,Betty ist eine Serienmörderin.,Бетті - серійна вбивця.,Betty ist ein Serienmörder.,0.6463929414749146,
216.0,Betty kam als letzte.,Беті прийшла останньою.,Betty ist zuletzt gekommen.,-0.6035460233688354,
217.0,Betty spricht sehr gut Esperanto.,Беті дуже добре розмовляє на есперанто.,Betty spricht sehr gut bei Esperanto.,0.7359694838523865,
218.0,Beweise es.,Доведи це.,Beweise es.,0.928802490234375,
219.0,"Bezahl, was du möchtest.","Заплати стільки, скільки хочеш.","Bezahle so viel, wie du willst.",-0.8778812885284424,
220.0,Biegen Sie an der Kreuzung rechts ab.,Поверніть праворуч на перехресті.,Dreht nach rechts auf der Kreuzung.,-0.20219145715236664,
221.0,Bill geht oft in den Park.,Білл часто ходить до парку.,Bill geht oft in den Park.,0.9102617502212524,
222.0,Billig ist teuer.,Скупий платить двічі.,Der Käufer zahlt zweimal.,-0.7829504609107971,
223.0,Bill kommt nächste Woche zurück.,Біл повернеться наступного тижня.,Bill kommt nächste Woche zurück.,0.9108392000198364,
224.0,Bill lebt nah am Meer.,Біл живе недалеко від моря.,Bill wohnt nicht weit vom Meer entfernt.,-0.8608071804046631,
225.0,Bill raucht nicht mehr.,Білл більше не палить.,Bill raucht nicht mehr.,0.8996554613113403,
226.0,"Bill, ruf mich heute Abend an.","Біле, зателефонуй мені сьогодні ввечері.","Bill, ruf mich heute Abend an.",0.9225390553474426,
227.0,Bill war in Japan.,Біл був у Японії.,Bill war in Japan.,0.912405252456665,
228.0,Bill wohnt in der Nähe des Meeres.,Біл живе недалеко від моря.,Bill wohnt nicht weit vom Meer entfernt.,-0.36838752031326294,
229.0,Bin ich bereit?,Я готова?,Bin ich bereit?,0.9279971122741699,
230.0,Bin ich bereit?,Я готовий?,Bin ich bereit?,0.9279971122741699,
231.0,Bin ich gefeuert?,Я звільнена?,Bin ich gefeuert?,0.9164144992828369,
232.0,Bin ich in London?,Чи я в Лондоні?,Bin ich in London?,0.9142614603042603,
233.0,Bin ich in London?,Я в Лондоні?,Bin ich in London?,0.9142614603042603,
234.0,Bis bald!,Побачимося!,Wir sehen uns!,-1.364424467086792,
235.0,Bis fünf Uhr wird er wieder zurück sein.,Він повернеться з школи до п'ятої.,Er kommt von der Schule zurück auf Freitag.,-0.7928047776222229,
236.0,Bis morgen!,До завтра!,Bis morgen!,0.9238086938858032,
237.0,Bis nächste Woche!,Побачимося наступного тижня.,Bis nächste Woche.,0.7728896737098694,
238.0,Bis später!,Побачимось пізніше!,Bis später!,0.9188339710235596,
239.0,Bist du am Arbeiten?,Ти на роботі?,Bist du auf der Arbeit?,0.19501566886901855,
240.0,Bist du Amerikaner?,Ти американець?,Bist du Amerikaner?,0.9086163640022278,
241.0,Bist du an Musik interessiert?,Тебе цікавить музика?,Interessierst du dich für Musik?,-0.05517493188381195,
242.0,Bist du Atheist?,Ти атеїст?,Bist du ein Atheist?,0.5178448557853699,
243.0,Bist du Atheist?,Ти атеїстка?,Bist du Atheistin?,0.7608261704444885,
244.0,Bist du aus den Vereinigten Staaten?,Ти зі Сполучених Штатів?,Bist du aus den USA?,-0.49628448486328125,
245.0,Bist du Ausländer?,Ти іноземець?,Bist du ein Ausländer?,0.5985375046730042,
246.0,Bist du bei mir?,Ти зі мною?,Kommst du mit?,-1.1817612648010254,
247.0,Bist du bereit anzufangen?,Готовий починати?,Bist du bereit?,-0.2931164503097534,
248.0,"Bist du bereit, aus dem Haus zu gehen?",Готовий іти надвір?,Bist du bereit zu gehen?,-0.24497179687023163,
249.0,Bist du Deutscher?,Ти німець?,Bist du Deutscher?,0.9031602144241333,
250.0,Bist du dick?,Ти гладкий?,Bist du glatt?,-0.3842538595199585,
251.0,Bist du eine gute Tänzerin?,Ти добре танцюєш?,Tanzst du gut?,-0.5578928589820862,
252.0,Bist du ein Einzelkind?,Ти єдина дитина?,Bist du das einzige Kind?,0.12550793588161469,
253.0,Bist du ein guter Tänzer?,Ти добре танцюєш?,Tanzst du gut?,-0.44448620080947876,
254.0,Bist du ein Mensch?,Ти людина?,Bist du ein Mensch?,0.8991224765777588,
255.0,Bist du ein Vampir?,Ти вампір?,Bist du Vampir?,0.039267152547836304,
256.0,Bist du Engländer?,Ти англієць?,Bist du Engländer?,0.9104500412940979,
257.0,Bist du enttäuscht?,Ти розчарована?,Bist du enttäuscht?,0.9090379476547241,
258.0,Bist du es?,Це ти?,Bist du das?,0.25280338525772095,
259.0,Bist du fertig?,Ти готова?,Bist du bereit?,-0.7157419919967651,
260.0,Bist du fertig?,Ти готовий?,Bist du bereit?,-0.7157419919967651,
261.0,Bist du gesund?,Ти здорова?,Bist du gesund?,0.9098852872848511,
262.0,Bist du gesund?,Ти здоровий?,Bist du gesund?,0.9098852872848511,
263.0,"Bist du gewarnt, bist du gewappnet.",Попереджений - означає озброєнний.,Warnend bedeutet bewaffnet.,-1.1778104305267334,
264.0,Bist du heute beschäftigt?,Ти сьогодні зайнятий?,Hast du heute zu tun?,-0.4313049912452698,
265.0,Bist du heute in die Schule gegangen?,Ти сьогодні ходив до школи?,Warst du heute zur Schule gegangen?,0.08199404180049896,
266.0,Bist du heute in die Schule gegangen?,Ти сьогодні ходила до школи?,Warst du heute zur Schule gegangen?,0.08199404180049896,
267.0,Bist du hier beschäftigt?,Ти тут зайнята?,Bist du hier beschäftigt?,0.9140682816505432,
268.0,Bist du hier beschäftigt?,Ти тут зайнятий?,Bist du hier beschäftigt?,0.9140682816505432,
269.0,Bist du in Australien?,Ти в Австралії?,Bist du in Australien?,0.9062663912773132,
270.0,Bist du in Tom verliebt?,Ти закохана у Тома?,Hast du Tom geliebt?,-0.40198636054992676,
271.0,Bist du in Tom verliebt?,Ти закоханий у Тома?,Bist du in Tom verliebt?,0.9156519174575806,
272.0,Bist du Japaner?,Ти японець?,Bist du ein Japaner?,0.5245323181152344,
273.0,Bist du jemals in Afrika gewesen?,Ти колись був у Африці?,Warst du jemals in Afrika?,-0.3320257067680359,
274.0,Bist du jemals in Afrika gewesen?,Ти колись була в Африці?,Warst du jemals in Afrika?,-0.3320257067680359,
275.0,Bist du Marys Ehemann?,Ти чоловік Мері?,Bist du Marys Mann?,-0.37495923042297363,
276.0,Bist du mit deinen Hausaufgaben fertig?,Ти вже доробив домашнє завдання?,Hast du schon deine Hausaufgaben gemacht?,-0.1844286471605301,
277.0,Bist du mit den Hausaufgaben fertig?,Ти вже доробив домашнє завдання?,Hast du schon deine Hausaufgaben gemacht?,-0.2014514058828354,
278.0,Bist du nervös?,Ти нервуєш?,Bist du nervös?,0.9095565676689148,
279.0,Bist du nicht Toms Mutter?,Хіба ти не мама Тома?,Bist du nicht Toms Mutter?,0.9025615453720093,
280.0,Bist du nicht Tom?,Хіба ти не Том?,Du bist nicht Tom?,0.9103180170059204,
281.0,Bist du noch immer müde?,Ти все ще сонний?,Bist du immer noch schläfrig?,-0.38134533166885376,
282.0,Bist du noch verheiratet?,Ти все ще одружена?,Bist du noch verheiratet?,0.9238605499267578,
283.0,Bist du schlechter Laune?,В тебе поганий настрій?,Hast du eine schlechte Laune?,0.08316196501255035,
284.0,Bist du schon mal in Indien gewesen?,Ти колись бував у Індії?,Warst du jemals in Indien?,-0.8082323670387268,
285.0,Bist du sicher?,Ти впевнений?,Bist du sicher?,0.913338840007782,
286.0,Bist du stolz auf deinen Vater?,Ти пишаєшся своїм батьком?,Bist du stolz auf deinen Vater?,0.8969242572784424,
287.0,Bist du traurig?,Тобі сумно?,Bist du traurig?,0.91584312915802,
288.0,Bist du übelgelaunt?,В тебе поганий настрій?,Hast du eine schlechte Laune?,-0.9291963577270508,
289.0,Bist du über achtzehn?,Ти старше 18?,Bist du älter als 18?,-0.6063383221626282,
290.0,Bist du Übersetzer?,Ти перекладач?,Bist du Dolmetscher?,-0.7906227111816406,
291.0,Bist du Vegetarierin?,Ти вегетаріанка?,Bist du Vegetarierin?,0.9191000461578369,
292.0,Bist du verheiratet?,Ти заміжня?,Bist du verheiratet?,0.9266983866691589,
293.0,Bist du zehn Jahre alt?,Тобі десять років?,Bist du 10 Jahre alt?,0.15097008645534515,
294.0,Bist du zurückgekommen?,Ти повернувся?,Bist du wieder da?,-0.5473479628562927,
295.0,Bitte beantworten Sie diese Frage für mich.,"Будь-ласка, дай мені відповідь на це запитання.",Bitte gib mir die Antwort auf diese Frage.,-0.6489125490188599,
296.0,Bitte beeil dich!,"Будь ласка, поквапся!","Bitte, beeil dich!",0.9039661288261414,
297.0,Bitte bleiben Sie sitzen.,"Будь ласка, не вставайте.","Bitte, wach nicht auf.",-0.8922445774078369,
298.0,Bitte entferne den Kommentar.,"Видалiть коментар, будь-ласка.","Den Kommentar ausholen, bitte.",0.09574513137340546,
299.0,"Bitte entschuldigen Sie, aber ich glaube das ist mein Platz.","Перепрошую, але я думаю, що це моє місце.","Tut mir leid, aber ich glaube, das ist mein Platz.",0.04805867373943329,
300.0,Bitte entschuldigen Sie mein Zuspätkommen.,Перепрошую за запізнення.,Entschuldigen Sie die Verspätung.,-0.31877899169921875,
301.0,Bitte erlauben Sie mir zu gehen.,"Будь ласка, дозвольте мені піти.","Bitte, lassen Sie mich gehen.",-0.3804779648780823,
302.0,Bitte komm in drei Tagen.,"Будь ласка, прийди за три дні.","Bitte, kommen Sie in drei Tagen her.",0.1362694799900055,
303.0,"Bitte, mach dir keine Sorgen.","Не турбуйся, будь ласка.","Keine Sorge, bitte.",-0.4961177110671997,
304.0,Bitte nehmen Sie Platz!,"Сідайте, будь ласка!","Setzen Sie sich, bitte!",-0.7945661544799805,
305.0,Bitte nicht im Klassenzimmer rennen.,"Будь-ласка, не бігай у класі.",Bitte geh nicht in die Klasse.,-0.3897634744644165,
306.0,Bitte öffnen Sie ihre Tasche.,"Відкрийте сумку, будь ласка.","Öffnen Sie die Tasche, bitte.",0.33835405111312866,
307.0,Bitte öffnen Sie seine Tasche.,"Відкрийте сумку, будь ласка.","Öffnen Sie die Tasche, bitte.",0.24500924348831177,
308.0,Bitte rufen Sie ihn an.,"Зателефонуйте йому, будь ласка.",Rufen Sie ihn bitte an.,0.9282612800598145,
309.0,Bitte schön.,Нема за що.,Nichts.,-1.3713123798370361,
310.0,Bitte sende es mir per Fax.,"Відправ мені це факсом, будь ласка.",Senden Sie mir bitte das Fax.,0.22972875833511353,
311.0,Bitte singe ein Lied.,"Заспівай пісню, будь ласка.","Sing das Lied, bitte.",0.08273063600063324,
312.0,Bitte sprechen Sie langsamer.,"Будь ласка, розмовляйте повільніше.",Sprecht bitte langsamer.,0.07322679460048676,
313.0,Bitte stehen Sie nicht auf.,"Не вставайте, будь ласка.","Nicht aufstehen, bitte.",-0.18901441991329193,
314.0,Bitte steh nicht auf.,"Не вставай, будь ласка.","Steh nicht auf, bitte.",0.8972725868225098,
315.0,Bitte steht nicht auf.,"Не вставайте, будь ласка.","Nicht aufstehen, bitte.",0.27925288677215576,
316.0,"Bitte Tom, nicht auf mich zu warten!",Попроси Тома не чекати на мене.,"Frag Tom, ob er nicht auf mich wartet.",-0.2104165405035019,
317.0,"Bitte, trink etwas!",Випийте щось.,Trinken Sie etwas.,-0.5422886610031128,
318.0,Bitte übersetzen Sie diesen japanischen Text ins Französische.,"Перекладіть цей японський текст на французьку, будь ласка.","Übersetzen Sie den japanischen Text ins Französische, bitte.",0.46902334690093994,
319.0,Bitte verbinden Sie mich mit Herrn Smith.,"З'єднайте мене з паном Смітом, будь ласка.",Verbinden Sie mich bitte mit Mr. Smith.,0.45584118366241455,
320.0,Bitte weine nicht.,"Не плач, будь ласка.","Weine nicht, bitte.",0.9161330461502075,
321.0,Bitte zeigen Sie mir diese Fotos.,"Будьте ласкаві, покажіть мені ці фотографії.","Bitte, zeigen Sie mir diese Bilder.",-0.03962276875972748,
322.0,Bleibt Tom zum Abendessen?,Том залишиться на вечерю?,Wird Tom zum Abendessen bleiben?,0.4019703269004822,
323.0,Blinde glauben nicht an die Liebe auf den ersten Blick.,Сліпі не вірять у кохання з першого погляду.,Blinde glauben nicht an Liebe auf den ersten Blick.,0.8982645869255066,
324.0,"Bob aß die Schnecke, dann erbrach er sich.","Боб з'їв равлика, потім виригав.",Bob aß eine Muschel und holte sie aus.,-0.5419219136238098,
325.0,Bob hat mir geholfen.,Боб мені допоміг.,Bob hat mir geholfen.,0.9146221876144409,
326.0,Bob war sehr glücklich.,Боб був дуже щасливий.,Bob war sehr glücklich.,0.9074653387069702,
327.0,Boston ist langweilig.,Бостон нудний.,Boston ist langweilig.,0.923925518989563,
328.0,Boston verändert sich.,Бостон змінюється.,Boston verändert sich.,0.921698808670044,
329.0,Bratislava ist die Hauptstadt der Slowakei.,Братислава - столиця Словаччини.,Preßburg - Hauptstadt der Slowakei,0.32757705450057983,
330.0,Brauchen Sie einen Krankenwagen?,Вам потрібна швидка допомога?,Brauchen Sie Verstärkung?,-0.40482306480407715,
331.0,Brauchen Sie Geld?,Вам потрібні гроші?,Brauchen Sie Geld?,0.9174885749816895,
332.0,Brauchen wir einen Plan B?,"Ми потребуємо плану ""Б""?",Brauchen wir einen B-Plan?,0.8844431638717651,
333.0,Brauchen wir einen Plan B?,"Нам потрібний план ""Б""?",Brauchen wir einen B-Plan?,0.8844431638717651,
334.0,Brauchst du meine Hilfe noch?,Тобі все ще потрібна моя допомога?,Brauchst du noch meine Hilfe?,0.902174711227417,
335.0,Brauchst du unsere Hilfe?,Тобі потрібна наша допомога?,Brauchst du unsere Hilfe?,0.9080280065536499,
336.0,Brauchst du viel Geld?,Тобі потрібно багато грошей?,Brauchst du viel Geld?,0.9076194167137146,
337.0,Braucht ihr einen Krankenwagen?,Вам потрібна швидка?,Brauchen Sie einen Krankenwagen?,0.2208901047706604,
338.0,Braucht ihr einen Krankenwagen?,Вам потрібна швидка допомога?,Brauchen Sie Verstärkung?,-0.8171912431716919,
339.0,Brian hat einen Lippenstift für Kate gekauft.,Брайан купив для Кейт губну помаду.,Brian hat für Kate eine Lippenstifte gekauft.,0.8068421483039856,
340.0,Brich niemals dein Versprechen!,Ніколи не порушуй своєї обіцянки.,Gib dein Versprechen nie auf.,0.00219784677028656,
341.0,Bringen Sie mir etwas kaltes Wasser.,Принесіть мені холодної води.,Bringt mir kaltes Wasser.,-0.15334738790988922,
342.0,Bring es mir.,Принеси його мені.,Bring ihn zu mir.,-0.6387364268302917,
343.0,"Bring mir etwas Wasser, aber schnell!","Принеси мені води, швиденько.",Hol mir schnell das Wasser.,-0.5789568424224854,
344.0,Bronislaw ist 18 Jahre alt.,Броніславу вісімнадцять років.,Bronnigus war achtzehn Jahre alt.,-0.5343684554100037,
345.0,"Brustschwimmen kann ich, aber Rückenschwimmen nicht.","Я можу плисти на животі, але не на спині.","Ich kann auf dem Bauch schwimmen, aber nicht auf dem Rücken.",-0.012521922588348389,
346.0,Bulgarien ist ein wunderschönes Land.,Болгарія - прекрасна країна.,Bulgarien ist ein wunderschönes Land.,0.9184083342552185,
347.0,Butter macht man aus Milch.,Масло роблять з молока.,Olivenöl wird aus Milch hergestellt.,-0.9409656524658203,
348.0,Butter wird aus Milch gemacht.,Масло роблять з молока.,Olivenöl wird aus Milch hergestellt.,-0.509793221950531,
349.0,Carol hat Kopfweh.,У Керол болить голова.,Carol hat Kopfschmerzen.,0.2667335271835327,
350.0,Caty ist lesbisch.,Кеті лесбіянка.,Cathy ist eine Lesbierin.,-0.8036665916442871,
351.0,Champagner wird aus Frankreich importiert.,Шампанське імпортують із Франції.,Champagner wird aus Frankreich importiert.,0.9112916588783264,
352.0,China ist das größste Land Asiens.,Китай - найбільша країна в Азії.,China ist das größte Land in Asien.,0.3603697419166565,
353.0,China ist das größte Land in Asien.,Китай - найбільша країна в Азії.,China ist das größte Land in Asien.,0.9141300916671753,
354.0,China ist ein großes Land.,Китай - велика країна.,China ist ein großes Land.,0.9120115637779236,
355.0,China ist größer als Japan.,"Китай більший, ніж Японія.",China ist größer als Japan.,0.9066533446311951,
356.0,Christiano Ronaldo ist ein Fußballspieler.,Кріштіану Роналду - футболіст.,Krystyna Ronaldo ist Footballspieler.,-0.78192138671875,
357.0,Christoph Kolumbus entdeckte Amerika im Jahre 1492.,Христофор Колумб відкрив Америку в 1492 році.,Christoph Kolumbus entdeckte 1492 Amerika.,0.362271785736084,
358.0,"Christoph Kolumbus fand einst den Heiligen Gral, warf ihn aber weg, weil ihm die Farbe nicht gefiel.","Христофор Колумб якось знайшов Святий Грааль, але викинув його, бо йому не сподобався колір.","Christoph Kolumbus fand den heiligen Gral, warf ihn weg, weil ihm die Farbe nicht gefiel.",0.6137760281562805,
359.0,Computer machen die Leute dumm.,Комп'ютери роблять із людей ідіотів.,Computer machen Idioten.,-0.7995116114616394,
360.0,Computer machen Menschen dumm.,Комп'ютери роблять із людей ідіотів.,Computer machen Idioten.,-0.6823183298110962,
361.0,Coolidge hat die Wahl im Jahre 1924 spielend gewonnen.,Кулідж легко переміг на виборах у 1924 році.,Der Kugelhagel gewann 1924 bei seinen Wahlen leicht.,-0.38126999139785767,
362.0,Cristiano Ronaldo ist ein Fußballspieler.,Кріштіану Роналду - футболіст.,Krystyna Ronaldo ist Footballspieler.,-0.6910474300384521,
363.0,Cristiano Ronaldo ist Fußballer.,Кріштіану Роналду - футболіст.,Krystyna Ronaldo ist Footballspieler.,-0.4598764181137085,
364.0,"Da du gekocht hast, kümmere ich mich um den Abwasch.","Оскільки ти готувала, я помию посуд.","Da du gekocht hast, putze ich das Geschirr.",-0.1876695305109024,
365.0,Da fehlt eine Seite.,Не вистачає сторінки.,Die Seite ist unvollständig.,-0.9759255647659302,
366.0,Dafür bin ich zu alt.,Я для цього занадто стара.,Ich bin zu alt dafür.,0.9134277701377869,
367.0,Da hängt ein Schatten über mir.,Наді мною нависла тінь.,Mir stand ein Schatten bevor.,-0.6953209638595581,
368.0,Da ist eine Katze auf dem Stuhl.,На стільці є кіт.,Es gibt eine Katze auf dem Stuhl.,0.3800903558731079,
369.0,Da ist eine weiße Taube auf dem Dach.,На даху сидить білий голуб.,Auf dem Dach sitzt eine weiße Taube.,0.4287884831428528,
370.0,Da ist ein Hund an der Tür.,Біля дверей стоїть пес.,An der Tür steht ein Hund.,0.38368600606918335,
371.0,Damals waren wir jünger.,Тоді ми були молодші.,Damals waren wir jünger.,0.9106051921844482,
372.0,Damals war Mary Toms Freundin.,Мері тоді була дівчиною Тома.,Mary war damals Toms Mädchen.,-0.41287147998809814,
373.0,Damals war Tom mein einziger Freund.,На той час Том був моїм єдиним другом.,Tom war damals mein einziger Freund.,0.9073281288146973,
374.0,Damit hat Tom nicht gerechnet.,Том цього не очікував.,Tom hat das nicht erwartet.,-0.5320494771003723,
375.0,Daniela hat mich zu Hause angerufen.,Даніела зателефонувала мені додому.,Daniela rief mich an.,-1.023158073425293,
376.0,Dank dir habe ich meinen Appetit verloren.,Через тебе я втратив апетит.,Wegen dir habe ich keinen Appetit mehr.,-0.3537559509277344,
377.0,„Danke!“ – „Bitte!“,"Дякую. - ""Прошу"".",Danke.,-0.876530647277832,
378.0,"Danke, das ist alles.","Дякую, це все.","Danke, das war's.",-0.6430420279502869,
379.0,"Danke, dass Sie mich eingeladen haben.","Дякую, що запросили мене!","Vielen Dank, daß Ihr mich eingeladen habt!",-0.04994557797908783,
380.0,Danke für das Kompliment!,Дякую за комплімент.,Danke für das Kompliment.,0.7911187410354614,
381.0,Danke für das wunderbare Essen.,Дякую за чудову їжу.,Vielen Dank für das wunderschöne Essen.,0.07177047431468964,
382.0,Danke für deine Antwort.,Дякую за відповідь.,Danke für die Antwort.,-0.04256461560726166,
383.0,Danke für deine Erklärung.,Дякую за пояснення.,Danke für die Erklärung.,0.2682836651802063,
