Unnamed: 0,de,uk,TRANSLATION,BLEURT_Score,UK
384.0,Danke für deine freundlichen Worte!,Дякую за добрі слова.,Vielen Dank für die freundlichen Worte.,0.06839419901371002,
385.0,Danke für deine Geduld!,Дякую тобі за терпіння.,Vielen Dank für Ihre Geduld.,-0.5377511382102966,
386.0,Danke für dein Geschenk.,Дякую тобі за подарунок.,Danke für das Geschenk.,0.26652082800865173,
387.0,Danke für die Blumen!,Дякую за квіти.,Danke für die Blumen.,0.7841922044754028,
388.0,"Danke für die Hilfe. ""Keine Ursache.""",«Дякую за допомогу.» «Нема за що.»,„ Vielen Dank für die Hilfe. “,-0.4008758068084717,
389.0,Danke für die Pizza!,Дякуємо за піцу.,Danke für die Pizza.,0.774344801902771,
390.0,Danke für die Praline. Sie war köstlich.,Дякую за шоколад. Він був смачним.,"Danke für die Schokolade, er war köstlich.",0.2425801157951355,
391.0,Danke für Ihre freundlichen Worte!,Дякую за добрі слова.,Vielen Dank für die freundlichen Worte.,-0.05106540024280548,
392.0,Danke für Ihre Geduld.,Дякуємо вам за терпіння.,Vielen Dank für Ihre Geduld.,0.4290667176246643,
393.0,Danke fürs Schreiben.,"Дякую за те, що написали.","Danke für das, was ich geschrieben habe.",-0.4333089590072632,
394.0,„Danke!“ – „Keine Ursache!“,"Дякую. - ""Прошу"".",Danke.,-0.9224033355712891,
395.0,„Danke!“ – „Keine Ursache!“,"Спасибі. - ""Нема за що"".","- ""Nichts für was.""",-1.3082780838012695,
396.0,„Danke!“ – „Nichts zu danken!“,"Спасибі. - ""Нема за що"".","- ""Nichts für was.""",-1.0911720991134644,
397.0,Danke schön.,Щиро дякую!,Vielen Dank!,-1.0676984786987305,
398.0,Danke trotzdem.,"У будь якому разі, дякую.","Auf jeden Fall, danke.",-0.9893816709518433,
399.0,Danke!,Дякуємо!,Danke!,0.9173004627227783,
400.0,Danke!,Дякую!,Danke!,0.9173004627227783,
401.0,Danke.,Дякую!,Danke!,0.754255473613739,
402.0,Danke.,Дякую.,Danke.,0.8989375233650208,
403.0,Dank seiner Mutter wurde er berühmt.,Він став відомим завдяки матері.,Er wurde durch seine Mutter berühmt.,0.16685448586940765,
404.0,Dann eilte sie nach Hause.,А потім вона поквапилася додому.,Dann beeilte sie sich nach Hause.,0.07257793843746185,
405.0,Dann fangen wir an.,"Ну, тоді розпочнімо.",Dann fangen wir an.,0.9221151471138,
406.0,Dann haben wir ein Problem...,Тоді ми маємо проблему...,Dann haben wir ein Problem.,0.8571841716766357,
407.0,Dann komme ich später wieder.,Тоді я повернуся пізніше.,Dann komme ich später wieder.,0.9226971864700317,
408.0,Dann komme ich später wieder.,Тоді я прийду пізніше.,Dann komme ich später.,0.22490793466567993,
409.0,Dann legte er sich auf das gleiche Bett.,Він тоді лежав на тому ж ліжку.,Er lag auf demselben Bett.,-0.6534556150436401,
410.0,Dann zögern Sie nicht.,Тож не вагайтеся.,Man sollte also nicht zögern.,-0.049987658858299255,
411.0,Danzig ist die größte Stadt im Norden Polens.,Гданськ - найбільше місто на півночі Польщі.,Dansk ist die größte Stadt im Norden Polens.,0.18205046653747559,
412.0,Darf ich deinen Kuli benutzen?,Можна скористатися твоєю ручкою?,Darf ich deinen Stift benutzen?,0.38716810941696167,
413.0,Darf ich den Fernseher ausschalten?,Можна мені вимкнути телевізор?,Darf ich den Fernseher ausschalten?,0.9123495817184448,
414.0,Darf ich den Fernseher ausschalten?,Можна я вимкну телевізор?,Darf ich den Fernseher ausschalten?,0.9123495817184448,
415.0,Darf ich dich Tom nennen?,Можна я буду називати тебе Томом?,Darf ich dich Tom nennen?,0.9197102785110474,
416.0,Darf ich dich unterbrechen?,Можна тебе перебити?,Darf ich dich umlegen?,-0.12290515005588531,
417.0,Darf ich dir jetzt etwas zu trinken anbieten?,Я можу тобі запропонувати щось зараз випити?,Kann ich dir jetzt einen Drink anbieten?,-0.2859485149383545,
418.0,Darf ich es noch einmal machen?,Можу я це зробити ще раз?,Kann ich das nochmal machen?,0.09801118075847626,
419.0,Darf ich etwas sagen?,Можна мені щось сказати?,Kann ich was sagen?,-0.11479465663433075,
420.0,Darf ich euer Telefon benutzen?,Можна мені скористатися вашим телефоном?,Darf ich Ihr Telefon benutzen?,0.34453558921813965,
421.0,"Darf ich fragen, wie alt du bist?","Можна мені запитати, скільки тобі років?","Darf ich fragen, wie alt du bist?",0.9078799486160278,
422.0,"Darf ich fragen, wie alt du bist?","Можна поцікавитися, скільки тобі років?","Darf ich fragen, wie alt du bist?",0.9078799486160278,
423.0,"Darf ich fragen, wie alt Sie sind?","Можу я запитати, скільки вам років?","Darf ich fragen, wie alt sind Sie?",0.9094469547271729,
424.0,Darf ich hier rauchen?,Чи можу я тут курити?,Kann ich hier rauchen?,0.5237956047058105,
425.0,"Darf ich Ihnen helfen, gnädige Frau?","Чи можу вам чимось допомогти, пані?","Kann ich Ihnen helfen, Ma'am?",-0.23935677111148834,
426.0,Darf ich mal deinen Bart anfassen?,Можна мені доторктнутися до твоєї бороди?,Darf ich deinen Bart berühren?,-0.1561657041311264,
427.0,Darf ich mich neben euch setzen?,Можна сісти поруч із вами?,Darf ich mich neben Sie setzen?,0.34046369791030884,
428.0,Darf ich mich vorstellen? Mein Name ist Tom Frisch.,Можна представитися? Мене звуть Том Фріш.,Mein Name ist Tom Freesh.,-0.7948616147041321,
429.0,Darf ich mich vorstellen?,Можна мені представитися?,Darf ich mich vorstellen?,0.9193905591964722,
430.0,Darf ich mit ihr sprechen?,Чи можу я поговорити з нею?,Kann ich mit ihr reden?,-0.493205726146698,
431.0,Darf ich nach Hause gehen?,Можна мені піти додому?,Darf ich nach Hause?,0.27039676904678345,
432.0,Darf ich Sie unterbrechen?,Можна вас перебити?,Kann ich Sie unterbrechen?,0.37918418645858765,
433.0,Darum musst du dir keine Sorgen machen.,Тобі не треба хвилюватися за це.,Du brauchst dir keine Sorgen zu machen.,-0.17348052561283112,
434.0,Darum sind wir hier.,Ось чому ми тут.,Deswegen sind wir hier.,-0.4509861469268799,
435.0,Darum werde ich mich morgen kümmern.,Я займуся цим завтра.,Ich mache das morgen.,-0.6916009187698364,
436.0,Darwin hat alles verändert.,Дарвін все змінив.,Darwin hat alles verändert.,0.9172638654708862,
437.0,"Das Adjektiv endet auf ""a"".","Прикментник закінчується на ""а"".","Das Zeichen endet mit ""a"".",-0.1963866800069809,
438.0,Das also ist Tatoeba.,"Отже, це Татоеба.",Das ist also Dadsba.,-0.16884081065654755,
439.0,Das ängstigt mich überhaupt nicht.,Я ані трохи цього не боюся.,Ich habe keine Angst davor.,-0.7241430878639221,
440.0,Das Apartment war mit Möbeln im viktorianischen Stil eingerichtet.,Квартира була мебльована у вікторіанському стилі.,Die Wohnung war im viktorianischen Stil metabolisiert.,-0.6389133930206299,
441.0,Das Auto blieb im Schlamm stecken.,Машина застрягла в багні.,Der Wagen steckt im Schlamm fest.,-0.3906640410423279,
442.0,Das Auto fuhr gegen einen Telegrafenmast.,Автівка зіткнулась із телеграфним стовпом.,Mit der Telegrafensäule kam es zu Unfällen.,-0.20298446714878082,
443.0,Das Auto ist gelb.,Машина жовта.,Die Maschine ist gelb.,-0.1795068234205246,
444.0,Das Auto ist in der Garage.,Машина в гаражі.,Der Wagen ist in der Garage.,-0.1939743310213089,
445.0,Das Auto springt nicht an.,Автомобіль не заводиться.,Das Auto läuft nicht.,-0.5436847805976868,
446.0,Das Auto stieß mit dem LKW zusammen.,Автомобіль врізався у вантажівку.,Das Auto ist in den Truck gefahren.,-0.8964011669158936,
447.0,Das Baby läuft noch nicht.,Дитина ще не ходить.,Das Kind geht noch nicht.,-0.43103063106536865,
448.0,Das Baby schläft gerade.,Немовля спить.,Das Baby schläft.,0.039050787687301636,
449.0,Das Baby schlief in der Wiege ein.,Дитина заснула в колисці.,Das Baby schlief in der Wiege ein.,0.9177381992340088,
450.0,Das Baby sucht seine Mutter.,Дитя шукає маму.,Das Baby sucht Mutter.,0.08791254460811615,
451.0,Das Baseballspiel endete unentschieden.,Бейсбольний матч закінчився з нічийним результатом.,Das Baseballspiel endete mit einem nächtlichen Ergebnis.,-0.20918665826320648,
452.0,Das beste Buch über das Leben ist das Leben selbst.,Найкраща книжка про життя - власне життя.,Das beste Buch über das Leben ist sein eigenes.,0.4571877121925354,
453.0,Das Bett kostet 120 Euro!,Ліжко коштує 120 євро!,Das Bett kostet 120 Euro!,0.9202653169631958,
454.0,Das beweist meine Theorie.,Це доводить мою теорію.,Das beweist meine Theorie.,0.9162850975990295,
455.0,Das Bier ist sehr kalt.,Пиво дуже холодне.,Das Bier ist sehr kalt.,0.9151483774185181,
456.0,Das Bild erinnerte mich an Schottland.,Картина нагадувала менi Шотландiю.,Das Bild erinnerte mich an Schottland.,0.9174720048904419,
457.0,"Das brauchst du mir nicht zu sagen, du Idiot.","Можеш не говорити мені цього, ідіоте.","Du kannst mir das nicht sagen, du Idiot.",0.017111673951148987,
458.0,Das Brot ist frisch.,Хліб свіжий.,Das Brot ist frisch.,0.9207243919372559,
459.0,Das Buch enthält viele Abbildungen.,Ця книжка має багато малюнків.,Das Buch hat viele Bilder.,-0.8740345239639282,
460.0,"Das Bücherlesen hörte auf, das Privileg einer Minderheit zu sein.",Читання книжок більше не є привілеєм меншості.,Das Lesen von Büchern ist nicht mehr das Vorrecht einer Minderheit.,-0.09857963025569916,
461.0,Das Buch handelt von Sternen.,Ця книжка про зірки.,Dieses Buch ist ein Buch über die Sterne.,-0.40331363677978516,
462.0,Das Buch hat mir gefallen.,Мені сподобалася ця книжка.,Das Buch hat mir sehr gut gefallen.,0.7704563736915588,
463.0,Das Buch ist alt.,Книжка стара.,Das Buch ist alt.,0.9229940176010132,
464.0,Das Buch ist geeignet für deine Bedürfnisse.,Ця книга відповідає твоїм потребам.,Dieses Buch entspricht deinen Bedürfnissen.,-0.4061328172683716,
465.0,Das Buch ist geeignet für Ihre Bedürfnisse.,Ця книга не відповідає Вашим потребам.,Dieses Buch stimmt nicht mit Ihren Bedürfnissen überein.,-0.2675681710243225,
466.0,Das Buch ist gelb.,Книжка жовта.,Das Buch ist gelb.,0.9238466024398804,
467.0,Das Buch ist neu.,Ця книжка нова.,Das Buch ist neu.,0.9276739358901978,
468.0,Das Buch ist orange.,Книжка помаранчева.,Das Buch ist orange.,0.9299671649932861,
469.0,Das Buch ist weiß.,Книга біла.,Das Buch ist weiß.,0.9167959094047546,
470.0,Das Ei ist ein universelles Symbol des Lebens und der Wiedergeburt.,Яйце - це універсальний символ життя та відродження.,Das Ei ist ein universelles Symbol für Leben und Wiedergeburt.,0.7100929021835327,
471.0,Das Eis ist geschmolzen.,Крига розтанула.,Die Krise ist gesunken.,-0.5967645645141602,
472.0,Das Eis schmolz.,Крига розтанула.,Die Krise ist gesunken.,-0.9413015842437744,
473.0,Das Ende ist nahe.,Кінець вже близько.,Das Ende ist nahe.,0.9268713593482971,
474.0,Das ergibt keinen Sinn.,Це не має сенсу.,Das ergibt keinen Sinn.,0.915851354598999,
475.0,Das erraten Sie nie!,Цього ти ніколи не вгадаєш!,Das wirst du nie vergessen!,-0.552954912185669,
476.0,Das erwies sich als richtig.,Це виявилося правдою.,Es erwies sich als wahr.,-0.23409147560596466,
477.0,"Das Esperanto-Alphabet enthält achtundzwanzig Buchstaben: a, b, c, ĉ, d, e, f, g, ĝ, h, ĥ, i, j, ĵ, k, l, m, n, o, p, r, s, ŝ, t, u, ŭ, v, z.","Алфавіт есперанто має 28 літер: a, b, c, ĉ, d, e, f, g, ĝ, h, ĥ, i, j, ĵ, k, l, m, n, o, p, r, s, ŝ, t, u, ŭ, v, z.","Esperanto hat 28 Buchstaben: a, b, c, c, c, d, e, f, g, 6, h, i, j, dig, k,l, l,m,m,m, n, p, r, s, able, et, u, c.",-0.14998023211956024,
478.0,Das esse ich nicht.,Я цього не буду їсти.,Das werde ich nicht essen.,-0.262378454208374,
479.0,Das Experiment scheiterte.,Експеримент закінчився невдало.,Versuch fehlgeschlagen.,-1.0255272388458252,
480.0,Das Fahrrad gehört mir.,Цей велосипед належить мені.,Dieses Fahrrad gehört mir.,0.10704471170902252,
481.0,Das Fahrrad ist meins.,Цей велосипед належить мені.,Dieses Fahrrad gehört mir.,-0.6679415702819824,
482.0,Das Feld ist mit Schnee bedeckt.,Поле вкрите снігом.,Das Feld ist mit Schnee bedeckt.,0.9114145040512085,
483.0,Das Fenster ist offen.,Вікно відкрите.,Das Fenster ist geöffnet.,-0.3077939748764038,
484.0,Das Fenster öffnete sich.,Вікно відчинилося.,Das Fenster ist geöffnet.,-0.5011730790138245,
485.0,Das Fernsehen zerstört das Familienleben.,Телевізор руйнує родинне життя.,Fernsehen zerstört das Familienleben,0.8709050416946411,
486.0,Das Fest ist zu Ende.,Вечірка закінчилася.,Die Party ist vorbei.,-0.9429295063018799,
487.0,Das Fest ist zu Ende.,Вечірка скінчилася.,Die Party ist zu Ende.,0.07764706015586853,
488.0,Das Festival war alles andere als öde.,Фестиваль був далеко не нудним.,Das Festival war alles andere als langweilig.,0.2521671652793884,
489.0,Das Fleisch ist roh.,М'ясо сире.,Das Fleisch ist rohes Fleisch.,0.6291327476501465,
490.0,Das Fleisch ist zäh.,М'ясо жорстке.,Das Fleisch ist hart.,0.022739842534065247,
491.0,Das Fleisch schmeckt schlecht.,М'ясо погано смакує.,Fleisch schmeckt nicht gut.,0.6253237724304199,
492.0,Das Flugzeug flog über den Wolken.,Літак летів над хмарами.,Das Flugzeug flog über die Wolken.,0.8213220238685608,
493.0,Das Flugzeug ist abgestürzt.,Літак розбився.,Das Flugzeug ist kaputt.,0.08318527042865753,
494.0,Das Flugzeug wird in einer Stunde abheben.,Літак злетить за годину.,Das Flugzeug fliegt in einer Stunde ab.,0.22567681968212128,
495.0,Das frisch getraute Paar ging Hand in Hand.,"Молоді йшли, узявшись за руки.",Die jungen Leute gingen und hielten sich an die Hand.,-0.7489060163497925,
496.0,Das Frühstück ist bereitet.,Сніданок готовий.,Frühstück ist fertig.,-0.391804575920105,
497.0,Das Frühstück war sehr gut.,Сніданок був дуже смачний.,Das Frühstück war köstlich.,-0.22960425913333893,
498.0,Das funktioniert nie.,Це ніколи не запрацює.,Das wird nie funktionieren.,0.4312019944190979,
499.0,Das funktioniert nie.,Це ніколи не спрацює.,Das wird nie funktionieren.,0.4312019944190979,
500.0,Das Gebäude hat ein russischer Architekt gebaut.,Будинок побудовано російським архитектором.,Das Gebäude wurde von einem russischen Architekten gebaut.,0.2761337161064148,
501.0,Das Gebäude wurde von einem russischen Architekten erbaut.,Будинок побудовано російським архитектором.,Das Gebäude wurde von einem russischen Architekten gebaut.,0.7637075185775757,
502.0,Das Gegenteil von unpraktisch ist praktisch.,Антонім до непрактичності - практичність.,Antonyme ist unpraktisch.,-0.4535069465637207,
503.0,Das gehört ihm.,Це його.,Es gehört ihm.,0.2812453508377075,
504.0,Das geht dich nichts an.,Це не твоя справа.,Das geht dich nichts an.,0.9227214455604553,
505.0,Das geht vorbei.,Це піде у минуле.,Das wird der Vergangenheit angehören.,-0.4435487985610962,
506.0,Das gesamteuropäische Sabantuy 2014 findet am 7. Juni in Riga statt. Die jährliche Organisation dieses nationalen tatarischen Feiertags in den Kulturhauptstädten des Kontinents wird zu einer guten Tradition.,Європейський Сабантуй 2014 року проходить 7 червня в Ризі. Щорічна організація цих татарських національних свят у культурних столицях континенту стає доброю традицією.,"Juni 2014 in Riga stattfand, ist die jährliche Organisation dieser taaristischen Feste in den kulturellen Hauptstädten des Kontinents eine gute Tradition.",-0.09228868782520294,
507.0,Das Geschäft ist gerade gegenüber von meinem Haus.,Крамниця знаходиться просто навпроти мого будинку.,Der Laden ist direkt vor meinem Haus.,-0.5294466018676758,
508.0,Das Gesetz ist für alle gleich.,Закон один для всіх.,Das Gesetz ist e i n Gesetz für alle.,0.02884410321712494,
509.0,Das Gesicht ist der Spiegel der Seele.,Обличчя - дзеркало душі.,Gesicht ist ein Spiegel der Seele.,0.8955905437469482,
510.0,Das glaube ich nicht.,Я в це не вірю.,Das glaube ich nicht.,0.9272677302360535,
511.0,Das glaube ich.,"Думаю, так.",Ich denke schon.,-0.505534291267395,
512.0,"Das Glück liegt nicht darin, viele Dinge zu besitzen.","Щастя не в тому, щоб володіти багатьма речами.","Das Glück besteht nicht darin, viele Dinge zu besitzen.",0.4811480641365051,
513.0,Das habe ich als Kind immer gemacht.,Я так робив у дитинстві.,Das habe ich schon als Kind getan.,-0.23171637952327728,
514.0,Das habe ich von dir gelernt.,Я навчилася цього у тебе.,Ich habe das bei dir gelernt.,0.716555118560791,
515.0,Das habe ich wirklich nicht von dir erwartet.,Я такого від тебе дійсно не очікувала.,Das habe ich von dir wirklich nicht erwartet.,0.9038848876953125,
516.0,Das hast du absichtlich getan!,Ти це спеціально зробив!,Du hast es absichtlich getan!,0.6581411957740784,
517.0,Das hat mich gerettet.,Це мене врятувало.,Das hat mich gerettet.,0.9252334833145142,
518.0,Das hat nichts mit euch zu tun.,Це не має до вас жодного відношення.,Das hat nichts mit dir zu tun.,0.27915629744529724,
519.0,Das hat nichts mit euch zu tun.,Це не має до вас жодного стосунку.,Das hat nichts mit Ihnen zu tun.,0.3081408143043518,
520.0,Das hat nichts mit Ihnen zu tun.,Це не має до вас жодного відношення.,Das hat nichts mit dir zu tun.,0.11465851962566376,
521.0,Das hat niemand von uns vor.,Ніхто з нас не планує це зробити.,"Niemand von uns hat vor, das zu tun.",0.6772956848144531,
522.0,Das hätte ich beinahe vergessen.,Я мало не забув цього зробити.,Ich hätte es fast vergessen.,-0.14268054068088531,
523.0,Das hat Tom gar nicht gesagt.,Том цього не казав.,Tom hat das nicht gesagt.,0.2784287929534912,
524.0,Das Haus brennt.,Дім горить!,Das Haus brennt!,0.8613470792770386,
525.0,"Das Haus ist komplett abgebrannt, bevor die Feuerwehr kam.","До того часу, як приїхала пожежна бригада, весь будинок згорів.","Als die Feuerwehr eintraf, brannte das ganze Haus nieder.",-0.26745593547821045,
526.0,Das Haus ist rot.,Будинок червоний.,Das Haus ist rot.,0.925959587097168,
527.0,Das Haus war leer bis auf eine Katze.,"Будинок був пустим, за винятком кота.","Das Haus war leer, außer Katzen.",0.13357482850551605,
528.0,Das Haus wurde durch Feuer zerstört.,Будинок був зруйнований вогнем.,Das Haus wurde zerstört.,-0.05523626506328583,
529.0,Das Heidentum ist viel näher an der Natur als das Christentum.,"Язичництво набагато ближче до природи, ніж християнство.",Das Heidentum ist der Natur viel näher als das Christentum.,0.7212411165237427,
530.0,Das hier ergibt keinen Sinn.,Це без сенсу.,Das ergibt keinen Sinn.,0.46506577730178833,
531.0,Das hier ergibt keinen Sinn.,Це не має сенсу.,Das ergibt keinen Sinn.,0.46506577730178833,
532.0,"Das hier ist haargenau das Buch, nach dem ich suchte.","Це саме та книга, яку я шукав.","Das ist genau das Buch, nach dem ich gesucht habe.",0.037157997488975525,
533.0,Das hier ist mein Bruder Tom.,Це мій брат Том.,Das ist mein Bruder Tom.,0.22805452346801758,
534.0,Das hoffe ich.,"Сподіваюся, що так.",Ich hoffe es.,0.46339017152786255,
535.0,Das hoffe ich.,Я на це сподіваюся.,Das hoffe ich.,0.9133940935134888,
536.0,Das interessiert mich nicht.,Це мене не цікавить.,Das interessiert mich nicht.,0.9124793410301208,
537.0,Das ist alles deine Schuld!,Це все твоя вина.,Es ist alles deine Schuld.,0.35835790634155273,
538.0,Das ist alles deine Schuld!,Це все твоя провина.,Es ist alles deine Schuld.,0.35835790634155273,
539.0,"Das ist alles, was ich versprechen kann.","Це все, що я можу пообіцяти.","Das ist alles, was ich versprechen kann.",0.9297170042991638,
540.0,Das ist alles?,Це все?,Ist das alles?,0.9197683334350586,
541.0,Das ist auch wahr.,Це також вірно.,Auch das ist wahr.,0.9228981733322144,
542.0,Das ist auf meinem Mist gewachsen.,Це була моя ідея.,Das war meine Idee.,-0.8009687066078186,
543.0,Das ist bequem.,Зручно.,Das ist bequem.,0.9348123073577881,
544.0,"Das ist besser, oder?","Так краще, так?","So ist es besser, oder?",0.34621721506118774,
545.0,Das ist besser.,Так краще.,So ist es besser.,0.0698535144329071,
546.0,Das ist besser.,Так ліпше.,So ist es besser.,0.0698535144329071,
547.0,Das ist Copacabana!,Це Копакабана!,Das ist Copacabana!,0.9393876791000366,
548.0,"Das ist das Dümmste, was ich je gesagt habe.","Це найбільша нісенітниця, яку я коли-небудь казав.","Das ist der größte Unsinn, den ich je gesagt habe.",-0.20147915184497833,
549.0,Das ist das Interessanteste.,Це саме цікаве.,Das ist interessant.,0.18456390500068665,
550.0,Das ist das letzte Mal.,Це в останній раз.,Das ist das letzte Mal.,0.9194801449775696,
551.0,Das ist dein Buch.,Це твоя книжка.,Das ist dein Buch.,0.922910749912262,
552.0,Das ist deine Aufgabe.,Це твоя робота.,Das ist dein Job.,-0.46490657329559326,
553.0,Das ist dein Hauptproblem.,Це твоя головна проблема.,Das ist dein größtes Problem.,-0.06814484298229218,
554.0,"Das ist dein Hut, oder?","Це твій капелюх, так?","Das ist dein Hut, oder?",0.8969391584396362,
555.0,Das ist dein Platz.,Це твоє місце.,Das ist dein Platz.,0.9239312410354614,
556.0,Das ist deins.,Це твій.,Das gehört dir.,-0.8122502565383911,
557.0,"Das ist der Grund, weshalb ich herkam.","Це і є причина, чому я сюди прийшов.","Das ist der Grund, warum ich hierher gekommen bin.",-0.05571766197681427,
558.0,Das ist der heißeste Sommer seit 50 Jahren.,Це найспекотніше літо за п’ятдесят років.,Es ist der heißeste Sommer in 50 Jahren.,0.4166356325149536,
559.0,Das ist der letzte Zug.,Це останній потяг.,Das ist der letzte Zug.,0.9133179187774658,
560.0,"Das ist der Mann, den ich gut kenne.","Це людина, яку я добре знаю.","Das ist der Mann, den ich gut kenne.",0.9090826511383057,
561.0,Das ist der Rechner meiner Mutter.,Це комп'ютер моєї мами.,Das ist der Computer meiner Mutter.,-0.020939096808433533,
562.0,Das ist der wichtigste Grund.,Це найважливіша причина.,Das ist der wichtigste Grund.,0.9134531021118164,
563.0,Das ist die Ansicht eines Dilettanten.,Це думка дилетанта.,Das ist die Idee des Dilettants.,-0.146972194314003,
564.0,Das ist die einzige Möglichkeit.,Це єдина можливість.,Das ist die einzige Möglichkeit.,0.9116895198822021,
565.0,Das ist die erste Reise meines Lebens.,Це перша подорож у моєму житті.,Das ist die erste Reise meines Lebens.,0.9035024642944336,
566.0,Das ist die Kamera meiner Schwester.,Це фотоапарат моєї сестри.,Das ist die Kamera meiner Schwester.,0.9146490097045898,
567.0,"Das ist doch nicht so einfach, wie ich dachte.","Це не так просто, як мені здавалося.","Es ist nicht so einfach, wie ich dachte.",0.4971200227737427,
568.0,Das ist durchaus möglich.,Це цілком можливо.,Das ist absolut möglich.,-0.16610048711299896,
569.0,Das ist ein Adverb.,Це прислівник.,Das ist ein Adverb.,0.9176392555236816,
570.0,Das ist ein altes Gesetz.,Це стародавній закон.,Das ist ein altes Gesetz.,0.9172426462173462,
