Unnamed: 0,de,uk,TRANSLATION,BLEURT_Score,UK
791.0,Das Mädchen singt und tanzt und dann lächelt es mich an.,"Дівчинка співає й танцює, а потім посміхається мені.",Das Mädchen singt und tanzt und lächelt dann zu mir.,0.14995907247066498,
792.0,Das Mädchen singt und tanzt und dann lacht es mich an.,"Дівчинка співає й танцює, а потім посміхається мені.",Das Mädchen singt und tanzt und lächelt dann zu mir.,0.10960517823696136,
793.0,Das Mädchen wusch sich die Haare.,Дівчина помила волосся.,Sie hat sich die Haare gewaschen.,-0.2519952058792114,
794.0,Das menschliche Gehirn wiegt ungefähr drei Pfund.,Мозок людини важить близько трьох фунтів.,Das menschliche Gehirn wiegt etwa drei Pfund.,0.3483823537826538,
795.0,Das möchte ich mit eigenen Augen sehen.,Я хочу побачити це на власні очі.,Ich möchte es mit eigenen Augen sehen.,0.8874506950378418,
796.0,Das Murmeltier ist unsterblich.,Байбак безсмертний.,Der Bastard ist unsterblich.,-0.3856067657470703,
797.0,Das Museum ist nun geschlossen.,Музей зараз закритий.,Das Museum ist jetzt geschlossen.,0.07910661399364471,
798.0,Das müsst ihr entscheiden.,Вам вирішувати.,Die Entscheidung liegt bei Ihnen.,-0.22982056438922882,
799.0,Das nächste Jahr wird schlimmer.,Наступний рік буде гіршим.,Das nächste Jahr wird schlimmer.,0.9175199866294861,
800.0,Das nächste Mal werde ich es selbst machen.,Наступного разу я зроблю його сам.,Das nächste Mal mache ich es alleine.,-0.1870398074388504,
801.0,Das nächste Mal werden meine Kommentare auf Russisch sein.,Наступного разу мої коментарі будуть російською.,Das nächste Mal werden meine Kommentare russischer sein.,0.7477247714996338,
802.0,Das Nashorn ist sehr groß.,Носоріг дуже великий.,Nashorn ist sehr groß.,0.8728386163711548,
803.0,Das neue System hat sich als erfolgreich erwiesen.,Нова система виявилась успішною.,Ein neues System hat sich als erfolgreich erwiesen.,0.8472048044204712,
804.0,Das Paar ist gestorben.,Пара померла.,Das Paar starb.,-1.0385982990264893,
805.0,Das Papier wurde in China erfunden.,Папір було винайдено в Китаї.,Papier wurde in China erfunden.,0.6475345492362976,
806.0,Das passiert ab und an.,Таке іноді трапляється.,Das passiert manchmal.,-0.7666130065917969,
807.0,Das passiert vielleicht nicht.,Цього може не трапитися.,Das kann nicht passieren.,-0.08617676794528961,
808.0,"Das Passwort ist ""Muiriel"".","Пароль - ""Muiriel"".","Das Passwort ist ""Muiriel"".",0.9184638261795044,
809.0,Das Pferd hat Durst.,Кінь хоче пити.,Das Pferd will trinken.,-0.7204821109771729,
810.0,Das Prinzip „Auge um Auge“ macht die ganze Welt blind.,Око за око - і весь світ стане сліпим.,"Auge um Auge, und die ganze Welt wird blind.",-0.26036936044692993,
811.0,"Das Problem ist, dass Sonnenenergie zu teuer ist.","Проблема в тому, що сонячна енергія занадто дорога.","Das Problem ist, dass Sonnenenergie zu teuer ist.",0.905754804611206,
812.0,Das Radio ist ausgeschaltet.,Радіо вимкнене.,Der Radio ist abgeschaltet.,0.38538265228271484,
813.0,Das Radio ist defekt.,Радіо зламалося.,Das Radio ist kaputt.,-0.3073495030403137,
814.0,Das Radio ist kaputt.,Радіо зламалося.,Das Radio ist kaputt.,0.9357939958572388,
815.0,Das riecht aber seltsam.,Але це дивно пахне.,Aber es riecht komisch.,-0.28865188360214233,
816.0,Das Rindfleisch ist zart.,Ця яловичина ніжна.,Dieses Rindfleisch ist zart.,0.05557195842266083,
817.0,Das sagt man nicht mehr.,Так уже не кажуть.,Das wird nicht mehr gesagt.,-0.2825039029121399,
818.0,Das scheinen keine Amerikaner zu sein.,"Вони, здається, не американці.",Sie scheinen nicht Amerikaner zu sein.,0.48541170358657837,
819.0,"Das scheint dir gerecht zu sein, oder?","Тобі здається, що це справедливо, так?","Du denkst, das ist fair, oder?",-0.577788233757019,
820.0,Das Schicksal kannst du nicht überlisten.,Долю не обдуриш.,Ich kann dich nicht täuschen.,-0.4880688190460205,
821.0,Das Schiff ist jetzt im Hafen.,Корабель зараз у порту.,Das Schiff ist jetzt im Hafen.,0.9127299785614014,
822.0,Das Schiff transportiert Rohstoffe aus Indonesien.,Корабель перевозить сировину з Індонезії.,Ein Schiff bringt Rohstoffe aus Indonesien,0.10187029838562012,
823.0,Das Schlimmste ist überstanden.,Найгірше вже позаду.,Das Schlimmste ist vorbei.,0.06033980846405029,
824.0,Das Schloss ist schön.,Замок прекрасний.,Der Vorhang ist wunderschön.,-0.37167805433273315,
825.0,Das schmeckt gut.,Смачно.,Lecker.,-1.396653175354004,
826.0,Das sind Alkoholiker.,Вони алкоголіки.,Sie sind Alkoholiker.,0.4897260069847107,
827.0,"Das sind die teuersten Schuhe, die ich je gesehen habe.","Це найдорожчі туфлі, які я коли-небудь бачила.","Das sind die teuersten Schuhe, die ich je gesehen habe.",0.9110850691795349,
828.0,Das sind Dummköpfe.,Вони дурні.,Die sind dumm.,-0.37574052810668945,
829.0,Das sind Dummköpfe.,Вони ідіоти.,Sie sind Idioten.,-0.9229909181594849,
830.0,Das sind Geschenke für meine Freunde.,Це подарунки для моїх друзів.,Das sind Geschenke für meine Freunde.,0.9020237922668457,
831.0,Das sind Geschenke.,Це подарунки.,Es sind Geschenke.,0.8200993537902832,
832.0,Das sind gute Neuigkeiten.,Це добрі новини.,Das sind gute Nachrichten.,0.058289751410484314,
833.0,Das sind meine Brüder.,Це мої брати.,Das sind meine Brüder.,0.9096728563308716,
834.0,Das sind meine CDs.,Це мої диски.,Das sind meine CDs.,0.9134742617607117,
835.0,Das sind meine Geschwister.,Це мої брати й сестри.,Das sind meine Geschwister.,0.9083229303359985,
836.0,Das sind meine Sachen.,Це мої речі.,Das sind meine Sachen.,0.9075442552566528,
837.0,Das sind nicht meine Bücher.,Це не мої книги.,Das sind nicht meine Bücher.,0.90763920545578,
838.0,Das sind Spione.,Вони шпигуни.,Sie sind Spione.,0.391144335269928,
839.0,Das sind Vegetarier.,Вони вегетаріанці.,Sie sind Vegetarier.,0.3914225995540619,
840.0,Das sind Vögel.,Це птахи.,Das sind Vögel.,0.897145688533783,
841.0,Das Spiel fängt morgen Nachmittag um zwei an.,Гра розпочинається завтра вдень о другій годині.,Das Spiel beginnt morgen um zwei Uhr.,-0.17297782003879547,
842.0,Das stimmt nicht.,Це невірно.,Das ist falsch.,-0.9073898792266846,
843.0,Das stimmt!,Правильно!,Richtig!,-1.2918426990509033,
844.0,Das stimmt.,Саме так.,Genau.,-1.1754764318466187,
845.0,Das stimmt.,Так.,"Ja, das ist es.",-0.6703407764434814,
846.0,Das Symbol ' &amp; ' steht für 'und'.,"Символ "" &amp; "" ставиться замість ""і"".","Das Zeichen &amp; ""bezieht sich anstelle von ""und"".",-1.0207877159118652,
847.0,Das Symbol '&' steht für 'und'.,"Символ ""&"" означає ""і"".","""&"" bedeutet ""i"".",-1.2996073961257935,
848.0,Das Symbol '&' steht für 'und'.,"Символ ""&"" ставиться замість ""і"".","""&"" steht für ""und"".",-0.5532277822494507,
849.0,Das Taxi holte zwei Fahrgäste ab.,Таксі підібрало двох пасажирів.,Das Taxi zog zwei Fahrgäste an.,-0.012823596596717834,
850.0,Da steht eine Blume auf dem Tisch.,На столі квітка.,Auf dem Tisch ist eine Blume.,0.1077059954404831,
851.0,Das Telefon funktioniert im Moment nicht.,Наразі телефон не працює.,Das Telefon funktioniert derzeit nicht.,0.26177161931991577,
852.0,Das Telefon funktioniert nicht.,Телефон не працює.,Das Telefon funktioniert nicht.,0.9166330099105835,
853.0,Das Telefon ist außer Betrieb.,Телефон не працює.,Das Telefon funktioniert nicht.,-0.836689293384552,
854.0,Das Telefon ist rot.,Телефон червоний.,Das Telefon ist rot.,0.9273537397384644,
855.0,Das Treffen fand hier statt.,Зустріч була тут.,Ich traf mich hier.,-0.7631616592407227,
856.0,Das Treffen fand hier statt.,Зустріч відбувалася тут.,Wir trafen uns hier.,-1.1249103546142578,
857.0,Das Treffen ist in zehn Tagen.,Зустріч буде за десять днів.,Wir treffen uns in zehn Tagen.,0.029947176575660706,
858.0,Das tut mir wirklich leid!,Мені дійсно шкода!,Es tut mir wirklich leid!,0.6585272550582886,
859.0,Das Undenkbare ist passiert.,Трапилося щось неймовірне.,Es war unglaublich.,-1.0498684644699097,
860.0,Das Undenkbare ist passiert.,Трапилося щось немислиме.,Es passierte etwas Unvorhergesehenes.,-0.6574920415878296,
861.0,Das Universum ist grenzenlos.,Всесвіт безмежний.,Das Universum ist unendlich.,0.204537495970726,
862.0,Das Universum ist unendlich.,Всесвіт безмежний.,Das Universum ist unendlich.,0.9242035746574402,
863.0,Das Unternehmen war von Anfang an ein Reinfall.,Цей проект з самого початку був помилкою.,Dieses Projekt war von Anfang an ein Fehler.,-0.619202196598053,
864.0,Das Video ist langweilig.,Це відео нудне.,Das Video ist langweilig.,0.9288239479064941,
865.0,Das war deine Entscheidung.,Це був твій вибір.,Das war deine Wahl.,-0.11082179844379425,
866.0,Das wäre ein Fehler.,Це було б помилкою.,Das wäre ein Fehler.,0.9127614498138428,
867.0,Das war ein böser Hase.,Це був злий заєць.,Es war ein böser Hase.,0.8399441242218018,
868.0,Das war eine bescheuerte Idee.,Це була ідіотьска ідея.,Das war eine dumme Idee.,0.08881306648254395,
869.0,Das war eine kluge Entscheidung.,Це було мудре рішення.,Das war eine weise Entscheidung.,0.23908066749572754,
870.0,Das war eine Lüge.,Це була брехня.,Das war eine Lüge.,0.9121517539024353,
871.0,Das war ein Fehler.,Це була помилка.,Das war ein Fehler.,0.9153815507888794,
872.0,"Das wäre zu cool, wenn ich zehn Sprachen sprechen könnte!","Було б так круто, якби я розмовляв десятьма мовами!","Es wäre so cool, wenn ich in zehn Sprachen sprechen würde!",0.21144349873065948,
873.0,Das war genug.,Цього було достатньо.,Das war genug.,0.9144970774650574,
874.0,Das war gut geschrieben.,Це було добре написано.,Das war gut geschrieben.,0.9128472805023193,
875.0,Das war immer so.,Так було завжди.,Das war schon immer so.,0.4089902639389038,
876.0,Das war immer so.,Так завжди було.,Das war schon immer so.,0.4089902639389038,
877.0,Das war kein Fehler.,Це не було помилкою.,Das war kein Fehler.,0.9190264940261841,
878.0,Das war nicht meine Idee.,Це була не моя ідея.,Das war nicht meine Idee.,0.914331316947937,
879.0,Das war sicher nicht mit Absicht.,"Я впевнена, що це було ненавмисно.","Ich bin sicher, es war unabsichtlich.",-0.0904245525598526,
880.0,Das war sicher nicht mit Absicht.,"Я певен, що це було ненавмисно.","Ich bin sicher, das war unabsichtlich.",-0.05691210925579071,
881.0,Das war unser Geheimnis.,Це був наш секрет.,Das war unser Geheimnis.,0.9147356748580933,
882.0,Das war unvermeidlich.,Це було неминуче.,Das war unvermeidlich.,0.9213019609451294,
883.0,Das Wasser im Brunnen war eisig.,Вода в криниці була крижана.,Es war eiskalt im Brunnen.,-0.2652984857559204,
884.0,Das Wasser im Brunnen war eiskalt.,Вода в криниці була крижана.,Es war eiskalt im Brunnen.,0.006907299160957336,
885.0,Das Wasser ist gut.,Вода добра.,Wasser ist gut.,0.6981921792030334,
886.0,Das Wasser ist herrlich!,Вода чудова!,Das Wasser ist großartig!,0.26892203092575073,
887.0,Das Wasser ist nicht kalt.,Вода не холодна.,Das Wasser ist nicht kalt.,0.9360232949256897,
888.0,Das Wasser ist nicht trinkbar.,Ця вода непридатна для пиття.,Dieses Wasser ist nicht zum Trinken geeignet.,-0.1329251080751419,
889.0,Das Wasser ist sauber.,Вода чиста.,Das Wasser ist rein.,0.08418360352516174,
890.0,Das Wasser ist warm.,Вода тепла.,Das Wasser ist warm.,0.9322159290313721,
891.0,Das Wasser schmeckt gut.,Вода добре смакує.,Wasser schmeckt gut.,0.786562442779541,
892.0,Das Wasser war blau.,Вода була блакитна.,Das Wasser war blau.,0.934454619884491,
893.0,Das weiß ich bereits.,Я вже це знаю.,Das weiß ich schon.,-0.007164403796195984,
894.0,Das weiß ich nicht.,Я цього не знаю.,Das weiß ich nicht.,0.9133175611495972,
895.0,Das weiß ich schon.,Я вже знаю.,Ich weiß es schon.,0.6090257167816162,
896.0,Das weiß ich schon.,Я вже це знаю.,Das weiß ich schon.,0.9124293327331543,
897.0,Das weißt du doch.,Ти вже це знаєш.,Das weißt du schon.,-0.06404803693294525,
898.0,Das weißt du ja.,Ти вже це знаєш.,Das weißt du schon.,0.13136467337608337,
899.0,Das Wetter ist heute wunderbar.,Погода сьогодні чудова.,Heute ist das Wetter wunderbar.,0.9178557395935059,
900.0,Das Wetter war windstill.,Погода була безвітряна.,Die Wetterlage war hoffnungslos.,-0.8578920364379883,
901.0,Das wird dreißig Euro kosten.,Це коштуватиме 30 євро.,Das würde 30 Euro kosten.,-0.561072587966919,
902.0,Das wird einfach.,Це буде легко.,Das wäre leicht.,-0.5099905729293823,
903.0,Das wird komisch sein.,Це буде весело.,Das wird lustig.,-1.0806089639663696,
904.0,Das wird leicht sein.,Це буде легко.,Das wäre leicht.,-0.42263948917388916,
905.0,Das wird lustig sein.,Це буде весело.,Das wird lustig.,-0.020112231373786926,
906.0,Das wird mein letzter Satz in Englisch sein.,Це буде моє останнє речення англійською.,Das ist mein letzter Satz auf Englisch.,-0.03132389485836029,
907.0,Das wird nicht allzu schwierig sein.,Це буде не так вже й складно.,Es wird nicht so schwierig sein.,0.22696608304977417,
908.0,Das wird nicht funktionieren.,Це не спрацює.,Das wird nicht funktionieren.,0.9222066402435303,
909.0,Das wird nicht klappen.,Це не спрацює.,Das wird nicht funktionieren.,-0.3959892988204956,
910.0,Das wird nicht noch einmal passieren.,Цього більше не трапиться.,Das wird nicht mehr passieren.,0.04584178328514099,
911.0,Das wird nicht passieren.,Це не станеться.,Das wird nicht passieren.,0.9262797236442566,
912.0,Das wird sich ereignen.,Це трапиться.,Das wird geschehen.,-0.7713707685470581,
913.0,Das wird Tom nicht gefallen.,Тому це не сподобається.,Das würde es also nicht gefallen.,-0.006549909710884094,
914.0,Das wisst ihr doch.,Ви вже це знаєте.,Das wissen Sie bereits.,-0.8818094730377197,
915.0,Das wisst ihr ja.,Ви вже це знаєте.,Das wissen Sie bereits.,-0.7078245282173157,
916.0,Das wollte ich nicht.,Я не хотів цього.,Das wollte ich nicht.,0.9200137257575989,
917.0,Das Wörterbuch enthält ungefähr eine halbe Million Wörter.,У цьому словнику приблизно півмільйона слів.,Es gibt ungefähr eine halbe Million Wörter in diesem Wörterbuch.,0.14279034733772278,
918.0,Das Wörterbuch hier gehört mir.,Цей словник мій.,Das ist mein Wörterbuch.,-0.2740614414215088,
919.0,Das Wort wird nicht mehr benutzt.,Це слово більше не використовується.,Dieses Wort wird nicht mehr verwendet.,-0.11818759143352509,
920.0,Das wusste ich nicht.,Я цього не знала.,Das wusste ich nicht.,0.9183211326599121,
921.0,Das Zimmer hat zwei Fenster.,Ця кімната має два вікна.,Dieser Raum hat zwei Fenster.,-0.18196247518062592,
922.0,Das Zimmer ist leer.,Кімната пуста.,Das Zimmer ist leer.,0.916295051574707,
923.0,Das Zimmer war abgeschlossen.,Кімната була замкнена.,Das Zimmer war verschlossen.,0.42554283142089844,
924.0,Das Zimmer wird morgen angestrichen.,Кімнату завтра пофарбують.,Morgen wird das Zimmer gestrichen.,0.453172504901886,
925.0,Das Zusehen schmerzte.,На це було боляче дивитися.,"Es tat weh, das zu sehen.",-0.49285614490509033,
926.0,Das zweite Semester hat geendet.,Закінчився другий семестр.,Das zweite Semester ist vorbei.,-0.37500661611557007,
927.0,David ist zu Hause.,Давид вдома.,David ist zu Hause.,0.9173035025596619,
928.0,Davon könnt ihr nur träumen.,Вам про це тільки мріяти.,Das ist nur ein Traum.,-0.4184262752532959,
929.0,Da war niemand im Garten.,У саду нікого не було.,Niemand war im Garten.,0.8503981232643127,
930.0,Dazu bin ich zu alt.,Я для цього занадто стара.,Ich bin zu alt dafür.,0.5959973335266113,
931.0,"Dein Bruder hat geheiratet, oder?","Твій брат одружився, чи не так?","Dein Bruder hat geheiratet, nicht wahr?",0.3473286032676697,
932.0,Deine Antwort ist falsch.,Твоя відповідь невірна.,Deine Antwort ist falsch.,0.9233007431030273,
933.0,Deine Frisur gefällt mir nicht.,Мені не подобається твоя зачіска.,Ich mag deine Frisur nicht.,-0.012585818767547607,
934.0,Deine Haare sind nicht einmal nass.,Твоє волосся навіть не мокре.,Dein Haar ist auch nicht nass.,0.19881749153137207,
935.0,Deine Haare sind zu lang.,Твоє волосся задовге.,Dein Haar ist zu lang.,0.0862777978181839,
936.0,Deine Ideen sind ziemlich altmodisch.,Твої ідеї досить старомодні.,Deine Ideen sind ziemlich altmodisch.,0.9194620847702026,
937.0,Deine Krawatte sitzt schief.,У тебе перекосилася краватка.,Du hast eine Krawatte zugeknöpft.,-0.5394871234893799,
938.0,Deine Mannschaft ist stärker als unsere.,Твоя команда сильніша від нашої.,Dein Team ist stärker als unser Team.,-0.0684165209531784,
939.0,Deine Mannschaft ist stärker als unsere.,"Твоя команда сильніша, ніж наша.",Dein Team ist stärker als unser Team.,-0.0684165209531784,
940.0,Deine Meinung interessiert mich nicht.,Мене не цікавить ваша думка.,Ihre Meinung interessiert mich nicht.,0.37136518955230713,
941.0,Deine Meinung ist sehr konstruktiv.,Твоя думка дуже конструктивна.,Du hast eine sehr konstruktive Idee.,-0.03902818262577057,
942.0,Deine Mutter ist ein Computer.,Твоя мати - комп'ютер.,Deine Mutter ist ein Computer.,0.9132596850395203,
943.0,Deine Mutter wird mich umbringen.,Твоя мама мене вб'є.,Deine Mutter wird mich umbringen.,0.9159166812896729,
944.0,Dein Englisch ist perfekt.,У тебе досконала англійська.,Du hast perfektes Englisch.,-0.006998226046562195,
945.0,Dein Erfolg ist das Ergebnis deiner harten Arbeit.,Твій успіх - результат твоєї важкої праці.,Dein Erfolg ist das Ergebnis deiner harten Arbeit.,0.9076040983200073,
946.0,Dein Französisch ist perfekt.,У тебе досконала французька.,Du hast perfekte Französisch.,0.26178574562072754,
947.0,Dein Französisch ist schon viel besser geworden.,Твоя французька стала набагато краща.,Dein Französisch ist viel besser geworden.,0.8490759134292603,
948.0,Dein Freund ist hier.,Твій друг тут.,Dein Freund ist hier.,0.9245562553405762,
949.0,Dein Führerschein ist abgelaufen.,Твої водійські права прострочені.,Ihre Führerscheine sind überfällig.,-0.3429301977157593,
950.0,Dein Geld brauch ich nicht. Ich brauche deine Zeit.,Мені не потрібні твої гроші. Мені потрібен твій час.,Ich brauche dein Geld nicht.,0.12543292343616486,
951.0,Dein Haus ist fantastisch.,Твій будинок просто фантастичний.,Dein Haus ist fantastisch.,0.9281817078590393,
952.0,Dein Haus muss repariert werden.,Твій будинок потребує ремонту.,Dein Haus muss repariert werden.,0.9122899770736694,
953.0,Dein Hund biss mich in die Hand.,Твій собака вкусив мене за руку.,Dein Hund hat mich am Arm gebissen.,-0.666115403175354,
954.0,Dein Hund hat mich in die Hand gebissen.,Твій собака вкусив мене за руку.,Dein Hund hat mich am Arm gebissen.,0.06627826392650604,
955.0,Dein Kleid gefällt mir.,Мені подобається твоя сукня.,Ich mag dein Kleid.,-0.3858422040939331,
956.0,Dein Kleid ist schon nicht mehr in Mode.,Твоє плаття вже вийшло з моди.,Dein Kleid ist aus der Mode gekommen.,-0.2833232283592224,
957.0,Dein Reißverschluss ist offen.,У тебе розстебнута ширінька!,Du hast ein gespicktes Gemäuer!,-0.8686878681182861,
958.0,Dein Vorschlag gefällt mir.,Мені подобається твоя пропозиція.,Ich mag dein Angebot.,-0.7348058223724365,
959.0,Dein Wort in Gottes Ohr!,Твої б слова та богу в вуха!,Deine Worte und Worte wären mir zu Ohren gekommen.,-0.6722288131713867,
960.0,Delfine und Wale sind keine Fische.,Детьфіни та кити не риби.,Delphine und Wale sind keine Fische.,0.024099603295326233,
961.0,"Dem nach zu urteilen, was sie sagt, ist er schuldig.","Судячи з того, що вона каже, він винний.","Er ist für das, was sie sagt, verantwortlich.",-0.44002896547317505,
962.0,Den Apfel habe ich gegessen.,Я з'їв яблуко.,Ich aß den Apfel.,-0.3540043234825134,
963.0,Den Film will ich noch einmal sehen.,Я хочу подивитися цей фільм ще раз.,Ich will den Film noch einmal sehen.,0.9310438632965088,
964.0,Denke an deine Zukunft!,Подумай про своє майбутнє.,Denk an deine Zukunft.,0.591020941734314,
965.0,"Denke daran, dass du Staub bist.","Пам’ятай, що ти порох.","Vergiß nicht, daß du Staub bist.",-0.2604182958602905,
966.0,Denke darüber nach.,Поміркуй над цим.,Denken wir einmal darüber nach.,0.3155461251735687,
967.0,"Denken Sie, Tom ist betrunken?","Гадаєте, Том п'яний?","Glauben Sie, Tom ist betrunken?",0.3608555197715759,
968.0,Denke über deine Zukunft nach!,Подумай про своє майбутнє.,Denk an deine Zukunft.,-0.15222381055355072,
969.0,Denk mal drüber nach.,"Подумай про це, будь ласка.","Denken Sie darüber nach, bitte.",-0.29529237747192383,
970.0,Denkst du auf Französisch?,Ти думаєш французькою?,Findest du Französisch?,-0.4411408305168152,
971.0,"Denkst du, dass ich meine Zeit vertue?","Гадаєш, я марную свій час?","Glaubst du, ich verschwende meine Zeit?",0.09096020460128784,
972.0,"Denkst du, Tom ist betrunken?","Гадаєш, Том п'яний?","Glaubst du, Tom ist betrunken?",0.2353273183107376,
973.0,"Denkt ihr, Tom ist betrunken?","Гадаєте, Том п'яний?","Glauben Sie, Tom ist betrunken?",-0.18548338115215302,
974.0,Den Studenten gefällt es.,Студентам він подобається.,Den Studenten gefällt er.,0.31139129400253296,
975.0,Den Tapferen hilft das Glück.,Доля посміхається сміливим.,Das Schicksal lächelt mutig.,-0.7196848392486572,
976.0,Der Affe fiel vom Baum.,Мавпа упала з дерева.,Der Affe ist vom Baum gefallen.,0.004342630505561829,
977.0,Der alte Hund bellte.,Старий пес загавкав.,Der alte Hund ist eingebrochen.,-0.2609631419181824,
978.0,Der alte Mann gab ihr eine kleine Puppe.,Цей дідусь подарував їй маленьку ляльку.,Er schenkte ihr eine kleine Puppe.,-0.04778195917606354,
979.0,Der Alte schenkte ihr eine kleine Puppe.,Цей дідусь подарував їй маленьку ляльку.,Er schenkte ihr eine kleine Puppe.,0.7448509931564331,
980.0,Der Anfang der Geschichte ist interessant.,Початок розповіді цікавий.,Der Beginn der Geschichte ist interessant.,0.2971324920654297,
981.0,Der Antisemitismus ist der Sozialismus der dummen Kerle.,Антисемитизм - це соціалізм для дурнів.,Antisemitismus ist der Sozialismus der Narren.,0.203292578458786,
982.0,Der Apfel fiel vom Baum.,Яблуко впало з дерева.,Ein Apfel fiel vom Baum.,0.7724066972732544,
983.0,Der Apfel ist gelb.,Це яблуко жовте.,Das ist ein gelber Apfel.,0.4816460609436035,
984.0,Der Apfel ist gelb.,Яблуко жовте.,Der Apfel ist gelb.,0.9236017465591431,
985.0,Der Apfel ist noch nicht reif.,Яблуко ще не стигле.,Der Apfel ist noch nicht reif.,0.9162191152572632,
986.0,Der Apfel ist vom Baum gefallen.,Яблуко впало з дерева.,Ein Apfel fiel vom Baum.,-0.05671621859073639,
