,EN,UK,TRANSLATION
0,The children.,Діти.,Діти.
1,I still have some friends in high places.,В мене все ще є друзі в високих кругах.,У мене все ще є друзі на високих посадах.
2,Successfully moved to trash.,Успішно пересунуто до смітника. @ info: status,Успішно пересунуто до смітника.
3,The given name could not be resolved to a unique server. Make sure your network is setup without any name conflicts between names used by Windows and by UNIX name resolution.,"Не вдається зв' язати вказану назву з унікальним сервером. Перевірте, що в мережі немає конфліктів між назвами вузлів у Windows та UNIX.","Не вдалося визначити вказану назву для унікального сервера. Переконайтеся, що вашу мережу налаштовано без конфліктів назв, які використовуються у Windows і UNIX."
4,Data tool,Засоби роботи з даними,Інструмент даних
5,Close the door.,Закрий двері.,Зачини двері.
6,I'm just glad he's feeling better.,"Я рада, що йому стало краще.","Я просто рад, что ему лучше."
7,Don't you touch her!,- Не чіпай її!,Не торкайся її!
8,So?,І що?,І що?
9,Subdued,З підпорядкуванням,"СубтитнаThe role of the transaction, in past tense"
10,Notes,Примітки,Нотатки
11,"Look, he's my lawyer, same as yours.","Слухай, він мій адвокат, також як і твій.","Слушай, он мой адвокат, такой же, как и твой."
12,"Forget about control, Nina. I want to see passion.","Забудь про контроль Ніно, я хочу побачити пристрасть","Забудь о контроле, Нина, я хочу увидеть страсть."
13,I pray you two see each other again soon.,"Я молюся, щоб ви двоє змогли незабаром побачитися.","Я молюся, що ви двоє скоро знову побачитеся."
14,Configure the number of calendar days you wish to be published and available to others,"Тут ви можете вказати кількість днів, дані про які буде оприлюднено.","Налаштуйте кількість днів календаря, які ви бажаєте опублікувати, доступною для інших@ info: whatsthis"
15,The shader should run!,Програма малювання тіней повинна запуститися!,Слід запустити інструмент тінь!
16,Any Video4Linux compatible device,Будь- які сумісні з Video4Linux пристрої,Будь- який сумісний з Video4Linux пристрій
17,How did you end up here?,"Зараз розповім, сер.",Як ти тут опинився?
18,- What do you expect?,- А на що ви розраховуєте?,- Чого ти сподіваєшся?
19,Top Output Bin (Face Down),Верхній вивідний (лицем вниз),Верхня вихідна скринька (лицем вниз)
20,"Well, you know, I...","Добре, знаєш, я...","Ну, знаешь, я..."
21,You have to enter the name of the new identity into the New Identity edit field. This will be the name shown in the identity list.,Вам слід ввести назву нового профілю до поля Новий профіль. Введену назву буде показано у списку профілів.,Вам слід ввести назву нового профілю до поля Новий профіль. Це буде вказано у списку профілів.
22,No.,"- Ні, не треба.",Ні.
23,Sharp turns,Різкі повороти,Різкі повороти
24,I'll work something out.,Я щось вирішу.,Я щось придумаю.
25,"And how many years did it take to build-- my grandfather and Uncle were murdered here, weren't they?","І скільки років пішло на будівництво Тут вбили мого діда і дядька, правда?","І скільки років пішло на будівництво-- тут вбили мого дідуся й дядька, чи не так?"
26,"I want you to steal the diamonds. - No, that's...","я хочу, щоб ви вкрали діаманти.","Я хочу, щоб ти вкрала діаманти."
27,She can speak not only English but also French.,"Вона може говорити не тільки англійською, але й французькою.","Вона говорить не лише англійською, але й французькою."
28,Oh I told him...,- Що ви йому сказали?,"О, я сказав йому..."
29,Delete the current profile,Вилучити поточний профіль,Вилучити поточний профіль
30,"It's an Earth-shaking discovery, and it's forcing us to radically reassess our place in the Universe and even our eventual fate.",Це відкриття всесвітнього масштабу і воно змушує нас радикально переоцінити наше місце у всесвіті і навіть нашу можливу долю.,"Це відкриття Землі, яке змушує нас радикально переосмислити своє місце у всесвіті і навіть нашу можливу долю."
31,- It's great.,- Це просто божевілля.,- Чудово.
32,"Whoa, excuse me.",вибачте мені.,Вибачте.
33,"Okay, you really gotta help me out here.","гаразд, ви дійсно маєте допомогти мені тут.","Ладно, ты действительно должен помочь мне здесь."
34,Hit me.,Здай мені.,Вдар мене.
35,We can shake hands with Russian guests and wish them a safe return home.,Ми можемо потиснути руки російським гостям і побажати їм безпечно повернутися додому.,Ми можемо потиснути руку російським гостям і побажати їм безпечно повернутися додому.
36,The SUMSQ() function calculates the sum of all the squares of values given as parameters. You can calculate the sum of a range SUMSQ(A1: B5) or a list of values like SUMSQ(12; 5; 12.5).,"Функція SUMSQ () підраховує суму квадратів значень, переданих у параметрах. Ви можете підрахувати суму діапазону, SUMSQ( A1: B5) або списку значень, SUMSQ( 12; 5; 12. 5).","Функція SUMSQ}) обчислює суму всіх квадратів значень, заданих як параметри. Ви можете обчислити суму діапазону SUMSQA1: B5 або списку значень на зразок SUMSQ12; 5; 12. 5)."
37,1971?,У 1971-му році?,1971?
38,So is there anything I should know about?,є ще щось що я маю знати про це?,"Так есть что-нибудь, о чем я должен знать?"
39,"Oh, what the hell is this?",Якого біса?,Що це в біса таке?
40,It's the last thing he'll expect.,На таке він не сподіватиметься.,"Это последнее, на что он будет ожидать."
41,-What's the matter?,- У чому справа?,- Що сталося?
42,Konqueror is a combined web- and filebrowser.,Konqueror є комбінацією переглядача Тенет і програми для роботи з файлами.,Konqueror - це комбінований веб- і файловий навігатор.
43,Delete the selected task.,Вилучити вибране завдання.,Вилучити вибране завдання.
44,- Mm-hmm.,- Угу.,- Угу.
45,My dental plan doesn't kick in for another six months.,Нехай усі його зуби будуть цілі.,Мій стоматолог не планує працювати ще шість місяців.
46,Color Roles,Ролі кольорів,Ролі кольорів
47,Arwen's life is now tied to the fate of the Ring.,Життя Арвен тепер прив'язане до Персня.,Життя Арвена тепер пов'язане з долею Персня.
48,"Yes, yes, yes. I gotta go now, ol' fever Sal.","Так, так, так, чоловіче, час.","Так, так, так, мені треба йти, ой лихоманка Сал."
49,"Mr. Fifield, let's get a grid of the structure.","Пане Файфілд, визначте структуру цієї споруди.","Мистер Файфілд, давайте найдем решетку здания."
50,(CROWD MURMURING),РОПТАННЯ У НАТОВПІ,(Звучить натовп)
51,- Do not!,- Зовсім ні!,- Не треба!
52,"This will be your room, Mr. Bond.","Це ваша кімната, містере Бонд.","Це ваша кімната, містере Бонд."
53,Play the original Quake III Arena,Грати у початкову версію Quake III Arena,Грати у початкову Quake III Arena
54,It's mad in here.,"Діти, тут можна з глузду з'їхати.",Тут це божевілля.
55,If we don't freeze to death first.,Якщо спершу не загинемо від холоду.,Якщо ми не замерзнемо до смерті спочатку.
56,Right.,Вірно.,Так.
57,System Administration,Керування системою,Адміністрування системи
58,I think we should talk about it.,"Тому я вважаю, нам є про що поговорити.","Думаю, нам стоит поговорить об этом."
59,Dust Devils,Пилові завихренняweather condition,Пилові дияволи
60,Next LaTeX Warning,Наступне попередження LaTeX,Наступне попередження LaTeX
61,I like that you get to see the same people every day... bring 'em that check they've been waiting for... and presents for Christmas...,"Мені подобається, що ти можеш бачити одних і тих же людей щодня. Давати їм те, що вони чекали. Подарунки на Різдво.","Мне нравится, что каждый день ты встречаешься с теми же людьми, которые приносят им, чтобы проверить, что они ждут... и подарки на Рождество..."
62,Installation,Встановлення,Встановлення
63,"Easy, pal.","Легше, друзяко.","Полегче, приятель."
64,Show Size In,Показувати розмір в,Показувати розмір в
65,Has he told you?,Він тобі казав?,Он сказал тебе?
66,I hit a snag.,﻿Я знаю.,Я попала в захват.
67,"Step away, Tal Hajus.",Відійди. Таль Аджас.,"Уйди, Талл Хаджус."
68,And she says to the other...,І вона йому говорить...,И она говорит другую...
69,None but the king of Gondor may command me.,Я вимагаю від вас виконати вашу присягу!,"Ніхто, крім короля Гондору може мені наказувати."
70,If true this tense is selected for learning.,"Якщо « так », цей час буде вибрано для тестування.","Якщо істина, цей час вибрано для навчання."
71,I want to buy it.,Я хочу купити її.,Я хочу купити його.
72,"Okay, give it to me.",Давай я помогу.,"Ладно, дай его мне."
73,It was one of those instant best friend things.,"Це були почуття, які можливі тільки у справжніх друзів.",Це був один з тих моментальних кращих друзів.
74,Please check your permissions to create it.,"Будь ласка, переконайтеся, що ви маєте право на створення цього елемента.","Будь ласка, перевірте ваші права доступу для створення цього файла."
75,The first word of a game should cover the central position.,Перше слово гри слід розміщувати по центру.,Перше слово гри має займати центральну позицію.
76,Cursor & Selection,Курсор та вибір,Курсор та вибір
77,Our sons will take over the company.,Наші сини будуть керувати компанією.,Наші сини заволодіють компанією.
78,Has he said anything?,Він щось сказав?,Він щось сказав?
79,This home will be your home.,Цей дім буде вашим домом.,Цей дім буде твоїм домом.
80,The ones that aren't healing.,"Ті, які не гояться.","Ті, що не виліковуються."
81,"- His mouse, wifey, gargles brandy...","- Його мишка, жіночка, глушить бренді...","- Його миша, жіночна, гарбуз бренді..."
82,"Yes, it still stands at 74%.","Так, як і раніше зупинилося на 74%.","Так, він все ще стоїть на 74%."
83,"Isn't Job crying the same cry as Ginsberg's ""Howl""?","Чи Йов не плаче так само, як Ґінзберґ у ""Плачі""?","Хіба Йов не плаче так само, як Ґінзберґ ""Плач""?"
84,"I mean, that shouldn't be your reference.",Не це повинно бути мірилом твоїх зусиль.,"Я маю на увазі, це не повинно бути вашим посиланням."
85,"& kiten; can also help you refine your searches by allowing you to search for new text in the results generated by a previous search. To do this, just choose Search Search in Results to perform your search.","& kiten; також надає вам змогу уточнити результат пошуку за допомогою пошуку нового тексту у результатах, які є наслідком попереднього пошук. Щоб виконати такий пошук, просто оберіть пункт меню Пошук Шукати у результатах.","Крім того, & kiten; може допомогти вам покращити результати пошуку, надавши вам змогу шукати новий текст у результатах, створених попереднім пошуком. Щоб виконати цей пошук, просто скористайтеся пунктом меню Пошук Шукати у результатах."
86,"Get out there and find your little girlfriend, bring her and Julia Shumway back here, pronto.","Вимітайся звідси і знайди свою малу подружку, привези її та Джулію Шамвей сюди, швидко.","Іди і знайди свою подружку, приведи її та Джулію Шамвей сюди."
87,"No, no, no.","Ні, ні, ні.","Ні, ні, ні."
88,Now you have a military dictatorship.,Тепер у вас військова диктатура.,Тепер у вас є військова диктатура.
89,You can do it.,Ви подужаєте!,Ти зможеш.
90,I hate to think where that puts me.,Я не хочу думати скільки тоді мені.,"Я ненавижу думать, куда меня это заставляет."
91,- Business purposes only.,- Тільки для роботи.,- Тільки для ділових цілей.
92,"Okay, bye-bye.","Добре, бувай.","гаразд, бувай."
93,"Not knowing what to do, I asked for his advice.","Не знаючи, що робити, я попрохав його поради.","Не знаючи, що робити, я попросив у нього поради."
94,This schedule is baselined. Do you want to remove the baseline?,Цей розклад належить до базового плану. Ви бажаєте вилучити базовий план?,Цей розклад є базовим. Ви бажаєте вилучити базову лінію?
95,"Yeah, I remember.","Так, я пам'ятаю.","Так, я пам'ятаю."
96,This is where I buried it.,Ось тут я його закопав.,Ось де я його закопав.
97,There's no oil in it.,Паливо закінчилось.,У ній немає нафти.
98,Site Policy,Правила поведінки для сайтів,Правила веб- сайтів
99,A little bit further.,І раз! І два! І три!,Ще трохи.
100,"The Heaviside Step Function. Returns 1 if x is positive, 0.5 if x is zero, or 0 if x is negative.","Ступінчаста функція Хевісайда. Повертає 1, якщо x додатне, 0. 5, якщо x рівне нулеві, і 0, якщо x від’ ємне.","Крок Хеавіда. Повертає 1, якщо x додатнє, 0, 5, якщо x дорівнює нулю, або 0, якщо x від' ємне."
101,A land where nothing grew.,"Землі, на якій ніщо не росло. Тепер тут є рослини.","Земля, де ніщо не росло."
102,a neat analog clock,лаконічний аналоговий годинник,акуратний аналоговий годинник
103,"Doomed to wait upon an old man, who should have loved her as a father.","Проклята піклуватися про старого чоловіка, що мав би її любити як батько.","Засуджений чекати на старого чоловіка, який повинен був любити її, як батька."
104,Where did you get it?,Звідки вона у вас?,Де ти його взяв?
105,"When you have selected a cell, pressing the Enter key will move the cell cursor one cell left, right, up or down, as determined by this setting.","Цей параметр визначає напрямок переміщення у наступну комірку, якщо натиснути клавішу Enter. Можливе переміщення на одну комірку ліворуч, праворуч, вгору або вниз.","Після вибору комірки, натискання клавіші Enter переведе курсор на одну комірку ліворуч, праворуч, вгору або вниз, згідно до значення цього параметра."
106,Fax file(s) to show,Показати файли факсів,Показувати файли факсів
107,What do you want to do?,Що збираєшся робити?,Що ти хочеш зробити?
108,"- Well, bravo!",- Молодця!,"- Ну, браво!"
109,Nadia.,Надю!,Надя.
110,"- Twins, my lord.","- Двійнята, мій пане.","- Близнюки, милорд."
111,"A few years after World War II, The world plunged into Cold War.",КІЛЬКА РОКІВ ПО ЗАКІНЧЕННЮ ІІ СВІТОВОЇ ВІЙНИ СВІТ ПОРИНУВ У ХОЛОДНУ ВІЙНУ.,"Через кілька років після другої світової війни, світова війна вступила в Холодну війну."
112,You very nearly were.,Так воно майже і було.,Ти майже була.
113,"Default is Number but you can set the WBS code to be Roman Numbers or Letters, either upper case or lower case.","Типовим значенням є Число, але ви можете вказати, що коди СРР слід визначати як римські цифри або літери (верхнього або нижнього регістрів).","Типовим значенням є Число, але ви можете вказати код СРР як римські номери або літери, верхній або нижній регістр."
114,Don't put off the work till tomorrow.,Не відкладайте роботу на завтра.,Не відкладайте роботу на завтра.
115,But this is my house.,Але це мій будинок.,Но это мой дом.
116,Even though you don't want to.,Навіть якщо не хочеш.,Навіть якщо не хочеш.
117,"Ben, check the outhouse.","Бене, перевір сортир.","Бене, перевір будинок."
118,"To create a new email alarm to send a copy of an existing email message, drag the email from & kmail; onto & kalarm; 's main window or system tray icon. Then select the Email option. The Alarm Edit dialog is preset with the entire email message except sender.","Щоб створити нагадування електронною поштою, за якого буде надіслано копію існуючого повідомлення електронної пошти, перетягніть позначку повідомлення електронної пошти з & kmail; до вікна або піктограми системного лотка & kalarm;. Після цього оберіть пункт Нагадування ел. поштою. У діалоговому вікні редагування нагадування буде використано дані повідомлення електронної пошти, окрім відправника.","Щоб створити нагадування електронною поштою для надсилання копії існуючого повідомлення електронної пошти, перетягніть позначку повідомлення електронної пошти з & kmail; до головного вікна або піктограми системного лотка & kalarm;. Після цього позначте пункт Адреса ел. пошти. Діалогове вікно редагування нагадування буде використано для всього повідомлення електронної пошти, окрім відправника."
119,- I think I'll have οne.,А я б випив.,"- Думаю, я з'їм."
120,Save logins in a wallet,Зберігати реєстраційні дані у торбинці,Зберігати реєстраційні дані у торбинці
121,Flake device definition,Визначення інструмента елементаComment,Визначення пристрою Flake
122,Use own default charset when replying,Використовувати власне кодування у відповідях,Використовувати власне кодування під час відповіді
123,Want a doughnut?,- Хочеш пампуха? - Ні.,Хочеш пончик?
124,"Kuopio, Finland","Куопіо, ФінляндіяName","Куопіо, Фінляндія"
125,Structures tool,Інструмент структур@ title: menu,Інструмент структур
126,"Brutes, do you think that I wouldn't do it if I wanted to ? !","Скоти, думаєте якби я хотіла, то не зробила б цього?","Брутс, ты думаешь, я бы этого не сделал, если бы хотел?"
127,"Neck, I'm gonna need you to stay here and get this motor runnin'.","Неку, ти повинен тут залишитися і завести двигун.","Нэк, мне нужно, чтобы ты осталась здесь и запустила этот мотор."
128,"I used to think rich people were cursed, and that only garrets, sour soup and potatoes can bring people joy.","Раніше я думав, що багаті - прокляті люди. І що тільки халупи і коморки, і кисла капуста з картоплею, дають людям щастя і благість.","Я думав, що багаті люди прокляті, і що тільки гаррети, кислий суп і картопля приносять людям радість."
129,She'd have told you She was like you,"Якби хотіла, то передала. Вона була така ж як і ти.","Вона б тобі сказала, що вона така ж, як ти."
130,"When you are done setting up your screen saver, click OK.",Після завершення налаштування вашого зберігача екрана вам слід натиснути кнопку Гаразд.,Після завершення налаштування вашого зберігача екрана натисніть кнопку Гаразд.
131,Full CD,Повний КД,Повний КД
132,I wonder what they're serving at the domestic dealerships.,я вражений вони обслуговують як в уповноважених сервісах.,"Цікаво, що вони служать на внутрішньому дільниці."
133,Alice?,Алісо!,Еліс?
