,EN,UK,TRANSLATION
672,Let me take it.,Давай я візьму.,Дай-но я візьму.
673,We could take the city in an hour.,Місто упало б за годину.,Ми можемо зайняти місто за годину.
674,- Last set of numbers confirmed.,﻿Останній набір підтверджений.,- Останній набір підтверджений.
675,My enema guy is here.,До мене прийшли з клізмою,Тут мій інфейер.
676,Add the following binary files to the repository:,Додати наступні двійкові файли до сховища:,Додати наступні бінарні файли до сховища:
677,X.509 Certificate Refresh Error,Помилка освіження сертифіката X. 509@ title: window,Помилка оновлення сертифіката X. 509
678,No! No.,Ні!,Нет!
679,Shows/ hides the & kbounce; statusbar.,Показує або ховає смужку стану & kbounce;.,Показує або ховає смужку стану & kbounce;.
680,Don't even think about it.,Навіть не думай про це.,Навіть не думай про це.
681,Blind to the lives of those they deem lesser than their own.,Вони не цінують життя тих кого вважають слабкішими за них.,"Сліпі до життя тих, кого вони вважають нижчими за них."
682,"He got his, too.",У нього теж такий.,У него тоже есть.
683,"All three of these methods are equivalent, and produce the same result.",Всі три описаних способи призводять до однакових наслідків і запускають одну і ту ж саму програму.,Всі три з цих методів однакові і дають однакові результати.
684,What?,Якій?,Что?
685,"I mean it's no homophobic, is it?",Це не звучить як гомофобія?,"Я маю на увазі, що це не гомофобія, чи не так?"
686,Unable to construct a GUI element. Your KMLDonkey installation is incomplete.,Не вдалося побудувати елемент графічного інтерфейсу. Ви встановили не всі компоненти KMLDonkey.,Не вдалося побудувати елемент графічного інтерфейсу. Встановлення KMLDonkey є неповним.
687,Investments,Інвестиції,Інвестиції
688,Toggle display of the opaque ground,Перемикач прозорості горизонту,Перемикач показу непрозорої поверхні
689,"Yeah, I'm going through all those typical teenage girl issues like:","Що ж, дякую вам за турботу, Наталі.","Да, у меня такие обычные проблемы с подростками:"
690,"Enter regular expressions which can be used to parse the data returned from the URL entered above. The symbol, price, and date must be found in the quote data to be usable. You may also try the KMyMoney user's mailinglist at kmymoney2-user@lists. sourceforge. net to find what settings work for other users in your country.","Введіть формальний вираз, який буде використано для обробки даних, отриманих з адреси URL, введеної вище. Для того, щоб програма могла скористатися даними, вона має знайти у них код, ціну і дату. Знайти перелік параметрів, які визначили інші користувачі з вашої країни, можна у списку листування kmymoney2- user@ lists. sourceforge. net.","Введіть формальні вирази, які можна використовувати для обробки даних, отриманих з адреси URL, введеної вище. Символ, ціна і дата слід знайти у даних цитування. Крім того, ви можете скористатися списком листування користувачів KMyMoney за адресою kmymoney2- user@ lists. sourceforge. net, щоб дізнатися, які параметри працюють для інших користувачів вашої країни."
691,- Muggles?,- Муглі?,- Магли?
692,The only time I'm not is... It's when I'm in the gym and I'm training with you.,Я перестаю бути таким лише коли я тренуюся у вас у залі.,Только когда я буду в спортзале и тренируюся с тобой.
693,"Well, um, how old are you?","Хм, а скільки тобі років?",А скільки тобі років?
694,Icons will be used without applying any effect.,Піктограми використовуватимуться без застосування будь- якого з ефектів.,Піктограми буде використано без застосування будь- якого ефекту.
695,"""Lester, this was an accident.""","""Лестере, це був нещасний випадок"".","""Лестер, это был несчастный случай."""
696,Cannot create folder %1. Check that you have write permission in the parent folder or that the connection to %2 is valid.,Не вдається створити теку% 1. Перевірте чи ви маєте право запису до батьківської теки або чи з' єднання з% 2 чинне.,Не вдається створити теку% 1. Перевірте чи ви маєте дозвіл на запис до батьківської теки або чи з' єднання з% 2 є дійсним.
697,I did not come to America to live like an Arab.,"Я не для того приїхала в Америку, щоб жити як арабка.","Я приїхав до Америки не для того, щоб жити як араб."
698,"Otherwise, why does he have Blackstones keeping us away from it?","В іншому випадку, чому він повинен Blackstones тримати нас подалі від нього?","Інакше, чому він тримає нас подалі від цього Блекстоуна?"
699,I did,Хотів.,Так.
700,Hostname,Назва вузла,Назва вузла
701,"If you do n't have a key, & kgpg; will automatically pop up the key generation dialog at the first startup. You can also access it in the Key Manager from Keys Generate Key Pair.","Якщо у вас немає ключа, & kgpg; автоматично відкриє діалогове вікно створення ключа під час першого запуску програми. Відкрити це вікно можна також у засобі керування ключами за допомогою пункту меню Ключі Створити пару ключів.","Якщо у вас немає ключа, & kgpg; автоматично відкриє діалогове вікно створення ключів під час першого запуску. Крім того, ви можете отримати доступ до нього за допомогою пункту Керування ключами за допомогою пункту меню Клавіші Створити пару ключів."
702,"I'm not your priest, but if I was, I think...","Я не твій священик, але якби був ним, то думаю...","Я не ваш священик, але якби я був, я думаю..."
703,I guess not.,"Так, мабуть.","Думаю, що ні."
704,The very first humans on Mars?,Найперші люди на Марсі?,Найперші люди на Марсі?
705,"Yeah, it was a mistake.","Так, як я говорив, відбулася помилка.","Да, это была ошибка."
706,Insert submenu widget into the popup menu. Use -1 as the index to insert at the end. The icon is optional.,"Вставити віджет підменю у вигулькне меню. Скористайтеся індексом - 1, щоб вставити у кінець. Піктограма є необов’ язковою.","Вставити віджет підменю до контекстного меню. Скористайтеся індексом - 1, щоб вставити у кінець. Піктограма є необов' язковою."
707,"You're needed here, Dr. Yedlin.","Ви потрібні тут, Dr. Едлін.","Ви потрібні тут, Dr. Едлін."
708,"That I've come to destroy your cities, burn down your homes, murder you, and orphan your children.","Я знаю, що вам сказала Серсея. Що я прийшла знищити ваші міста, спалити ваші домівки, вбити вас, залишивши ваших дітей безбатченками.","Що я прийшов зруйнувати ваші міста, спалити ваші домівки, вбити вас, і ваших дітей-сиріт."
709,And I will live forever.,І я житиму вічно!,І я житиму вічно.
710,& Saturation:,& Насиченість:,& Насиченість:
711,It's been a pleasure knowing you.,Приємно було познайомитися. Оревуар!,Приємно було познайомитися.
712,That's what I heard.,Я чув про це.,"Це те, що я чув."
713,I've had it.,З мене досить.,З мене досить.
714,Christina?,Крістіно?,Крістіно?
715,"Copying %1 MiB/ second, estimated time left: %2","Копіювання% 1 МБ/ секунду, оцінка залишкового часу:% 2@ info/ plain","Копіювання% 1 МБ/ секунду, оцінка залишкового часу:% 2"
716,Thank you.,"Його діяння підпадають під 148 статтю, 1 параграфу, Кримінального Кодексу.",Дякую.
717,What's the matter with you?,Та що з вами?,Що з тобою?
718,You gonna be finished soon?,"Еріку, тихіше.",Ти скоро закінчиш?
719,"Now, go put your clothes on, get in the car, and lets go to work.","Вдягайся, лізь в машину та їдьмо на роботу.","А тепер піди одягайся, сідай в машину і їдьмо на роботу."
720,Me and Dutch both got one.,У нас з Датчем теж є такі запальнички.,Я і Датч отримали один.
721,They are losing water now.,І втрачають воду.,Тепер вони втрачають воду.
722,- Did you want anything else?,- Ще щось хотіли?,- Хочеш ще чогось?
723,the one that put you in the wheelchair.,"Ту, що засадила вас у візок.","та, що поклала тебе в інвалідний візок."
724,He was here.,Він був тут.,Він був тут.
725,I like red wine better than white.,"Я люблю більше червоне вино, а не біле.","Я більше люблю червоне вино, ніж біле."
726,"Now, Baron. Which hand did you touch me with?","Кажи, барон, якою рукою ти торкався мене?","Барон, якою рукою ти торкався мене?"
727,We're with you.,Ми на твоєму боці.,Ми з тобою.
728,Emotes,Емоційки,Емоції
729,And fuck you if you're already thinking it.,"І, хай вам грець, якщо ви якраз подумали про це.","І пішов ти, якщо ти вже про це думаєш."
730,He picks me up.,Він мене забере.,Он забрал меня.
731,Clear the line and get to Duke's.,"Чорт, Коґґінсе.",Очисти линию и подойди к Дюку.
732,Been going on for a long time.,"Напевно, дуже старої.",Проходил долгое время.
733,- Hey.,- Привіт.,- Привет.
734,The regular expression token * can be used in the application and object arguments.,У параметрах програми і об’ єктів можна використовувати шаблон заміни формальних виразів *.,У параметрах програми і об' єктів можна використовувати ключ формального виразу *.
735,Bring me that glass of milk.,Принеси мені ту склянку молока.,Принеси мені склянку молока.
736,One of the selected packages failed to install correctly. More information is available in the detailed report.,Один з позначених вами пакунків не вдалося належним чином встановити. Детальнішу інформацію наведено у докладному звіті.,Один з позначених вами пакунків не вдалося належним чином встановити. Докладніше про це можна дізнатися з докладного звіту.
737,We have to see them.,Ми маємо їх бачити.,Ми повинні їх побачити.
738,Listen to me.,Послушай меня.,Послушай меня.
739,I had only been in service for five days.,Я служив там лише п'ять днів.,Я служив лише п'ять днів.
740,So long as they're happy.,"До того часу, поки вони щасливі.","До тех пор, пока они счастливы."
741,Settings Configure Shortcuts...,Параметри Налаштувати скорочення...,Параметри Налаштувати скорочення...
742,If the inspector dialog is not showing use the Tools Show inspectors menu item. To work with entities click on the Entities tab of dialog shown.,"Якщо діалогове вікно інспектора не було показано, скористайтеся пунктом меню Інструменти Показати інспекторів. Щоб розпочати роботу з елементами, оберіть вкладку Елементи у діалоговому вікні, що відкриється.","Якщо діалогове вікно інспектора не було показано, скористайтеся пунктом меню Інструменти Показати інспекторів. Щоб працювати з елементами, натисніть вкладку Елементи у діалоговому вікні, яке буде відкрито."
743,She's on the roof.,ОНА НАХОДИТСЯ НА КРЫШЕ.,Вона на даху.
744,"Oh, just that.","Та ну, дрібниці.",Вот так.
745,Always ruining everything!,- Вічно ти все псуєш!,Завжди все руйнуючи!
746,"- Yeah, I'm on my way out...","Подумав, може ти приєднаєшся...","- Да, я уже ухожу..."
747,"It's warm there, even at night, yes...",Там тепло. І вночі також...,"Там тепло, навіть вночі, так..."
748,I like that.,Мені подобається.,Мені подобається.
749,"Ladies and gentlemen, unfortunately we have to stop.","Шановні присутні, на жаль ми мусимо перервати.","Пані та панове, на жаль, ми повинні зупинитися."
750,Unable to eject media.,Не вдається виштовхнути носій.,Неможливо виштовхнути носій.
751,"Why, what happened to your ankle?",А що сталося з твоєю щиколоткою?,"Почему, что случилось с лодыжкой?"
752,I said get outta there.,Забирайтеся звідти.,"Я сказав, забирайся звідти."
753,I'd be dying to get back in the action.,"Я б здох, аби зайнятися справою.","Я б помирав, щоб повернутися до дії."
754,Calculate the area between:,Обчислити площу між:,Обчислити площу між:
755,Pause,Пауза,Пауза
756,Compression method for archive:,Метод стиснення архіву:,Метод стискання архіву:
757,Konversation Channel List: %1 - %2,Список каналів Konversation:% 1 —% 2,Список каналів Konversation:% 1 -% 2
758,"The atmosphere bends light passing through it, like a lens. If this item is checked, this ""atmospheric refraction"" will be simulated in the sky map. Note that this correction is only applied when using the Horizontal coordinate system.","Атмосфера, подібно до лінзи, викривляє промені світла, що проходять крізь неї. Якщо буде позначено цей пункт, цю « атмосферну рефракцію » буде змодельовано на карті неба. Зауважте, що ця корекція застосовна, лише якщо використано горизонтальну систему координат.","Атмосфера вигинає світло, що проходить крізь неї, як об' єктив. Якщо цей елемент увімкнено, цю "" атмосферну рефракцію "" буде симулюватись на карті неба. Зауважте, що цю корекцію буде застосовано, лише якщо використано горизонтальну систему координат."
759,"Well, if you give it to me, Don Luis will be very happy and very grateful.","Що ж. Якщо ти мені її даси, Дон Луїс буде просто щасливий і дуже вдячний.","Ну, якщо ти мені його даси, Дон Луїс буде дуже щасливий і дуже вдячний."
760,He promised me to come.,Він обіцяв мені прийти.,Він пообіцяв мені прийти.
761,- Battalion will be happy to see you.,- В батальйоні будуть раді Вас бачити.,- Батальйон буде радий тебе бачити.
762,"Oh, Charlie.","О, Чарлі.",оу Чарлі.
763,I'll speak to you later.,Поговорімо пізніше.,Поговоримо пізніше.
764,I've waited 17 years to get my throne back.,Я чекав 17 років щоб повернути мій трон,"Я чекав 17 років, щоб повернути трон."
765,Is he a viable contact for this mission?,Він придатний для цієї місії?,Чи є він життєздатним зв'язком для цієї місії?
766,Client side authentication,Розпізнавання на стороні клієнта,Автентифікація на стороні клієнта
767,"Into our midst came a stranger from a strange land, covered in scars and draped in a cloak of dragon skin.","Серед нас був незнайомець з далекої країни, вкритий шрамами й закутаний у плащ із драконячої шкіри.","Серед нас був незнайомець з чужої землі, вкритий шрамами і вкриті плащем з драконячої шкіри."
768,Big deal... 'cause they cure cancer in rats... that doesn't mean they dont blow shit up!,"Велика біда. Тільки тому, що вони лікують рак... на мишах, не значить, що вони не підірвуть нас.","Велика справа... тому що вони лікують рак щурами... це не означає, що вони не підривають лайно!"
769,Beyond the kid and the need for money...,У неї дитина і грошенят не вистачає...,Крім дитини і потреби в грошах...
770,We can't take or sell anything.,"Ми нічого не зможемо, ані забрати, ані продати.","Ми не можемо ні брати, ні продавати."
771,Nai.,Най.,Ні.
772,– Several sensors show it.,– Декілька сенсорів це показують.,"Це видно з того, що ми бачимо по п'ятах."
773,- Isn't it?,- Да?,- Правда?
774,Enhanced Browsing Plugin,Додаток розширеної навігаціїName,Додаток розширеної навігаціїName
775,There's a camper there.,Там стоїть автокараван.,Там лагерь.
776,Remember Brooks Hatlen?,- Пам'ятаєш Брукса Хетліна?,Пам'ятаєш Брукса Хатлена?
777,Add Equalizer Preset,Додати конфігурацію еквалайзера,Додати шаблон еквалайзера
778,I wanted you to see it before we start hacking it to bits.,"Я хотів, щоб ви це побачили, перш ніж ми почнемо видобуток.","Я хотів, щоб ви побачили це, перш ніж ми почнемо розбивати його на шматки."
779,Reverts the last change that was made to the contact list by Edit Undo,"Скасовує останню зміну, яку було внесено до списку контактів дією Правка Вернути","Скасовує останню зміну, яку було внесено до списку контактів за допомогою пункту меню Правка Вернути"
780,What the [bleep] is that?,Шо це за фігня?,Що це за фігня?
781,Let me just take a look... McMURPHY:,"- Дозвольте, тільки погляну...",Я просто гляну...
782,Get the ball.,Візьми м'ячик.,Візьми м'яч.
783,"Guys,",Друзі.,"Ребята,"
784,The guy's got a cannon.,У парня пистолет.,У парня пистолет.
785,Sorry. I am not able to export this puzzle type (yet),Вибачте. Ще не вмію експортувати головоломки цього типу.,Вибачте. Я не можу експортувати цей тип складанки (ще)
786,Are you sure you wish to convert the selected image(s) to black and white? This operation cannot be undone.,Ви справді бажаєте перетворити обрані зображення у чорно- білі? Результат цієї операції незворотний.,Ви справді бажаєте перетворити вибране зображення на чорно- біле? Цю дію не можна скасувати.
787,Send and Receive Facsimiles,Відправлення та отримання факсів,Відіслати і отримати зображення
788,I'm not...,І не...,Я не...
789,View Split View,Перегляд Розділити перегляд,Перегляд Розділити перегляд
790,Stop trying to fuck with my head.,Й годі мені баки забивати.,Не пытайся трахнуть мою голову.
791,Browse through the filesystem,Перегляд файлової системи,Перегляд файлової системи
792,Throw him out!,Викинь його!,Викинь його!
793,Who was that guy in The Lighthouse?,Що це був за хлопець в Lighthouse?,Хто той хлопець у Lighthouse?
794,"Well, he got up to stage four after drinking that brake fluid.","Виглядає, що, після того, як хильнув гальмової рідини, перейшов у 4 стадію.","Ну, он встал на четвертую стадию после того, как выпил эту жидкость для гальма."
795,"For the honor of my home, I fought and killed under a king I loathed.","За честь мого дому, я бився та вбивав під королем, до якого відчував відразу.","За честь мого дому я бився і вбивав під королем, якого ненавидів."
796,"- Well, yes, but...","- Ну, ніби так, але...","- Ну, так, але..."
797,"That was 15 years ago, Ollie.","Це ж було 15 років тому, Олі.","Це було 15 років тому, Оллі."
798,"If anything's wrong, anything at all, we leave.","І якщо щось не так, хоч що-небудь - ми йдемо.","Если что-то не так, то мы уходим."
799,Geometry Properties,Геометричні властивості,Властивості геометрії
800,I got it.,Я візьму.,Я понял.
801,He casts his ulti as well.,Він застосовує ульт.,Він також кидає ульт.
802,You playing me?,Ти зі мною граєшся?,Ти зі мною граєш?
803,Hold the line!,Тримати лінію!,Тримати лінію!
804,I had fun talking to you on stage.,Приємно було з тобою на сцені виступати.,Мені було весело поговорити з тобою на сцені.
