,EN,UK,TRANSLATION
524,Sounds like someone's not too happy to see her yesterday.,"Звучить так, ніби ти не був радий побачити її вчора.","Похоже, кто-то не очень рад видеть ее вчера."
525,"Yeah, it's more than enough.","У Патріка вимкнулася дихальна система, вони її лагодять. У нього це ламається частіше, ніж у мене.","Да, этого более, чем достаточно."
526,"%1: Hubble Space Telescope, operated by STScI for NASA [public domain]","% 1: Космічний телескоп « Хаббл », керований НІКТ для НАСА [для публічного доступу]","% 1: Космічний телескоп "" Хаббл,"" керований STScI для NASA [публічний домен]"
527,Fire crew!,Гармати до бою!,Пожежа!
528,You're up late.,Щось ти пізно.,Ти пізно.
529,Definitely.,"Я только ""за"".",Безумовно.
530,It's my dessert.,Це мій десерт.,Це мій десерт.
531,- Hi.,- Вітаю.,- Привіт.
532,The maximum number of bullets a player can have on the screen.,"Максимальна кількість куль, які може мати гравець.","Максимальна кількість куль, які може мати на екрані гравець."
533,Harry!,Гаррі!,Гаррі!
534,I can not help laughing to see him dance.,"Коли я бачу, як він танцює, я не можу втриматися від сміху.","Я не можу втриматися від сміху, коли бачу, як він танцює."
535,"Lovely species, the Aplans.",Аплани - це щось.,"Прекрасний вид, Аплани."
536,GRAY/ Alpha16 Histogram,Вимірювання,Гістограма GRAY/ Alpha16
537,"Hey, thanks for going along with my story.","Дякую, що підтвердив мою історію.","Эй, спасибо, что согласилась со мной."
538,Credits and Licenses,Подяки і ліцензії,Подяки і ліцензії
539,- I get it.,- Розумію.,- Я понимаю.
540,Get out of here!,Йдіть!,Забирайся звідси!
541,"The men, Stil, can't possibly imagine what my intentions are.","Люди, Стільгаре, навіть уявити моїх намірів не можуть.","Чоловіки, Стільгаре, не можуть уявити, які мої наміри."
542,- You okay?,- Ти у порядку?,- Ты в порядке?
543,"Ringo, Paul.","Рінго, це Пол.","Ринго, Пол."
544,"Before you make this change, ensure that you have a way to reboot your system if a problem occurs. This might be a rescue floppy-disk provided by your operating system distribution or a specially-designed rescue floppy-disk, such as tomsrtbt. Ignore this advice at your peril.","Перш ніж вносити цю зміну, переконайтеся, що ви зможете перезавантажити вашу систему, якщо виникнуть проблеми. Врятувати систему може рятівний гнучкий диск або компакт- диск, що постачається з вашою операційною системою. За наслідки ігнорування цієї поради відповідатимете лише ви самі.","Перш ніж ви внесете цю зміну, переконайтеся, що маєте змогу перезавантажити вашу систему, якщо виникають проблеми. Це може бути рятувальний диск, що постачається вашим дистрибутивом операційної системи або спеціально підписаним рятувальним диском, наприклад, Tommrtbt. Ігноруйте цю пораду у вашій небезпеці."
545,They will shoot my children.,Вони застрілять моїх дітей.,Вони застрелять моїх дітей.
546,I'm on my way to visit my friend Kyle because we had a bet that if I could prove leprechauns were real he would suck my balls,"Якщо ви справжній американець, то ви обожнюєте шаурму Але ви напевно терпіти не можете криваві плями на нижній білизні","Я иду к моему другу Кайлу, потому что мы поспорили, что если бы я смог доказать, что лепречаны были настоящими, он бы отсосал мои яйца."
547,Be seeing you,До побачення.,До зустрічі.
548,Sorry to disappoint you.,"Вибач, що тебе розчарував.","Простите, что разочаровал вас."
549,"Brightness: Slider to control the brightness value of all colors used. The brightness value can range from 0 to 200. Values greater than 100 will lighten the print. Values less than 100 will darken the print. Additional hint for power users: This KDEPrint GUI element corresponds to the CUPS command line job option parameter: -o brightness=... # use range from ""0"" to ""200""",Яскравість - повзунок контролює яскравість всіх кольорів при друці. Яскравість може приймати значення від 0 до 200. Значення більше 100 будуть освітлювати надруковане зображення. Значення менші за 100 зроблять надруковане зображення більш темним. Додаткова інформація для досвідчених користувачів - цей елемент інтерфейсу програми відповідає параметру командного рядка CUPS: - o brightness=... # число від « 0 » до « 200 »,"Яскравість: Повзунок для керування яскравістю всіх кольорів, які використовуватимуться. Значення яскравості може бути від 0 до 200. Значення, більші за 100, полегшать друк. Значення менші за 100 затьмарюють друк. Додаткова інформація для досвідчених користувачів - цей елемент інтерфейсу програми відповідає параметру командного рядка CUPS: - o lume=... # використовувати діапазон від "" 0 "" до "" 200 """
550,You got it.,Буде виконано.,Ти зрозумів.
551,"I know you don't understand, but you have to come with me.","про все. Знаю, ти не розумієш, тож просто пішли зі мною.","Я знаю, ты не понимаешь, но ты должен пойти со мной."
552,-Hm.,-Угу.,- Гм.
553,But what's the blackout part?,але що за повне відключення?,Але яка частина відключки?
554,Look to your right.,Поглянь в правий бік!,Дивіться праворуч.
555,That's really weird.,"Дякую. - Ну все, ходімо.",Це дуже дивно.
556,Look at him.,Гляньте на нього.,Посмотри на него.
557,We all got the Christmas card-- Cinnamon.,Він нам усім посилав цю листівку на Різдво... Кориця.,Ми всі отримали різдвяну листівку... Кориця.
558,Why was Qyburn here?,- Що Квіберн робив тут?,Чому Квіберн був тут?
559,Any Tag,Будь- яка мітка,Будь- яка мітка
560,Did you feel the earthquake this morning?,Ти відчув землетрус сьогодні рано?,Ти відчув землетрус сьогодні вранці?
561,Rhodes and Stark out.,- Кінець зв'язку.,Родс і Старк.
562,"You're getting hard right now, aren't you?","Дашь знать, когда снова захочешь целоваться.","У тебе зараз з'являються проблеми, чи не так?"
563,It's been a long time.,Давно.,Давно не бачилися.
564,Show Rating Computations,Показувати підрахунок рейтингу,Показувати доповнення оцінок
565,"Maxine Angelis, New York Journal.","Максін Енджеліс, з ""Нью-Йорк Джорнал""","Максін Енджеліс, New York Journal."
566,Save As...,Зберегти як...,Зберегти як...
567,Formatting with BSD on a user-given device is only possible with UFS,Форматування користувацького пристрою на BSD можливе тільки з файловою системою UFS,"Форматування BSD на пристрої, який надає користувач, можливе лише з UFS"
568,You talk to anyone while you were there?,Еммм ... в сенсі?,"Ти розмовляєш з кимось, поки був там?"
569,- No discussion.,- Без дискусій.,- Никаких разговоров.
570,I'll send in Eugene.,Я пришлю Євгена.,Я пришлю Юджина.
571,"Loading module ""%1"" and ""%2"" has failed: stop.",Спроба завантаження модуля «% 1 » і «% 2 » зазнала невдачі: зупинка.,"Спроба завантаження модуля ""% 1 "" і ""% 2 "" зазнала невдачі: зупинка."
572,And I would do it.,І я робила це.,І я б це зробив.
573,"Wait a second... boom, right there, you see that?","Секундочку... бум, вот здесь, видишь?","Секундочку... бум, прямо там, видишь?"
574,Who else knows?,Хто ще про це знає?,Хто ще знає?
575,Upload photos to Flickr,Надсилання фотографій на Flickr,Вивантажити фотографії на Flickr
576,McMURPHY: Home safe and sound.,Удома живі-здорові.,Дома в безопасности и звуке.
577,All frozen?,Усі заморожені?,Все замерзли?
578,I don't want to discuss it.,Я не хочу цього обговорювати.,Я не хочу це обговорювати.
579,Import Mode,Режим імпортування,Режим імпортування
580,"I knew you were a danger to me, especially after Halloween.","Що ти мені небезпечний, я давно знав, але напевно після Дня Всіх Святих.","Я знал, что ты в опасности для меня, особенно после Хэллоуина."
581,"Yes,well,I didn't have a boyfriend then and jake was still cute.","так,але я не мала коханого тоді і Джейк був ще привабливий.","так, що ж, в мене не було хлопця тоді а Джейк був ще гарненький."
582,"Oh, yeah, I'm gonna have to tip her.","оу, так. я збираюся залишити їй чайові.","оу, так, я збираюся дати їй чайові."
583,"- Hello, Ron.","— Привіт, Рон.","- Привіт, Роне."
584,United Kingdom,Сполучене Королівствоworld. kgm,Великобританія
585,Who told you this?,Хто тобі це сказав?,Хто тобі це сказав?
586,There something you wanted?,Ти чогось від мене хочеш?,Ти щось хотів?
587,They said they were going to kill you.,"Вони сказали, що збираються вбити тебе","Вони сказали, що вб'ють тебе."
588,ROLES_OF_TRANSLATORS,Юрій Чорноіван yurchor@ ukr. net Переклад українською,Юрій Чорноіван yurchor@ ukr. net Переклад українською
589,Page Layout Problem,Помилка компонування сторінки,Проблема з компонуванням сторінки
590,"- That means you, Private Blithe.","- Вас це теж стосується, рядовий Блайт.","- Це означає тебе, рядовий Блайт."
591,"No, sir.","- Ні, сер.","Ні, сер."
592,You got the Come'N'Shop and Shop'N'Come bags?,Прямо у полі. Ти взяв пакети ''Йди і купи'' і ''Купи та йди''?,"У тебе є пакети "" Йди і купи ""?"
593,An inflatable hippo pool?,Надувний басейн?,Надувний басейн для бегемотів?
594,Did you believe me?,Ти віриш мені?,Ти мені повірив?
595,I'm... I'm done here.,С меня хватит.,Я закончила здесь.
596,& Overwrite All,Перезаписати всі,Перезаписати всі
597,I've never stuck a toe in myself.,я ніколи так сильно не працював ногами.,Я ніколи не тримав палець в собі.
598,(POLICE RADIO CHATTER),(Поліцейські радіопереговори),(ПОЛІЦІЯ RADIO CHATTER)
599,Trying to Determine the Gender - Hadifix Plug In,Перевірка. The voice is unknown,Спроба визначення додатка Gender - Hadifix in
600,"- Yeah, I have... Mr Fancy Pants.","- Таак, випила.. містер Сцикло.","- Так, у мене... містер Вишукані Штанці."
601,We would have been anyway!,Ми б випарувалися в будь-якому разі!,Мы бы все равно появились!
602,It's really dark down here.,Здесь внизу очень темно.,Здесь внизу очень темно.
603,All right!,ЗА СВОБОДУ! СТОЯТЬ!,Добре!
604,This option specifies if Tidy should strip out surplus presentational tags and attributes replacing them by style rules and structural markup as appropriate. It works well on the HTML saved by Microsoft Office products.,"Цей параметр визначає чи слід Tidy обрізати додаткові теґи показу і атрибути, замінюючи їх на правила стилю та структурну розмітку, відповідно. Це добре спрацьовує для HTML збережених у продуктах Microsoft Office.","За допомогою цього пункту можна вказати, чи слід Tidy вирізати зайві теґи і атрибути, які замінять їх на правила стилю і структурну розмітку. Цей параметр добре працює у HTML збереженому продуктами Microsoft Office."
605,"There's gotta be somewhere, man.",Має бути якесь місце.,Має бути якесь місце.
606,"We can take 'em to your house, show 'em the pod.","Я все поясню. Суд треба відвести до тебе додому, показати кокон.","Ми можемо відвести їх до вашого будинку, показати їм капсулу."
607,It's your father.,Батько дзвонив...,Це твій батько.
608,"- Oh, shit.","Мені там відріжуть... Ох, біс!",- Вот дерьмо.
609,Original author and former maintainer,Перший автор та колишній супровідник,Перший автор і колишній супроводжувач
610,It's in between my fingers.,Він між моїми пальцями.,Він знаходиться між моїми пальцями.
611,I told you what I saw.,"Я говорю тобі те, що бачу.","Я рассказал тебе, что видел."
612,You want to help me out?,"Ви хочете, щоб допомогти мені?",Хочешь помочь мне?
613,There's a hidden forest just up the Dorian river.,У таємному лісі вище по річці Доріан.,Біля річки Доріан лежить схований ліс.
614,This is like a job interview.,Це схоже на співбесіду.,Це схоже на співбесіду з працевлаштування.
615,"- Unless... - Man, he plans on taking all the money.",Якщо тiльки вiн не планує забрати всi грошi.,"Если только... - Чувак, он планирует взять все деньги."
616,Just about to get started.,Щоб почати.,Начинаем.
617,"Get filmed next to King Sobieski, and they'll need you till the end.","Якщо нас знімуть поруч Собеського, то потім ми будемо у кадрі весь час.","Знімайте поряд із Собескі, і вони потребуватимуть тебе до кінця."
618,You got me?,Зрозумів?,Ти мене зрозумів?
619,I don't think he'd want me to tell you.,"Навряд чи він захотів би, щоб я вам розповідав.","Не думаю, що він хотів би, щоб я тобі розповів."
620,We're never going to war over there.,Ми ніколи не воюватимемо там.,Ми ніколи не воюватимемо там.
621,When I unpack them in my own club.,Розберу їх коли матиму свій клуб.,Коли я розпакую їх у своєму клубі.
622,You got a secret supply of pills?,Хтось нелегально постачає тебе ними?,У тебя есть тайный запас таблеток?
623,But I rejoiced to see such devastation,"Але я радів, дивлячись на таке розорення.","Але я радів, коли побачив таке спустошення."
624,But that's irrelevant.,Але це не має значення.,Але це не має відношення до справи.
625,"- Well, you fell off your broom.",- Ти впав з мітли.,"- Ну, ти впав з мітли."
626,"Error in repositories. xml at line %1, column %2: %3","Помилка у файлі repositories. xml, рядок% 1, позиція% 2:% 3","Помилка у сховищі. xml у рядку% 1, позиція% 2:% 3"
627,Rounded Rectangles,Прямокутники з заокругленими кутами,Округлені прямокутники
628,Unable to Load Dialog,Неможливо завантажити діалогове вікно,Не вдалося завантажити діалогове вікно
629,"All right, everyone, gather around!","Чудово! Давайте, усі сюди!","Гаразд, всі, зберіться навколо!"
630,Alternative name of the location.,Інша назва місця.,Інша назва місця.
631,The current & FAQ; maintainers are:,Поточний супровід ЧаПу:,Поточними супровідниками ЧаПу є:
632,Are you freaking kidding me?!,Це в тебе такі жарти?!,"Ти що, знущаєшся з мене?!"
633,"You know my daddy, I said that my daddy!","Ви знаєте, мій тато... Я кажу - мій тато!","Ты знаешь моего папу, я сказал, что мой папа!"
634,"Well, that is why we test it on chimps.",Саме тому ми його випробовуємо на шимпанзе.,Ось чому ми випробовуємо шимпанзе.
635,- In two minutes?,За дві хвилини?,- Через дві хвилини?
636,I do.,Правда люблю.,Так.
637,Scan Preview,Перегляд сканування,Перегляд сканування
638,Maybe you're not the suicidal type.,"Мабуть, ти просто не суїцидний тип.","Может, ты не самоубийство."
639,"If you smile too much, you're delusional or you're stifling hysteria.","Як ви багато посміхаєтеся, вирішать, що у вас марення або істерія.","Якщо ви забагато посміхаєтеся, то ви бредите або істерикою притуплюєте."
640,You'll be trained separately from the Dauntless-born... but you'll be ranked together.,"Вас тренуватимуть окремо від народжених Безстрашними, але оцінюватимуть вас разом.","Вас будуть тренувати окремо від народжених Безстрашними, але ви будете згруповані разом."
641,I'm going in.,Буду углубляться.,Я йду.
642,Reminder every,Нагадування кожні,Нагадування кожні
643,"It's, wassup and my fella.",- Московський чижик тобі брателло!,"Це, розпушування і мій хлопець."
644,- A bar.,- У барі.,- Бар.
645,Other Switches,Інші перемикачі,Інші перемикачі
646,On your feet.,Підводьтеся.,Підйом.
647,Moves the selected messages to a certain folder.,Пересуває вибране повідомлення до певної теки.,Пересуває вибрані повідомлення до певної теки.
648,Blanking,Очищення,Очищення
649,Unknown error (%1),Невідома помилка (% 1),Невідома помилка (% 1)
650,Could be anything.,Може бути що завгодно.,Может быть что угодно.
651,I understand.,﻿Я розумію.,Я розумію.
652,"Sit down, will you?",Сядеш ти чи ні?,"Сідай, будь ласка."
653,Step over Instruction,Перейти до наступної & інструкції,Перейти до наступної інструкції
654,"A README file in each template will allow you to find out how to build the template. It will also give you links for tutorials related to the project. After the project is generated, & kapptemplate; 's job is finished and you are on your own to build it.","За допомогою файла README у кожному з шаблонів ви зможете дізнатися про те, які зібрати шаблон. Там також наведено посилання на підручники, пов’ язані з проектом. Після створення проекту завдання & kapptemplate; буде виконано і ви зможете зібрати проект власноруч.","За допомогою файла README у кожному з шаблонів ви зможете дізнатися про те, як побудувати цей шаблон. Крім того, програма надасть вам змогу знайти посилання на підручники, пов' язані з проектом. Після створення проекту завдання & kapptemplate; буде завершено і ви зможете зібрати його власноруч."
655,"Mom, I want to move back home.","Мамо, я хочу перебратися додому.","Мамо, я хочу повернутися додому."
656,Not reckless.,Не про легковажність.,Не безрассудно.
657,Preparing to head below deck.,Зберіться на головній палубі.,Приготуватися до підйому під палубою.
658,Albus.,Альбуc.,Альбусе.
659,We just jumped. They want us to jump again?,Ми тільки що стрибнули.,"Вони хочуть, щоб ми знову стрибнули?"
660,"I didn't come to help you, Claire.","Я не допомагати тобі прийшов, Клер.","Я пришел не помочь тебе, Клэр."
661,I have a person with a rifle in the stadium.,На стадіоні - мій снайпер.,У меня есть человек с винтовкой на стадионе.
662,Do you remember when we first met?,Ти пригадуєш нашу першу зустріч?,"Пам'ятаєш, коли ми вперше зустрілися?"
663,My motherly concern is not for him because he's not my son.,"Мої материнські страхи не через нього, тому що це не мій син.","Моя материнська турбота не для нього, тому що він не мій син."
664,I was hoping you'd come.,"Я сподівався, що ти прийдеш.","Я сподівався, що ти прийдеш."
665,What did you do?,І що ти зробила?,Що ти наробив?
666,It's so nice to be home.,Добре бути вдома.,Так приємно бути вдома.
667,I was busy learning who funds the Sons of the Harpy.,"Затримався дізнаючись, хто фінансує Синів Гарпії.","Я був зайнятий тим, що дізнався, хто фінансує Сина Гарпії."
668,Autocrop,Автообрізання,Автообрізання
669,We need your help.,Нам потрібна твоя допомога.,Нам потрібна твоя допомога.
670,My father loved a woman.,Мій батько любив жінку.,Мій батько любив жінку.
671,entry missing id,в записі немає ІД,в записі немає ІД
