Unnamed: 0,DE,EN,TRANSLATION,BLEU_Score,avg
698,"- Ich dachte, Bertie würde sein Gebiss verlieren.",- I thought Bertie would drop his teeth.,"- Ich dachte, Bertie würde seine Zähne fallen lassen.",0.44632361378533286,0.13855489357388123
699,"Es tut mir auch leid, Frau Piantoni.","And I'm sorry, too, Mrs. Piantoni.","Und ich bin auch leid, Mrs. Piantoni.",7.711523862191631e-155,0.13855489357388123
700,"Doch es sieht nicht so aus, als würden sie so schnell ein Liebespaar werden.","Doch es sieht nicht so aus, als würden sie so schnell ein Liebespaar werden.","Doch es sieht nicht so aus, als würden sie so schnell ein Liebespaar werden.",1.0,0.13855489357388123
701,Bei den meisten Prüfungen auf chronische Toxizität werden Nagetierarten verwendet; diese Prüfmethode gilt daher hauptsächlich für Prüfungen an diesen Arten.,"The majority of chronic toxicity studies are carried out in rodent species, and this Test Method is intended therefore to apply primarily to studies carried out in these species.","Die Mehrheit der chronischen Toxizitätsstudien wird bei Nagetieren durchgeführt, und diese Testmethode soll daher hauptsächlich auf Studien von diesen Arten angewendet werden.",6.434898744054132e-155,0.13855489357388123
702,"Dr. Wolfgang Sachs, geboren 1946 in München. Studium der Theologie und Soziologie in München, Tübingen und Berkeley, USA. 1980-1984 Mitarbeiter der Forschungsgruppe ""Energie und Gesellschaft"" an der Technischen Universität Berlin. 1984-87 Schriftleiter der Zeitschrift ""Development"" bei der Society for International Development, Rom. 1987-90 Visiting Professor an der Pennsylvania State University. 1990-93 Kollegiat am Kulturwissenschaftlichen Institut in Essen. Seit Mai 1993 am Wuppertal Institut für Klima, Umwelt und Energie. Seit 1993 jedes Jahr scholar-in-residence am Schumacher College, England. 1997 Lehrtätigkeit an der University of California, Berkeley, und Università La Sapienza, Rom. Mitglied im Fachbeirat Süd der Heinrich-Böll-Stiftung.","Dr. Wolfgang Sachs was born in 1946 in Munich, Germany. He studied theology and social sciences in Munich, Tübingen and Berkeley. From 1980-1984 he was member of the research group ""Energy and Society"" at the Berlin Technical University. From 1984 until 1987 he worked as the editor of the magazine ""Development"" in Rome. During 1987-1990 Wolfgang Sachs served as a professor at Pennsylvania State University, USA. From 1990-1993 he was a research fellow at the Institute for Cultural Sciences at Essen University. Since May 1993 he works for the Wuppertal Institute. He lectures widely nationally and internationally and is a regular scholar-in-residence at Schumacher College, England. His publications on development, environment, and globalisation have appeared in many languages.","Dr. Wolfgang Sachs wurde 1946 in München geboren. Er studierte Theologie und Sozialwissenschaften in München, Tübingen und Berkeley. Von 1980 bis 1984 war er Mitglied der Forschungsgruppe ""Energy and Society"" an der Berlin Technical University. Von 1984 bis 1987 arbeitete er als Herausgeber der Zeitschrift ""Development"" in Rom. Während der Jahre 1987 bis 1990 war Wolfgang Sachs Professor an der Pennsylvania State University in den USA. Von 1993 bis 1993 war er Forschungsmitglied am Institut für Kulturwissenschaften an der Universität Essen. Seit Mai 1993 arbeitet er für das Wuppertal Institute. Er hält zahlreiche Vorträge auf national und internationaler Ebene und ist regelmäßig als Residenzwissenschaftler am Schumacher College in England.",0.19529894981822846,0.13855489357388123
703,Die Regierung ist an der sache dran.,The Feds are on to the whole thing.,Die Feds sind auf dem ganzen Weg.,1.1200407237786664e-231,0.13855489357388123
704,Da müssen wir hin.,We should go there.,Wir sollten dorthin gehen.,1.2882297539194154e-231,0.13855489357388123
705,Ist sie ins Krankenhaus gezogen?,She's living at the hospital?,Sie lebt im Krankenhaus?,1.3127657569660467e-231,0.13855489357388123
706,"Richard Ellison ist kein Name, den ich noch einmal zu hören erwartet habe.",Richard Ellison is not a name I was expecting to hear again.,"Richard Ellison ist kein Name, den ich noch einmal hören wollte.",0.6728850678464081,0.13855489357388123
707,"Nun, die Gerüchte stimmen, und... ich darf Sie bekanntmachen... mit den beiden neuen Eigentümern der Opéra Populaire. Monsieur Richard Firmin und Monsieur Gilles André.","I can now tell you that these were all true, and it is my pleasure to introduce you to the two gentlemen who now own the Opera Populaire Monsieur Richard Firmin and Monsieur Gilles Andre.","Ich kann Ihnen jetzt sagen, dass dies alles wahr war, und es ist meine Freude, Ihnen die beiden Herren vorzustellen, die jetzt die Oper Populaire Monsieur Richard Firmin und Monsieur Gilles Andre besitzen.",0.19147265798368787,0.13855489357388123
708,"Nach deiner Theorie brauchte ein aztekischer Priester fünf Jahre, um von Mittelamerika hierher zu kommen.","According to your theory, it took Aztec priests five years to get here from somewhere in Central America.","Nach Ihrer Theorie dauerten es aztechische Priester fünf Jahre, um von irgendwo in Zentralamerika hierher zu kommen.",0.30277029197532096,0.13855489357388123
709,"Auf Wunsch kann Sue Booth-Forbes für interessante Programme mit irischen Musikanten, Geschichtenerzählern oder für Lesungen von Fotografen und bildenden Künstlern sorgen.","On request, Sue Booth-Forbes can arrange interesting programs with Irish musicians and storytellers or lectures by fotographers and visual artists.",Auf Wunsch kann Sue Booth-Forbes interessante Programme mit irischen Musikern und Geschichtenerzählern oder Vorträge von Fotografen und Bildkünstlern arrangieren.,0.3651625019670311,0.13855489357388123
710,"Der Austausch ermöglicht femer den angestammten Anbietern und Händlern mit erheblichen Marktanteilen, d. h. den vier größten Unter nehmen mit Anteilen von etwa 80 % am britischen Markt, ihre Marktstellung wirksamer zu verteidigen, als dies ohne die eingehenden Angaben über die Absatzzahlen ihrer Konkurrenten und Änderungen in deren Marktstellung möglich wäre.",The Exchange further helps the established firms and dealers with considerable market shares (i.e. the four biggest firms holding approximately 80 % of the United Kingdom market) to defend their market positions more efficiently than they could do without the detailed information on retail sales of their rivals and any changes thereof.,"Die Börse hilft den etablierten Unternehmen und Händlern mit beträchtlichen Marktanteilen (d.h. den vier größten Unternehmen, die etwa 80% des Marktes des Vereinigten Königreichs besitzen) außerdem, ihre Marktpositionen effizienter zu verteidigen, als sie ohne die detaillierten Informationen über den Einzelhandel ihrer Rivalen und ihre Änderungen hätten tun können.",3.446143343664425e-78,0.13855489357388123
711,Auf dem Pass (2Std23Min) (1750 m) stossen Sie auf einen Wanderweg. Biegen Sie nach rechts ab. Voraus erblicken Sie das Westmassiv von Picos De Europa. Im Westen erstreckt sich die Kantabrische Kordiliere.,"Once you have reached the pass (2h23min) (1750 m), you follow a track to the right.","Sobald Sie den Pass (2h23min) (1750 m) erreicht haben, folgen Sie einer Strecke nach rechts.",0.10439886344538728,0.13855489357388123
712,"Ich nehme an, er will damit zum Ausdruck bringen, dass er irgendwann einmal Geschichtsunterricht hatte.",I assume his purpose is to demonstrate that at one time or another he was subjected to a grammar-school course in history.,"Ich nehme an, sein Zweck ist es, zu demonstrieren, dass er zu einer Zeit oder anderen einem Grammatik-Schulkurs in Geschichte unterworfen wurde.",2.451550985545075e-78,0.13855489357388123
713,"Schickt das Jugendamt jemanden her, um ihn mitzunehmen?",Juvenile services is sending someone to take him in?,"Juvenile Services schickt jemanden, um ihn aufzunehmen?",7.1958300848837144e-155,0.13855489357388123
714,Die Gruppe könnte die Zusammenarbeit dann auf drei weitere politische Bereiche ausdehnen:,The group could then extend cooperation to three other policy areas:,Die Gruppe könnte dann die Zusammenarbeit auf drei andere Politikbereiche ausdehnen:,4.957285360692883e-78,0.13855489357388123
715,Was ist mit diesem? Das ist gut.,This is a good one.,Das ist ein guter.,3.506226123743032e-155,0.13855489357388123
716,"Ich kenne da ein paar Herren, die hervorragend geeignet wären, auf eine etwas australische Weise. Würde das helfen?",I know a couple of gentlemen who might fit the bill in an antipodean kind of way.,"Ich kenne ein paar Herren, die vielleicht auf eine Art Antipoden-Wartung in die Rechnung passen.",0.17026471729508522,0.13855489357388123
717,Das hat sie doch schon früher gewusst. - Ja.,-She must have known that earlier?,- Das muss sie schon früher gewusst haben?,4.797597231912944e-78,0.13855489357388123
718,Zusammen mit Polar Music und Union Songs werden die ABBA-Mitglieder den Bau eines Hauses für zehn Waisenkinder in der Stadt Bossangoa sponsern.,"Along with Polar Music and Union Songs, the ABBA members will sponsor the construction of a home for ten orphans in the town of Bossangoa.",Zusammen mit Polar Music und Union Songs werden die ABBA-Mitglieder den Bau eines Hauses für zehn Waisen in der Stadt Bossangoa unterstützen.,0.8232490471721702,0.13855489357388123
719,dem Bausektor führen die Finanzrestriktionen zu einer er-,"In the construction sector especially, the financial con-",Insbesondere im Bausektor ist der finanzielle,8.34076112986429e-232,0.13855489357388123
720,Kein Mensch.,"He""s not a person.",Er ist keine Person.,0.0,0.13855489357388123
721,"Jungs könnt das sicher hinbekommen, oder?","Guys should be able to work that out, right?","Die Jungs sollten das ausarbeiten können, oder?",7.711523862191631e-155,0.13855489357388123
722,Als Teil dieser Partnerschaft hat Orlando die Möglichkeit Spieler von Benfica auszuleihen.,"As part of that partnership, Orlando City signed two players from the S.L.",Als Teil dieser Partnerschaft unterschrieb Orlando City zwei Spieler aus der S.L.,0.23462350320528,0.13855489357388123
723,Nach einer Zählung aus dem Jahr 2000 hat die Stadt 20.339 Einwohner.,"As of the 2010 census, the city had a total population of 21,387.",Nach der Volkszählung von 2010 hatte die Stadt eine Gesamtbevölkerung von 21.387.,5.791739854583281e-155,0.13855489357388123
724,lesen Sie hier den Tourbericht,lesen Sie hier den Tourbericht,Sie lesen hier den Tourbericht,7.803659209895733e-78,0.13855489357388123
725,Er meidet alle.,He shuns everybody.,Er vermeidet alle.,1.646211035903463e-231,0.13855489357388123
726,"Er tut sein möglichstes, um -- ohne sich allzu sehr zu kompromittieren -- der Idee Nahrung zu verschaffen, Faurisson wäre ein altbekannter Antisemit; und erzählt die Geschichte klein-klein, auf diese Weise den Eindruck zu erwecken, sie, als Verantwortliche der Universität, hätten gar nicht anders handeln können, was, grosso modo, wohl bedeutet, sie hätten den Störenfried in die Falle laufen lassen, um sich nicht der Kritik der Gegner Faurissons auszusetzen.","He tries, without compromising himself, to give credit to the idea that Faurisson was a long-time antisemite.","Er versucht, ohne sich zu kompromittieren, der Idee zu geben, dass Faurisson ein langjähriger Antisemit war.",3.108164628794545e-156,0.13855489357388123
727,einen qualitativ immer hochwertigeren Wein herzustellen.,produce wines with increasing high quality organoleptic properties.,Wein mit zunehmenden organoleptischen Eigenschaften von hoher Qualität herstellen.,1.0518351895246305e-231,0.13855489357388123
728,"Danke. Wie spät ist es, Hank?","What time is it, Hank?","Wie spät ist es, Hank?",0.846481724890614,0.13855489357388123
729,Die Sortierfolge kann in einem Menü im Fuß des Fensters gewählt werden. Im Browser-Fenster können die Dateien in eine Dropliste im unteren Bereich des Fensters gezogen werden und dort durch Ziehen sortiert werden.,"The sorting order can be set in a menu at the bottom of the window. In the browser window files can be dragged to a drop area at the bottom of that window, in that drop list the files can be ordered by dragging.","Die Sortierungsordnung kann in einem Menü am Unterseite des Fensters eingestellt werden. In dem Browserfenster können Dateien in einen Dropbereich am Unterseite dieses Fensters gezogen werden, in dieser Dropliste können die Dateien durch Zäger gezogen werden.",0.14631973332919768,0.13855489357388123
730,"""Danebenschossen""","""By the Sea""","""Am Meer""",1.5319719891192393e-231,0.13855489357388123
731,Im Frühling 1905 begann Sabina Spielrein ein Medizinstudium an der Universität Zürich.,"Spielrein was able to begin her medical studies in 1905, graduating as a doctor in 1911.",Spielrein konnte 1905 mit ihren medizinischen Studien beginnen und wurde 1911 als Ärztin absolviert.,1.1200407237786664e-231,0.13855489357388123
732,Ich hatte letzte Nacht einen Drink auf Irland mit ein paar Freunden von beiden Richtungen.,I had a drink for Ireland last night with some friends of both persuasions.,Ich hatte gestern Abend einen Drink für Irland mit einigen Freunden beider Überzeugungen.,7.74696072333324e-155,0.13855489357388123
733,Gepäckbeförderung von Tür zu Tür,Door to door luggage carriage,Gepäckwagen von Tür zu Tür,0.668740304976422,0.13855489357388123
734,"Ich habe kein Vertrauen Zeitung Linien, sie sind annähernd und oft unzuverlässig.","I don’t trust newspaper lines, they are approximate and quite often unreliable.","Ich vertraue nicht an Zeitungslinien, sie sind ungefähr und ziemlich oft unzuverlässig.",8.190757052088229e-155,0.13855489357388123
735,"Er leitete das International Institute for Strategic Studies (IISS) in London und später die deutsche Stiftung Wissenschaft und Politik, ein Think Tank, der die Bundesregierung und den Bundestag in außenpolitischen Fragen federführend berät. Deutschland müsse, so Bertram, “die immensen Vorteile eines engen und gemeinschaftlichen Verhältnisses mit Iran” erkennen.","He used to head the International Institute for Strategic Studies in London and later the German Foundation for Science and Politics, a think tank that advises the government and parliament on foreign policy.","Er leitete das International Institute for Strategic Studies in London und später die Deutsche Stiftung für Wissenschaft und Politik, einen Denkzentrum, der der Regierung und das Parlament über die Außenpolitik berät.",0.2367419342770677,0.13855489357388123
736,"Weshalb macht er sich so unverschämt vor unseren Augen breit? Weshalb tut er, als ob er weiter nach Gründen suchen würde- wobei dieses Gründe sinnlos geworden sind, nur leere Worte, hohle Parolen, inkonsistente Logik?","Why is it deployed so shamelessly before our eyes? Why does they continue to pretend to find reasons when these reasons no longer have any meaning - they are just empty words, hollow slogans and inconsistent logic?","Warum wird es so schamlos vor unseren Augen eingesetzt? Warum tun sie so weiter, als fanden sie Gründe, wenn diese Gründe keine Bedeutung mehr haben - es sind nur leere Worte, leere Slogane und inkonsekvente Logik?",0.10920968859591808,0.13855489357388123
737,"Jetzt kommt eine dicke, fette Nahaufnahme.","Now, here comes a big, fat close-up.","Hier kommt ein großes, fettes Nahaufbild.",1.1640469867513693e-231,0.13855489357388123
738,"Freitag, 11. März 2016, 22:16 UTC+1","Mittwoch, 9. März 2016, 14:32 UTC+1","Mittwoch, 9. März 2016, 14:32 UTC+1",8.38826642100846e-155,0.13855489357388123
739,GO!!! - Fahrzeuge,GO!!! - Fahrzeuge,GO!!! - Fahrzeug,1.133422688662942e-154,0.13855489357388123
740,"Ich möchte das Haus und die Kommission darauf aufmerksam machen, dass 90% der jährlich etwa 5 000 Gesetze im Rahmen übertragener Befugnisse verabschiedet werden.",I would remind the House and the Commission that 90% of some 5 000 legislative acts adopted every year in the Union are under delegated powers.,"Ich möchte dem Parlament und der Kommission daran erinnern, dass 90% der jährlich in der Union über 5.000 gesetzgebenden Akte delegierte Befugnisse haben.",0.17763946107941184,0.13855489357388123
741,Bezeichnenderweise sehen Regierung und »Experten« in Polen bis heute keinerlei Zusammenhang zwischen Finanzkrise und Autoproduktion. Dabei war die historisch einzigartige Ausweitung der weltweiten Autoproduktion von 58 auf 73 Millionen Stück zwischen 2002 und 2007 nur auf Kredit möglich.,"Typically, government and ""experts"" in Poland still refuse to see any links between fthe financial crises and the production of automobiles. But the historically unparalleled expansion of global car production from 58 to 73 million between 2002 and 2007 was only possible on credit.","Typischerweise weigern sich die Regierung und die ""Experten"" in Polen immer noch, Verbindungen zwischen der Finanzkrise und der Automobilproduktion zu sehen. Aber die historisch unvergleichliche Erweiterung der weltweiten Automobilproduktion von 58 auf 73 Millionen zwischen 2002 und 2007 war nur auf Kredit möglich.",0.23730535009428427,0.13855489357388123
742,Ich werde mit George nachkommen.,"I´ll, uh, follow along with George.",Ich werde mit George folgen.,0.668740304976422,0.13855489357388123
743,"Gewinnen ist klasse, aber wenn ich mein Bestes gegeben habe, bin ich meist zufrieden mit dem Ergebnis, egal wie es ist.","Winning's great, but if I've done my best, I usually feel good about the outcome, no matter what it is.","Gewinnen ist großartig, aber wenn ich mein Bestes gegeben habe, fühle ich mich normalerweise gut über das Ergebnis, egal was es ist.",0.346133586314057,0.13855489357388123
744,in dem Begleitbuch Juden in Buttenhausen,- in the book Jews in Buttenhausen (only in German),- im Buch Juden in Buttenhausen (nur in Deutsch),3.661843723291765e-78,0.13855489357388123
745,Sozialdemokraten beschäftigen sich mit der Stärkung der Rolle der Frau in der arabischen Welt,S&D Euro MPs address women's empowerment in the Arab World,S&D Euro-Deputanten sprechen über die Befugnis der Frauen in der arabischen Welt,0.18798317647335086,0.13855489357388123
746,Ich friere nicht.,"- I'm not cold, sir.","- Ich bin nicht kalt, Sir.",1.384292958842266e-231,0.13855489357388123
747,Einkommen aus unselbständiger Arbeit 2001,Compensation of employees 2001,Entschädigung der Arbeitnehmer 2001,1.0032743411283238e-231,0.13855489357388123
748,- Sie widern mich an.,- You disgust me.,- Du stört mich.,1.1931009847695213e-231,0.13855489357388123
749,"1993 wechselte er wieder zu seinem Heimatverein Fredrikstad FK, wo er ein Jahr später seine aktive Karriere beendete.","He finished his career back in Fredrikstad, where he is now the assistant coach.","Er beendete seine Karriere in Fredrikstad, wo er jetzt Assistent-Trainer ist.",3.96487352767742e-155,0.13855489357388123
750,"Die Person, die ein nicht im Katalog aufgeführtes Einzelfuttermittel zum ersten Mal auf den Markt bringt, meldet den in Artikel 26 Absatz 1 genannten Vertretern des europäischen Futtermittelsektors unverzüglich seine Verwendung.","The person who, for the first time, places on the market a feed material that is not listed in the Catalogue shall immediately notify its use to the representatives of the European feed business sectors referred to in Article 26(1).","Die Person, die zum ersten Mal ein Futtermaterial auf den Markt bringt, das nicht im Katalog aufgeführt ist, notifiziert sofort die Vertreter der europäischen Futtermittelgeschäfte nach Artikel 26 (1) über seinen Einsatz.",0.1686298660722932,0.13855489357388123
751,Im luxuriösen Le Chinois Restaurant & Bar genießen Sie moderne chinesische Küche und kreative Cocktails.,The sumptuous Le Chinois Restaurant & Bar serves a modern Chinese cuisine menu and creative cocktail list.,Das sumptuöse Le Chinois Restaurant & Bar bietet ein modernes Menü für chinesische Küche und eine kreative Cocktailliste.,0.2769413275131342,0.13855489357388123
752,So steigern Sie Ihr Wohlbefinden,That's the way to increase your wellbeing,"Das ist der Weg, um dein Wohlbefinden zu erhöhen",1.0518351895246305e-231,0.13855489357388123
753,"Sag bloß nicht, du hast einen Blutschwur geleistet.",Don't tell me - you took a blood oath.,"Sag mir nicht, du hast einen Blutverheißung abgenommen.",0.3655552228545123,0.13855489357388123
754,Warum hast du es niemand gesagt?,Why didn't you tell anyone? It must've been hell keeping all that inside.,Warum hast du es niemandem gesagt?,0.488923022434901,0.13855489357388123
755,- Eine Sternkarte.,- It's a star frame.,- Es ist ein Sternrahmen.,1.2183324802375697e-231,0.13855489357388123
756,Werner Trobin trobin@kde.org.,Werner Trobin trobin@kde. org.,Werner Trobin trobin@kde.org.,1.0,0.13855489357388123
757,"Was würden Sie tun, wenn Sie sichergehen wollten, dass die Streife den Bezirk im Auge behält?","What's up, Sergeant? How would you check the patrol was keeping an eye on things?","Wie würden Sie überprüfen, ob die Patrouille die Dinge im Auge hat?",5.775070712302037e-155,0.13855489357388123
758,"Paco zeigt mir den Spannungsregler, den Joe nachts gebracht hat.",Paco here was just about to show me the regulator that Joe brought in.,"Paco wollte mir gerade den Regulier zeigen, den Joe mitgebracht hat.",7.208781414766327e-155,0.13855489357388123
759,- Ich habe bestanden?,I passed?,Ich bin vorbei?,1.1931009847695213e-231,0.13855489357388123
760,"Du hast zwei andere Gatten hier, mit denen du das machen kannst.",You got two other husbands here to do that with.,"Du hast zwei andere Ehemänner, mit denen du das tun kannst.",0.4412739850976206,0.13855489357388123
761,"Wir sind allein in dem Glauben, dass sie eine schöne Frau ist.",We are alone in believing that she is a beautiful woman.,"Wir sind alleine daran zu glauben, dass sie eine schöne Frau ist.",0.5706745777055999,0.13855489357388123
762,"Es wurde vorgeschlagen, dass die Rollen nach Entfernen aus dem Trägermechanismus auf Paletten gesetzt und mit Gurten befestigt würden. Sobald 2 Rollen auf jeder Palette platziert wären, würden das Brutto- und Nettogewicht außen angegeben und die Rollen würden in einen Lagerbereich verbracht, wo diese dann von M&R Recycling abgeholt würden.","It was proposed that once the rolls had been lifted off the support mechanism, they would be placed on pallets and secured with strapping. Once 2 rolls were positioned on each pallet, the gross and net weight were written externally and they would be removed and placed into a storage area, awaiting collection by M&R Recycling.","Es wurde vorgeschlagen, dass die Rollen, sobald sie vom Stützungsmechanismus abgezogen worden waren, auf Palletten platziert und mit einem Schleifen gesichert werden. Sobald zwei Rollen auf jede Pallet platziert waren, wurden das Brutto- und Nettogewicht extern geschrieben und sie entfernt und in einen Lagerbereich gelegt, bis sie von M&R Recycling eingehegt wurden.",0.23946958301187804,0.13855489357388123
763,Ich brauche dich am Schalter.,We need you at the desk.,Wir brauchen dich am Schreibtisch.,8.38826642100846e-155,0.13855489357388123
764,"Tako, ich hoffe, dass wir Recht behalten.","Tako, I hope we're right.","Ich hoffe, wir haben recht.",6.686701276748014e-155,0.13855489357388123
765,"Mache ich dir ein Versprechen, breche ich eines an mich selbst.","Make a promise to you, break another to myself.","Ich mache dir ein Versprechen, breche mir ein anderes.",0.2644967217413845,0.13855489357388123
766,Blinde Kuh.,Please! - Blindman's bluff.,"- Blindmans Bluff, bitte!",0.0,0.13855489357388123
767,"Soweit es mich betrifft, ist dein Chemieunterricht beendet.","As far as I'm concerned, your chemistry education is over.","Was mich betrifft, ist deine Chemie-Ausbildung vorbei.",4.352883339726264e-78,0.13855489357388123
768,"In zwei der zwölf schottischen Regionen ist der Schulbeirat im Ausschuß für die Einstellung von leitendem Lehrpersonal durch ein Mitglied vertreten (was vom zuständigen Minister empfohlen wird), während in Nordirland die Einstellung von Lehrpersonal eine der wichtigeren Aufgaben des Schulausschusses ist.","In two of the 12 regions of Scotland a school council member is represented on the selection panel for senior staff, a procedure which has been commended by the Minister, while in Northern Ireland staff appointments represent one of the more important functions of the school management committee.","In zwei der 12 Regionen Schottlands ist ein Schulratmitglied im Auswahlpanel für Senior-Mitarbeiter vertreten, ein Verfahren, das vom Minister gefeiert wurde, während in Nordirland die Personalverordnung eine der wichtigsten Funktionen des Schulverwaltungsausschusses darstellt.",0.09953942952456943,0.13855489357388123
769,Mehr Info eng(4) ger(2),More info eng(4) ger(2),Weitere Informationen eng(4) ger(2),0.7598356856515925,0.13855489357388123
770,"Nein, ihr werdet die Herrlichkeit Gottes sehen. Das ist der Höhepunkt dieses 11. Kapitels im Johannesevangelium mit Lazarus und seinen Schwestern in Bethanien.","That is the upshot of this eleventh chapter of John with Lazarus and his sisters at Bethany. Difficult as the way to it was for them, the last picture is of an emanation of the glory of God.","Das ist der Schluss dieses elften Kapiteles von Johannes mit Lazarus und seinen Schwestern in Bethania. Wie schwierig der Weg für sie war, ist das letzte Bild von einer Ausstrahlung der Herrlichkeit Gottes.",0.19568336427344607,0.13855489357388123
771,- Es wird mich umbringen.,It'll kill me.,Das wird mich töten.,7.422680762211792e-155,0.13855489357388123
772,Sie hatten keine Abtreibung.,You did not have an abortion.,Sie haben keine Abtreibung gemacht.,9.283142785759642e-155,0.13855489357388123
773,Hier ist Kanon.,It's Kanon.,Es ist Kanon.,1.133422688662942e-154,0.13855489357388123
