Unnamed: 0,DE,EN,TRANSLATION,BLEU_Score,avg
774,"Wenn man genauer hinguckt, sieht man beispielsweise auch all das, was die Oberfläche ausmacht, also die Schönheit des Bildes, die Beiläufigkeit und Leichtigkeit, mit der Bergman alltägliche Begebenheiten eingefangen hat.","If you look closer, you see everything including the surface, the beauty of the image, the casualness and lightness with which Bergman captures daily occurrences.","Wenn man näher schaut, sieht man alles, einschließlich der Oberfläche, der Schönheit des Bildes, die Unruhigkeit und Leichtigkeit, mit denen Bergman tägliche Ereignisse erfasst.",0.14350530260627867,0.13855489357388123
775,Mein Merkzettel (34),My wish list (55),Meine Wunschliste (55),1.4488496539373276e-231,0.13855489357388123
776,Deine Ticks sind weg.,Your tics are gone.,Deine Tickets sind weg.,1.0547686614863434e-154,0.13855489357388123
777,"Vier Stunden, bis Lottie hier eintrifft.",Four hours 'til Lottie gets here.,"Vier Stunden, bis Lottie hier ist.",0.7598356856515925,0.13855489357388123
778,"Woher wussten Sie, wer da ist?",How'd you know who it is?,"Woher wusstest du, wer es ist?",8.286571670851008e-155,0.13855489357388123
779,Willkommen bei Vereinigte Füllkörper-Fabriken GmbH & Co. KG,"WELCOME to Vereinigte Füllkörper-Fabriken GmbH & Co. KG (VFF),","WELCOME an Vereinigte Füllkörper-Fabriken GmbH & Co. KG (VFF),",0.4617366309441026,0.13855489357388123
780,Das Abkommen wird hier eine enge Kiste.,The treaty's gonna be a tough sell here.,Der Vertrag wird hier schwer zu verkaufen sein.,6.484592771860512e-155,0.13855489357388123
781,"Wenn wir es mit ihr aufnehmen wollen, dann werden wir Klaus brauchen.","We go up against her,",Wir gehen gegen sie.,1.7434293862051595e-232,0.13855489357388123
782,Link: zur Homepage (Kursalon),Link: zur Homepage (Peterskirche),Link: zur Homepage (Peterskirche),0.6434588841607617,0.13855489357388123
783,Ich habe versagt.,I failed.,Ich habe versagt.,1.2213386697554703e-77,0.13855489357388123
784,"Man munkelt, dass nur der Erbe von Salazar Slytherin - einer der vier Zauberer, die einst Hogwarts gründeten - Macht über das Wesen besitzt, das angeblich in der Kammer haust.","But what is the awful secret hidden in the Chamber and what has all that to do with Harry? Legend has it that only the heir of Salazar Slytherin – one of the wizards who founded Hogwarts – has power over the monster living in the Chamber. Everybody is afraid of black magic, Harry most of all doesn't want anything to do with it, but as usual is drawn into events he can do nothing about.","Aber was ist das schreckliche Geheimnis, das in der Kammer versteckt ist, und was hat das alles mit Harry zu tun? Die Legende sagt, dass nur der Erbe von Salazar Slytherin, einer der Zauberer, der Hogwarts gründete, Macht über das Monster hat, das in der Kammer lebt. Jeder hat Angst vor Schwarzmagie, Harry will vor allem nichts damit zu tun haben, aber wie üblich wird er in Ereignisse gezogen, um das er nichts tun kann.",0.11741368553792739,0.13855489357388123
785,du hast nicht abgetrotzt,you will not have gone to war,Du wirst nicht in den Krieg gegangen sein.,1.2882297539194154e-231,0.13855489357388123
786,Anzeige Nr.595965 an einen Freund senden,Send ad no.640795 to a friend,Anzeige Nr. 64795 an einen Freund senden,0.4347208719449914,0.13855489357388123
787,Beide Vorschläge sind von großer Brisanz und werden von der Arbeiterkammer mit großer Aufmerksamkeit verfolgt.,"Both proposals are a highly explosive subject, being followed closely by the Chamber of Labour.","Beide Vorschläge sind ein sehr explosionsvolles Thema, das von der Chamber of Labour eng verfolgt wird.",3.3042234935730684e-78,0.13855489357388123
788,"Ich wusste, Sie würden so denken.",I knew you'd think so.,"Ich wusste, du würdest das denken.",8.38826642100846e-155,0.13855489357388123
789,"„Sendung“ eine Gesamtheit von Polyamid- oder Melamin-Kunststoffküchenartikeln, die von dem/denselben Dokument(en) begleitet und mit demselben Transportmittel befördert wird und aus demselben Drittland stammt; c) „zuständige Behörden“","‘consignment’ means a quantity of polyamide or melamine plastic kitchenware, covered by the same document(s), conveyed by the same means of transport and coming from the same third country;","Sendung bedeutet eine Menge Polyamid- oder Melamin-Plastküssen, die mit demselben Dokument (s) bedeckt sind und mit demselben Transportmittel transportiert werden und aus demselben Drittstaat kommen;",0.12593672952487148,0.13855489357388123
790,"Nein, Jimmy.","No, Jimmy.","Nein, Jimmy.",1.491668146240062e-154,0.13855489357388123
791,Die Messwerte können nun mit jedem OPC-Client abgerufen werden.,The measured values can now be polled by any OPC client.,Die gemessenen Werte können nun von jedem OPC-Client untersucht werden.,9.013778876140909e-155,0.13855489357388123
792,"Wir werden jedoch nicht akzeptieren, daß das gemeinschaftliche Konzept für die Regionen in äußerster Randlage durch das Konzept der Insellage verwässert wird, denn Inselregionen, die sich in äußerster Randlage befinden, haben aufgrund ihrer Entfernung vom europäischen Festland noch viel mehr Nachteile als Inseln im allgemeinen.","But we do not accept that the Community concept of outermost region should become diluted in the concept of island region. The fact is that the outermost island regions, because of their remoteness from the continent of Europe, are faced with more disadvantages than islands in general.","Wir akzeptieren jedoch nicht, dass das Gemeinschaftskonzept der äußeren Region im Konzept der Inselregion verdünnt werden sollte. Die Tatsache ist, dass die äußeren Inselregionen aufgrund ihrer Entfernung vom europäischen Kontinent mehr Nachteile haben als Inseln im Allgemeinen.",0.17399648206115362,0.13855489357388123
793,Monsieur... dieser Junge gehört zu mir.,Monsieur this child belongs to me.,"Monsieur, dieses Kind gehört mir.",1.3127657569660467e-231,0.13855489357388123
794,Wir können jetzt gehen.,We can go now.,Wir können jetzt gehen.,1.0,0.13855489357388123
795,Tyrrhenisches Meer (27),Tyrrhenian Sea (27),Tyrrhenische See (27),6.86809206056511e-78,0.13855489357388123
796,Wunderbar.,Excellent.,- Ausgezeichnet.,0.0,0.13855489357388123
797,"- Nein, nein, es ist okay.","- No, no, it's okay.","- Nein, nein, das ist in Ordnung.",5.395774370246974e-78,0.13855489357388123
798,"Ich habe geduscht, die Dukaten aus meiner du-weißt-schon-was gezogen... den Kopf oben gehalten und mit meinem Leben weitergemacht.","I showered,plucked the sequins from my hoo-hoo... held my head up,got on with my life.","Ich duschte, zog die Schleife aus meinem Ho-Ho... hielt meinen Kopf hoch, ging mit meinem Leben fort.",2.787124325581721e-78,0.13855489357388123
799,[10:48:29] xxx: ich habe dir doch gesagt dass ich in Teilzeit arbeite,[16:08:16] xxx: give me the name and adress of the hospital.,[16:08:16] xxx: Gib mir den Namen und die Adresse des Krankenhauses.,2.797527804604784e-78,0.13855489357388123
800,Lausanne - Die Alpiq Holding AG hat am 30. April 2015 in Olten ihre 7. ordentliche Generalversammlung abgehalten.,Lausanne - Alpiq Holding Ltd. held its 7th Annual General meeting in Olten on 30 April 2015.,Lausanne - Alpiq Holding Ltd. hielt am 30. April 2015 seine siebte Jahresversammlung in Olten ab.,0.20204022516827064,0.13855489357388123
801,Die Renaissance der Weine des Savoyen,The rebirth of wines from the Savoy,Die Wiedergeburt der Weine aus der Savoyen,8.286571670851008e-155,0.13855489357388123
802,"Nur zwei Schießstände außerhalb von Miami verkaufen Großkaliber Munition, und das ist der einzige in der Nähe des Flughafens.","Only two firing ranges outside of Miami sell high-caliber rounds, and this is the only one near the airport.","Nur zwei Schießbereiche außerhalb von Miami verkaufen hochkaliberne Schüsse, und dies ist die einzige in der Nähe des Flughafens.",0.42461633178803443,0.13855489357388123
803,"172,53 EUR inkl. 19 % MwSt.","2,88 EUR inkl. 19 % MwSt.","2,88 EUR einschließlich 19% MwSt.",6.206021746903507e-78,0.13855489357388123
804,"Diese Leute sind schlecht, durch und durch.","Look, these two robbers are so ruthless.","Sieh mal, diese beiden Räuber sind so rücksichtslos.",1.2882297539194154e-231,0.13855489357388123
805,In den zwanziger Jahren war Douglas Fairbanks Sr. in Japan (das er 1929 persönlich besuchte) der populärste westliche Kinostar.,"In the 1920s, the senior Douglas Fairbanks was Japan’s most popular western movie star (he visited the country in 1929).",In den 1920er Jahren war der ältere Douglas Fairbanks der beliebteste Western-Filmstar Japans (er besuchte das Land im Jahr 1929).,8.04040404842228e-155,0.13855489357388123
806,Er liebt mich.,he loves me!,Er liebt mich!,1.2213386697554703e-77,0.13855489357388123
807,Ich liebe die eingebaute Video-Voreinstellungen für mobile Geräte.,I love the built-in video presets for portable devices.,Ich liebe die eingebauten Video-Vorinstellungen für tragbare Geräte.,5.072841446586652e-78,0.13855489357388123
808,"CMA CGM versammelt die fünf Filialen, die sich den intermodale Transport in einer einzigen Entität aufpassen",CMA CGM reunites the five branches that takes care of intermodal transport in an only entity,"CMA CGM vereint die fünf Zweige, die sich um den intermodalen Verkehr kümmern, in einer einzigen Einheit",4.0636244822144107e-78,0.13855489357388123
809,- natürlich.,- Of course.,- Natürlich. - Was ist das?,6.968148412761692e-155,0.13855489357388123
810,"- Nein, natürlich nicht, ich...",I just...,Ich habe nur...,7.107197028258987e-232,0.13855489357388123
811,Diese Verordnung ist in allen ihren Teilen verbindlich und gilt unmittelbar in jedem Mitgliedstaat.,This Regulation shall be binding in its entirety and directly applicable in all Member States.,Diese Verordnung ist in ihrer Gesamtheit verbindlich und in allen Mitgliedstaaten unmittelbar anwendbar.,0.24918622945587304,0.13855489357388123
812,- Sie sind zu spät.,- You are late.,- Du bist zu spät.,9.283142785759642e-155,0.13855489357388123
813,Juli 1968 — Die Zölle auf Industrieerzeugnisse werden 18 Monate vor dem festgelegtenTermin abgeschat und ein Gemeinsamer Außenzolltarif eingeführt.,"July 1968 — Customs duties on industrial goods are completely abolished 18 months ahead of schedule, and a common external tariff is introduced.",Juli 1968  Zollmaßnahmen für Industriewaren werden 18 Monate vor dem Zeitplan vollständig abgeschafft und ein gemeinsames Außentarif eingeführt.,0.2503023845012661,0.13855489357388123
814,Wärmenennleistung > 6 kW und ≤ 12 kW,Rated heat output > 6 kW and ≤ 12 kW,Ratierte Wärmeleistung > 6 kW und ± 12 kW,0.3549481056010053,0.13855489357388123
815,Home >> Die Bücher >> Die klassischen Abenteuer >> Asterix der Gallier,Home >> The Collection >> The collection of the albums of Asterix the Gaul >> Asterix the Gaul,Home >> Die Sammlung >> Die Sammlung der Alben von Asterix der Gallien >> Asterix der Gallien,0.29494729140780945,0.13855489357388123
816,Die halbe Portion?,The little twerp?,Der kleine Twerp?,1.2882297539194154e-231,0.13855489357388123
817,"Die angegebene Übertragungsgeschwindigkeit ergibt sich aus der maximalen Datenrate von 433,3 MBit/s pro Antenne, also insgesamt 867 MBit/s.","The displayed transmission rate results from the maximum data rate of 433.3 Mbps per antenna, hence an overall 867 Mbps.","Die angezeigte Übertragungsrate ist das Ergebnis der maximalen Datenrate von 433.3 Mbps pro Antenne, daher einer Gesamtzahl von 867 Mbps.",0.21951524426618454,0.13855489357388123
818,"Nein, aber mit Handschellen gefesselt.","No, I'm just handcuffed.","Nein, ich bin nur mit Handschellen.",8.38826642100846e-155,0.13855489357388123
819,"Wenn man erst mal unsichtbar ist, ist es schwer, wieder sichtbar zu werden.","Once you're invisible, it's bloody hard to turn back.","Sobald man unsichtbar ist, ist es schwer, sich zurückzuwerfen.",0.2995197100101508,0.13855489357388123
820,(Carter) lhr Inneres scheint aus einem Hologramm zu bestehen.,(Carter) The inside of the barrier seems to be some kind of hologram.,(Carter) Das Innere der Barriere scheint eine Art Hologramm zu sein.,3.908633169762327e-78,0.13855489357388123
821,"Ich freue mich über die mit dem Rat erzielte Einigung zur Revision der Verordnung Nr. 1408/71. Mit der Annahme dieses einheitlichen, personenbezogenen Dokuments werden die derzeit verwendeten unterschiedlichen Formulare abgeschafft, die Rechte der Versicherten werden harmonisiert und Formalitäten vereinfacht.","I am pleased to note the agreement reached with the Council on the revision of Regulation No 1408/71. With the adoption of this single, personalised document, the various forms currently in use will be eliminated, the rights of the insured will be harmonised and formalities simplified.","Ich freue mich, dass die Vereinbarung mit dem Rat über die Überarbeitung der Verordnung Nr. 1408/71 erzielt wurde. Mit der Annahme dieses einzigen, personalisierten Dokuments werden die derzeit verwendeten Formen entfernt, die Rechte der Versicherten harmonisiert und die Formeln vereinfacht.",0.339852994322609,0.13855489357388123
822,"Argentinien , China , EIA , Frankreich , Mexiko , Erdgas , Polen , Schiefergas , USA","Argentina, China, EIA, France, Mexico, natural gas, Poland, shale gas, United States","Argentinien, China, EIA, Frankreich, Mexiko, Erdgas, Polen, Schiefergas, die Vereinigten Staaten",0.6786502681586727,0.13855489357388123
823,"14.08.2012, 08:30 Uhr","03.09.2015, 11:06 Uhr",Am 3.09.2015 Uhr 11:06,1.2882297539194154e-231,0.13855489357388123
824,Diese Seite wurde bisher 12.073-mal abgerufen.,"This page has been accessed 12,068 times.",Diese Seite wurde 12.068 Mal besucht.,5.775353993361614e-78,0.13855489357388123
825,Ich sah Sie hereinkommen.,I saw you as I was coming in.,"Ich sah dich, als ich hereinkam.",7.57965434483665e-155,0.13855489357388123
826,"Dies ist gleichzeitig der schwerste als auch der leichteste Bericht den ich schreibe, aber...",This is both the hardest and easiest review to write but I will be honest and objective. ...,"Dies ist sowohl die schwierigste als auch die einfachste Überprüfung zu schreiben, aber ich werde ehrlich und objektiv sein....",6.455962524053653e-155,0.13855489357388123
827,"Wir sind keine Götter, sondern bloß Menschen.","We're not gods, but mere men.","Wir sind keine Götter, sondern bloße Menschen.",0.6434588841607617,0.13855489357388123
828,"1916 legte er dieses Amt nieder, um bis 1928 Direktor der Londoner National Gallery zu werden.",He resigned this post in 1916 to take up his appointment as director of the National Gallery.,"Er trat 1916 aus diesem Posten zurück, um seine Ernennung als Direktor der Nationalgalerie aufzunehmen.",5.4815947791065374e-155,0.13855489357388123
829,"Ok, jetzt die nächste.","Okay, we'll go to the next one.","Okay, wir gehen zum nächsten.",0.0,0.13855489357388123
830,"Und wenn Gott gewollt hätte, hätte Er sie zu einer einzigen Gemeinschaft gemacht. Aber Er läßt in seine Barmherzigkeit eingehen, wen Er will.","Had God wanted, He could have made them all one single nation, but He grants mercy to whomever He wills.","Wenn Allah gewollt hätte, hätte Er sie alle zu einer einzigen Nation gemacht. Aber Er gewährt Barmherzigkeit, wem Er will.",0.2825289881300955,0.13855489357388123
831,Aufhören!,"- No, stop!","- Nein, aufhören!",1.384292958842266e-231,0.13855489357388123
832,Gott beschütze Euch.,God bless you.,Gott segne dich.,1.384292958842266e-231,0.13855489357388123
833,"Ich weiß, wie schwierig es für dich ist.",And I know what it is for you. How difficult.,"Und ich weiß, was es für dich ist. Wie schwierig.",0.3549481056010053,0.13855489357388123
834,Oktober 2007 wurde der Verkauf der LaSalle Bank an die Bank of America offiziell vollzogen.,"However in July 2007, the Dutch Supreme Court ruled that Bank of America's acquisition of LaSalle Bank could proceed and Bank of America absorbed LaSalle effective 1 October 2007.","Im Juli 2007 entschied der niederländische Oberste Gerichtshof jedoch, dass die Übernahme von LaSalle Bank von Bank of America fortgesetzt werden könnte und Bank of America LaSalle mit Wirkung vom 1. Oktober 2007 aufgenommen hat.",2.1251838540581257e-78,0.13855489357388123
835,"Ihr setzt ganz Spanien aufs Spiel. Don Rodrigo, Ihr werdet bei Sagrajas kämpfen.","Don Rodrigo, you will join us at Sagrajas... and we shall annul your banishment and return your lands.","Don Rodrigo, du wirst uns bei Sagrajas anschließen... und wir werden deine Verbannung annullieren und deine Länder zurückgeben.",5.998109029936297e-155,0.13855489357388123
836,"Ja, meine Blume.","- Ay, Blossom. I will.","- Ja, Blossom, das werde ich.",1.1640469867513693e-231,0.13855489357388123
837,Ich erlaube mir nicht mich auf der Basis von Polaritäten zu kreieren.,This is not best for all because I allow myself as a system to support a world system based on 'energy'.,"Das ist nicht für alle am besten, denn ich erlaube mir als System, ein weltweites System zu unterstützen, das auf ""Energie"" basiert.",2.165414196653705e-78,0.13855489357388123
838,"Jason, nimm die verdammte Kanone runter!","Jason, put the bloody gun down!","Jason, leg die verfluchte Waffe runter!",1.5319719891192393e-231,0.13855489357388123
839,Gewinner des Giro dell'Emilia,winner of the Giro dell'Emilia,Gewinner des Giro dell'Emilia,1.0,0.13855489357388123
840,Wie praktisch.,"Oh, how convenient.","Oh, wie bequem.",1.384292958842266e-231,0.13855489357388123
841,"«am: 10. August 2007, 11:50:37»","« Antwort #10 am: 03. März 2008, 19:55:41 »"," Antwort #10 am: 03. März 2008, 19:55:41 ",6.7393716283177006e-155,0.13855489357388123
842,"Peter, tu doch etwas.","Do something, Peter.","Tu etwas, Peter.",1.3053996630425247e-231,0.13855489357388123
843,"Okay, dann bestell bei Takeout. (Takeout liefert die Lebensmittel nach Hause)","okay,then order takeout.","Okay, dann bestellen Sie etwas zu essen.",2.9570929710230012e-155,0.13855489357388123
844,"Die Tiere sind nach Ländern und Kontinenten eingeteilt, Australien, Afrika, Asien (ein gigantischer Komodowaran ist der Star) und Südamerika. Außerdem gibt es die „Welt des Wissens“, einen Vergnügungspark, einen Wasserpark und einen Kinderzoo. Übernachtungsmöglichkeiten gibt es auf dem Zoogelände.","The animals are divided into the countries and continents of origin; Australia, Africa, Asia (very large Komodo Dragon is star attraction) and South America. As well as attractions; World of Knowledge, an amusement park, aqua park and children’s zoo. There is accommodation available within the zoo ground.","Die Tiere sind in die Länder und Kontinente der Herkunft unterteilt; Australien, Afrika, Asien (sehr großer Komodo-Dragon ist Sternattraktion) und Südamerika. Außerdem gibt es Inseln in der Welt des Wissens, einen Vergnügungspark, einen Aquapark und einen Kinder Zoo.",0.2600011880986606,0.13855489357388123
845,-Ich trage es am Freitag.,-I carry it on Friday.,- Ich habe es am Freitag.,5.775353993361614e-78,0.13855489357388123
846,dann machten WIR sie zu Jungfräulichen,"and made them virgins,","und machte sie zu Jungfrauen,",6.867731683891005e-155,0.13855489357388123
847,- Die ist unbezahlbar!,This is priceless.,Das ist unbezahlbar.,8.121328445417258e-155,0.13855489357388123
848,"Perugia [, ] ist die Hauptstadt der Region Umbrien in Italien und der Provinz Perugia.","Perugia (; () is the capital city of the region of Umbria in central Italy, crossed by the river Tiber.","Perugia (; () ist die Hauptstadt der Region Umbria im Zentrum Italiens, die vom Fluss Tiber überquert wird.",0.18759202316167214,0.13855489357388123
849,98% Baumwolle ; 2 % Elastan,98 % Cotton ; 2 % Elastan,98 % Baumwolle; 2 % Elastan,1.0,0.13855489357388123
850,Es goss wie aus Eimern.,It was absolutely tipping it down.,Es war absolut eine Niederlage.,1.2183324802375697e-231,0.13855489357388123
851,(Artikel I des Statuts; Artikel I bis 6 der BBSB),(Staff Regulations: Article I; CEOS: Articles I to 6),(Bediensteteinordnung: Artikel I; CEOS: Artikel I bis 6),0.2545093860020286,0.13855489357388123
852,- Arzneimittel zur Behandlung von Angst (Beruhigungsmittel/Tranquilizer),- medicines used for treating anxiety (tranquillisers),- Medikamente zur Behandlung von Angstzustand (Rückstellungsmittel),4.797597231912944e-78,0.13855489357388123
853,"Zum einen gibt es nach Lissabon einen neuen Ansatz in der Sozialpolitik, bei dem diese nicht mehr als ein Ergebnis oder Nebenprodukt der Wirtschaftspolitik, sondern als gleichwertige Politik betrachtet wird, die parallel zur Wirtschaftspolitik und zur Beschäftigungsstrategie verfolgt werden muss.","The first is that, since Lisbon, the new approach to social policy is to deal with it not as a product or by-product of economic policy, but as a policy in its own right which needs to be exercised in tandem with economic policy and the employment strategy.","Erstens besteht der neue Ansatz der Sozialpolitik seit Lissabon darin, sie nicht als Produkt oder Nebenprodukt der Wirtschaftspolitik zu behandeln, sondern als eine Politik in ihrem eigenen Recht, die in Zusammenarbeit mit der Wirtschaftspolitik und der Beschäftigungsstrategie ausgeübt werden muss.",0.10629480219240392,0.13855489357388123
854,Bei der 1984er Präsidentschaftskampagne spielten sie eine noch prominentere rolle bei der Konvention der Republikaner.,The oppressors of the homeless in Dublin cannot be the saviours of the oppressed in the North. Their dishonesty is there for anyone to see.,"Die Unterdrücker der Obdachlosen in Dublin können nicht die Retter der Unterdrückten im Norden sein. Ihre Unehrlichkeit ist da, um sie jedem zu zeigen.",1.0832677820940877e-231,0.13855489357388123
855,Home > B&B Grembergen,Home > B&B Grembergen,Zuhause > B&B Grembergen,0.7598356856515925,0.13855489357388123
856,Mist!,That was off.,Das war aus.,0.0,0.13855489357388123
857,Bosch hat am 28. August 2015 sein erstes mexikanisches Werk für Thermotechnik in Tepotzotlán rund 50 Kilometer nördlich von Mexico City offiziell eröffnet.,"On August 28, 2015, Bosch officially opened its first Thermotechnology plant in Mexico in the city of Tepotzotlán, located approximately 50 kilometers north of Mexico City.","Am 28. August 2015 eröffnete Bosch offiziell sein erstes Thermotechnologie-Werk in Mexiko in der Stadt Tepotzotlán, ungefähr 50 Kilometer nördlich von Mexiko-Stadt.",0.24701991296369977,0.13855489357388123
858,Hoffentlich macht dieser Massenexodus der Panik und der Unruhe auf der Welt ein Ende.,Hopefully this mass exodus will bring an end to the panic and unrest we've been seeing around the world.,"Hoffentlich wird dieser Massen-Exodus ein Ende für die Panik und Unruhe bringen, die wir auf der ganzen Welt sehen.",8.117943098525258e-155,0.13855489357388123
859,"Sie haben keine Macht über etwas von dem, was sie erworben haben.",So they gain nothing from their earnings.,Sie gewinnen also nichts aus ihrem Erwerb.,5.483065946899793e-232,0.13855489357388123
860,"sich und sind bis zum heutigen Tag noch sehr gut erhalten. Um nach Cuzco (einst die Metropole des riesigen Inkareiches) zu gelangen, mussten wir die Panamericana verlassen. Als1533 Pizarro und seine Männer in Cuzco einritten, waren sie vom Glanz der Stadt überwältigt. Eine 250m lange Goldkette umspannte den Marktplatz und dahinter erhoben","To get to Cuzco ( once the capitol of the giant Inka-Empire) we had to leave the Panamericana. When back in 1533 Pizarro and his horse artillery entered Cuzco, they have been fascinated by the brilliance of the city. A 820 feet long golden chain was spanned around the market place and behind that, they found palaces with golden door frames.","Um nach Cuzco zu kommen (eines Mal die Hauptstadt des riesigen Inka-Imperiums) mussten wir die Panamericana verlassen. Als Pizarro und seine Pferdertillerie 1533 Cuzco betraten, waren sie fasziniert von dem Glanz der Stadt. Eine 820 Fuß lange goldene Kette war um den Markt herum verstreut und hinter dem fanden sie Paläste mit goldenen Türrahmen.",0.14491938341443947,0.13855489357388123
861,"Wenn du ersetzt werden möchtest, machst du das Wächterersatz-Zeichen des Diamanten des Unsichtbaren.","When you need to be replaced, you make the Guardian replacement sign of the Diamond of the Unseen.","Wenn man ersetzt werden muss, macht man das Ersatzzeichen des Diamonds des Unsichtbaren.",8.16437745974496e-155,0.13855489357388123
862,"Sulzemoos, den 13. Januar 2009","Sulzemoos, 13 January 2009","Sulzemoos, 13. Januar 2009",7.227401369829121e-78,0.13855489357388123
863,"Wir sollten die wirtschaftlichen Bedingungen schaffen, die es dem Euro ermöglichen würden, in der Realität zu einer eben solchen Währung zu werden.",We should create the economic conditions that would allow the euro to become just such a currency in reality.,"Wir sollten die wirtschaftlichen Bedingungen schaffen, die es dem Euro ermöglichen würden, in Wirklichkeit genau eine solche Währung zu werden.",0.6274102538179022,0.13855489357388123
864,Wir sind glücklich Denn wir sind wieder da,# We can be whatever we want to be,"# Wir können sein, was wir wollen",1.154647032204335e-231,0.13855489357388123
865,1979 Direktor am Max-Planck-Institut für ausländisches und internationales Privatrecht in Hamburg,1979 Director of the Max-Planck-Institute for Comparative and International Private Law in Hamburg,1979 Direktor des Max-Planck-Instituts für Vergleichs- und internationale Privatrecht in Hamburg,4.661032518640916e-78,0.13855489357388123
