Unnamed: 0,UK,EN,TRANSLATION,BLEU_Score,avg
643,З ким я розмовляю?,Who am I talking with?,Who am I talking to?,0.537284965911771,0.20605902438792512
644,"Я згоден, але в мене є одна умова.","I accept, but only under one condition.","I agree, but I'm a wuss.",1.331960397810445e-231,0.20605902438792512
645,"Я згоден, але за однієї умови.","I accept, but only under one condition.","I agree, but for one condition.",7.629999090858336e-155,0.20605902438792512
646,"Посмiхнись зараз, поплачеш потiм!","Smile now, cry later!","I'm going to die, I'm going to die!",0.0,0.20605902438792512
647,Життя прекрасне.,Life is beautiful.,Life is over.,1.133422688662942e-154,0.20605902438792512
648,Життя вдалося.,Life is beautiful.,Life was successful.,1.384292958842266e-231,0.20605902438792512
649,Життя прекрасне!,Life is beautiful.,Life is over!,1.133422688662942e-154,0.20605902438792512
650,Я не можу стригти нігті і одночасно прасувати!,I can't cut my nails and do the ironing at the same time!,I can't cut and sew at the same time!,0.362698291501305,0.20605902438792512
651,Ти за чи проти абортів?,Are you for or against abortions?,What are you talking about?,7.100514228897259e-155,0.20605902438792512
652,Що змусило тебе змінити думку?,What made you change your mind?,Did you make me change my mind?,7.711523862191631e-155,0.20605902438792512
653,Що змусило вас змінити думку?,What made you change your mind?,Did it make you change your mind?,0.5169731539571706,0.20605902438792512
654,"Ну-мо, поглянь, мавпа з трьома головами!","Hey, look, a three-headed monkey!","Look at me, I'm a three-headed monkey!",4.797597231912944e-78,0.20605902438792512
655,Я обожнюю лазанью.,I love lasagna.,I love the lazan.,9.53091075863908e-155,0.20605902438792512
656,Я люблю лазанью.,I love lasagna.,I love the lazan.,9.53091075863908e-155,0.20605902438792512
657,Я в лікарні. У мене влучила блискавка.,I'm at the hospital. I got struck by lightning.,I got a flashlight in my doctor's office.,5.4493116732898584e-155,0.20605902438792512
658,Що для тебе є найбільшим джерелом наснаги?,What is your greatest source of inspiration?,What's the biggest source of energy for you?,6.8489908526642754e-155,0.20605902438792512
659,Що для тебе найкраще джерело натхнення?,What is your greatest source of inspiration?,What's the best inspiration for you?,1.4256605770826504e-231,0.20605902438792512
660,В теорії немає різниці між теорією та практикою. Але на практиці є.,"In theory, there is no difference between theory and practice. But, in practice, there is.",There's no difference between theory and practice.,0.29476596093379326,0.20605902438792512
661,"В цьому світі існують настільки голодні люди, що бог може з'явитися до них лише у вигляді хліба.","There are people in the world so hungry, that God cannot appear to them except in the form of bread.","In this world there are so many hungry people, that God can only appear to them as a slave.",4.250969416427983e-78,0.20605902438792512
662,"Я перечитував листи, які ти мені надіслав.",I was rereading the letters you sent to me.,"I read the lists, which you sent me.",7.1958300848837144e-155,0.20605902438792512
663,"Я перечитував листи, які ти мені надіслала.",I was rereading the letters you sent to me.,I read the letters you sent me.,0.3419177649965185,0.20605902438792512
664,"Я перечитувала листи, які ти мені надіслав.",I was rereading the letters you sent to me.,"I read the lists, which you sent me.",7.1958300848837144e-155,0.20605902438792512
665,"Я перечитувала листи, які ти мені надіслала.",I was rereading the letters you sent to me.,I read the letters you sent me.,0.3419177649965185,0.20605902438792512
666,Я не хочу йти до школи.,I don't want to go to school.,I don't want to go to school.,1.0,0.20605902438792512
667,Не хочу в школу.,I don't want to go to school.,I don't want to go to school.,1.0,0.20605902438792512
668,Я не хочу ходити до школи.,I don't want to go to school.,I don't want to go to school.,1.0,0.20605902438792512
669,Між нами все скінчено. Віддай мені перстень!,It's over between us. Give me back my ring!,Everything is lost in us.,4.481994719908145e-232,0.20605902438792512
670,Йде дощ.,It is raining.,There is a lot.,1.2882297539194154e-231,0.20605902438792512
671,Падає дощ.,It is raining.,It falls.,9.291879812217675e-232,0.20605902438792512
672,Дощить.,It is raining.,To be found.,0.0,0.20605902438792512
673,"Я планував піти сьогодні на пляж, але потім почало дощити.","I was planning on going to the beach today, but then it started to rain.","I planned to drink on the beach today, but then I started to.",0.31177153206263575,0.20605902438792512
674,"Вона дуже розумна, чи не так?","She's really smart, isn't she?","She's smart, isn't she?",0.6129752413741056,0.20605902438792512
675,"Вона насправді розумна, правда?","She's really smart, isn't she?","She's actually smart, right?",6.458654791343583e-155,0.20605902438792512
676,Справедливість дорого коштує.,Justice is expensive.,It's expensive.,1.384292958842266e-231,0.20605902438792512
677,Справедливість коштує дорого.,Justice is expensive.,Justice is expensive.,1.2213386697554703e-77,0.20605902438792512
678,Правосуддя коштує дорого.,Justice is expensive.,Justice is expensive.,1.2213386697554703e-77,0.20605902438792512
679,"Життя — смертельна хвороба, що передається статевим шляхом.",Life is a fatal sexually transmitted disease.,"Death by disease, which is transmitted by the stomach.",1.384292958842266e-231,0.20605902438792512
680,Я завтра вчитимуся в бібліотеці.,"Tomorrow, I'm going to study at the library.",I'll teach in the library tomorrow.,6.227170448085464e-155,0.20605902438792512
681,Я завтра займатимуся в бібліотеці.,"Tomorrow, I'm going to study at the library.",I'll take the library tomorrow.,5.467133248249545e-155,0.20605902438792512
682,Запізно.,Too late.,Write it down.,0.0,0.20605902438792512
683,Вчора я ходив до зоопарку.,I went to the zoo yesterday.,Yesterday I went to the zoo.,0.7952707287670506,0.20605902438792512
684,Вчора я ходила до зоопарку.,I went to the zoo yesterday.,Yesterday I went to the zoo.,0.7952707287670506,0.20605902438792512
685,Ми виграли битву.,We won the battle.,We won the battle.,1.0,0.20605902438792512
686,Гей! Ти ще тут?,Hello? Are you still here?,"Hey, are you gonna be here?",9.170599044431425e-155,0.20605902438792512
687,Алло? Ти ще там?,Hello? Are you still here?,Hello? Are you there?,0.4548019047027907,0.20605902438792512
688,Я готую обід щодня.,I make lunch every day.,I'm going to eat every day.,7.711523862191631e-155,0.20605902438792512
689,Я готую ланч щодня.,I make lunch every day.,I'm having lunch every day.,6.206021746903507e-78,0.20605902438792512
690,Сьогодні вранці я дивився телевізор.,I watched TV this morning.,I watched TV in the morning.,6.206021746903507e-78,0.20605902438792512
691,Сьогодні вранці я дивилася телевізор.,I watched TV this morning.,I watched TV in the morning.,6.206021746903507e-78,0.20605902438792512
692,Я читав книжку під час їжі.,I read a book while eating.,I read a book during the meal.,0.41113361690051975,0.20605902438792512
693,"Я читав книжку, поки їв.",I read a book while eating.,"I read the book, left.",7.600394483915427e-155,0.20605902438792512
694,Я читала книжку під час їжі.,I read a book while eating.,I was reading a book during the meal.,7.176381577237209e-155,0.20605902438792512
695,"Я читала книжку, поки їла.",I read a book while eating.,"I read the book, left it.",8.38826642100846e-155,0.20605902438792512
696,Я почав вивчати китайську минулого тижня.,I started learning Chinese last week.,I started learning Chinese last week.,1.0,0.20605902438792512
697,Я почала вивчати китайську минулого тижня.,I started learning Chinese last week.,I started learning Chinese last week.,1.0,0.20605902438792512
698,Минулого тижня я почав вивчати китайську.,I started learning Chinese last week.,Minugeng began to learn Chinese.,9.97486269044271e-232,0.20605902438792512
699,Минулого тижня я почала вивчати китайську.,I started learning Chinese last week.,I started learning Chinese in the afternoon.,0.41113361690051975,0.20605902438792512
700,Твої окуляри впали.,Your glasses fell on the floor.,Your eyelids are in.,7.813508425061864e-232,0.20605902438792512
701,В тебе окуляри впали на землю.,Your glasses fell on the floor.,The eyelids fell on the ground.,5.775353993361614e-78,0.20605902438792512
702,Твої окуляри впали на підлогу.,Your glasses fell on the floor.,Your eyelids are on the floor.,6.206021746903507e-78,0.20605902438792512
703,Ваші окуляри впали на підлогу.,Your glasses fell on the floor.,Your eyes are on the floor.,6.206021746903507e-78,0.20605902438792512
704,Скільки разів на день ти дивишся на себе у дзеркало?,How many times a day do you look at yourself in the mirror?,How many times a day do you look at yourself in the mirror?,1.0,0.20605902438792512
705,Скільки разів на день ти дивишся на себе у люстерко?,How many times a day do you look at yourself in the mirror?,How many times a day do you look at yourself in a mirror?,0.8091067115702212,0.20605902438792512
706,Скільки разів на день ви дивитеся на себе у дзеркало?,How many times a day do you look at yourself in the mirror?,How many times a day do you look at yourself?,0.69635477890704,0.20605902438792512
707,Скільки разів на день ви дивитеся на себе у люстерко?,How many times a day do you look at yourself in the mirror?,How many times a day do you get distracted by a candle?,0.45033035241661884,0.20605902438792512
708,Ми поїхали до Лондона минулого року.,We went to London last year.,We traveled to London last year.,0.537284965911771,0.20605902438792512
709,Вона не хоче про це говорити.,She doesn't want to talk about it.,She doesn't want to talk about it.,1.0,0.20605902438792512
710,Я втратив натхнення.,I lost my inspiration.,I lost my inspiration.,1.0,0.20605902438792512
711,Я втратила натхнення.,I lost my inspiration.,I lost my inspiration.,1.0,0.20605902438792512
712,Це не має ніякого значення!,It doesn't mean anything!,It doesn't matter!,6.725854833444237e-78,0.20605902438792512
713,"Зачини двері, коли будеш іти.",Close the door when you leave.,"Close the door, when you will.",0.7598356856515925,0.20605902438792512
714,"Зачиніть двері, коли будете йти.",Close the door when you leave.,You'll be there when you get there.,6.484592771860512e-155,0.20605902438792512
715,"Якщо немає рішення, то нема й проблеми.","If there's no solution, then there's no problem.","If there is no solution, there is no problem.",9.809321592636189e-155,0.20605902438792512
716,Мій молодший брат дивиться телевізор.,My little brother is watching TV.,My younger brother is watching TV.,0.537284965911771,0.20605902438792512
717,"Так, це трапляється час від часу.","Yes, it happens from time to time.","So, this is a time-traveling thing.",0.0,0.20605902438792512
718,Добре мати ідеали... ви так не думаєте?,It is good to have ideals... don't you think?,Good mother idealized... don't you think?,0.37188004246466494,0.20605902438792512
719,"Мати ідеали - це добре, .. як гадаєш?",It is good to have ideals... don't you think?,"Mati ideali - that's good, how are you?",1.2199981975731961e-231,0.20605902438792512
720,Люди в усьому світі завжди борються за більшу свободу та рівність.,People in the world are always advocating for more freedom and equality.,People in the world always fight for freedom and dignity.,0.27483906537871355,0.20605902438792512
721,"Якщо ви не прислухаєтеся до нас, ми будемо вимушені застосувати силу.","If you don't listen to us, we will have to resort to coercion.","If you don't listen to us, we'll have to stop you.",0.566260439529554,0.20605902438792512
722,Голод для нього був абстрактним поняттям; в нього завжди було достатньо їжі.,"To him, hunger was an abstract concept; he always had enough to eat.",Hunger for him was an abstract concept; there was always enough food for him.,0.284955776032203,0.20605902438792512
723,"Це залежить від того, що ви називаєте ""вірою"" у бога.","It depends what you mean by ""believe"" in God.","It depends on what you call a ""blue"".",8.156004405034412e-155,0.20605902438792512
724,"Батьки відмовилися б від мого брата, якби дізналися, що він ґей.",My parents would repudiate my brother if they ever found out he was gay.,"My brother's father refused, as if he knew, that he was.",6.624396503292269e-155,0.20605902438792512
725,Тим - великий прихильник сатиричної комедії.,Tim is a huge fan of satirical comedy.,Tim - the great comedian.,6.686350417856737e-232,0.20605902438792512
726,Я дуже люблю свою роботу.,I like my job very much.,I love my job.,6.397495320955232e-155,0.20605902438792512
727,Маленький вогонь в лісі може легко поширитися і швидко стати величезною пожежею.,A small forest fire can easily spread and quickly become a great conflagration.,A small fire in the forest can easily spread and quickly become a huge fire.,0.46563348805256366,0.20605902438792512
728,Ти мені снилася.,I dreamt about you.,You fell down.,9.918892480173173e-232,0.20605902438792512
729,Я не програю!,I won't lose!,I'm not losing!,1.2882297539194154e-231,0.20605902438792512
730,Я запізнився до школи.,I was late to school.,I wrote to school.,8.214546595247418e-155,0.20605902438792512
731,Заняття скоро розпочнуться знову.,Classes are starting again soon.,They'll be back soon.,1.2183324802375697e-231,0.20605902438792512
732,Але ж ти ніколи мені про це не розповідала!,But you've never told me about this!,But you never told me about it!,0.42383656282787796,0.20605902438792512
733,Але ти мені ніколи про це не казав!,But you've never told me about this!,But you never told me about it!,0.42383656282787796,0.20605902438792512
734,Я змінив розмітку свого сайту.,I've changed my website's layout.,I changed the size of my website.,8.286571670851008e-155,0.20605902438792512
735,Я змінила розмітку свого сайту.,I've changed my website's layout.,I changed the size of my website.,8.286571670851008e-155,0.20605902438792512
736,В тебе було повно часу.,You had plenty of time.,You were full of time.,9.283142785759642e-155,0.20605902438792512
737,В тебе було багато часу.,You had plenty of time.,You had a lot of time.,1.0719249972567852e-154,0.20605902438792512
738,Припини мене критикувати!,Stop criticizing me!,Stop criticizing me!,1.2213386697554703e-77,0.20605902438792512
739,Перестань мене критикувати!,Stop criticizing me!,Stop criticizing me!,1.2213386697554703e-77,0.20605902438792512
740,Перестаньте мене критикувати!,Stop criticizing me!,Stop criticizing me!,1.2213386697554703e-77,0.20605902438792512
741,"Ну ж бо, поговори зі мною, Транґу.","Come on! Talk to me, Trang.","Well, talk to me, Trans.",5.623118184955381e-78,0.20605902438792512
742,Я майже закінчив.,I'm almost done.,I almost quit.,1.1795617510369435e-231,0.20605902438792512
743,Я майже закінчила.,I'm almost done.,I almost finished.,1.1795617510369435e-231,0.20605902438792512
744,Я майже скінчив.,I'm almost done.,I almost quit.,1.1795617510369435e-231,0.20605902438792512
745,Я майже скінчила.,I'm almost done.,I almost got rid of it.,1.384292958842266e-231,0.20605902438792512
746,Візьми інший стілець!,Take the other chair!,The other one is standing!,8.38826642100846e-155,0.20605902438792512
747,Скільки залишилося бутербродів?,How many sandwiches are there left?,What's left of the bread?,1.331960397810445e-231,0.20605902438792512
748,Скільки канапок лишилось?,How many sandwiches are there left?,How many canals were lost?,7.100514228897259e-155,0.20605902438792512
749,Я не буду опускатися до його рівня.,I won't lower myself to his level.,I won't let him down.,4.1382219658909647e-78,0.20605902438792512
750,З вікна нам було видно захід сонця.,We could see the sunset from the window.,We were told the sun was shining.,1.154647032204335e-231,0.20605902438792512
751,Це зводить мене з глузду.,It's driving me crazy.,It's the same with me.,8.38826642100846e-155,0.20605902438792512
752,"Ти сказав, що я ніколи не зможу виграти?",Did you say that I could never win?,You said I'd never win?,4.2874310268234296e-78,0.20605902438792512
753,"Ти сказала, що я ніколи не зможу перемогти?",Did you say that I could never win?,You said I could never win?,0.4835447404743731,0.20605902438792512
754,"Ти сказав, що мені ніколи не виграти?",Did you say that I could never win?,Did you say I never won?,4.487375970393454e-78,0.20605902438792512
755,"Ти сказала, що мені ніколи не перемогти?",Did you say that I could never win?,You said I'd never win?,4.2874310268234296e-78,0.20605902438792512
756,На вулиці темно як у льоху.,It's all dark outside.,In the dark like a leaf.,1.1640469867513693e-231,0.20605902438792512
757,Що сталося? Вода по всій хаті!,What happened? There's water all over the apartment.,What happened?,1.184356142350827e-78,0.20605902438792512
758,"Ви будете говорити і робити те, що ваші батьки говорили і робили, навіть якщо ви присягнетеся, що ніколи не зробили би це.","You will say and do things your parents said and did, even if you swore you would never do them.","You will talk and do what your parents said and did, even if you never did.",0.41465079388766196,0.20605902438792512
759,Я застарий для цього світу.,I am too old for this world.,I'm stuck in this world.,7.100514228897259e-155,0.20605902438792512
760,"Життя починається тоді, коли ви готові його жити.",Life begins when you're ready to live it.,"Life starts then, when you're ready to live.",0.6104735835807844,0.20605902438792512
761,Вчитися ніколи не пізно.,It is never too late to learn.,Never be late.,4.339365177986787e-232,0.20605902438792512
762,"Зараз лише п'ята година ранку, але вже світло.","It's just five in the morning, but nevertheless it is light out.","It's only a few years old, but it's light.",5.742538458835147e-155,0.20605902438792512
763,Він розповів мені історію свого життя.,He told me the story of his life.,He told me about his life.,5.203538639359665e-78,0.20605902438792512
764,"Навіть не знаю, чи створений я для цього світу.",I wonder if I am made for this world.,"I don't know, I'm made for this world.",0.2907153684841096,0.20605902438792512
765,Про що ви говорите!?,What are you talking about?,What are you talking about?,1.0,0.20605902438792512
766,Я хочу цукерку.,I want a piece of candy.,I want sugar.,4.1696290531635676e-155,0.20605902438792512
767,Хочу цукерку.,I want a piece of candy.,I want sugar.,4.1696290531635676e-155,0.20605902438792512
768,"Я знав, що сьогодні буде весело.",I knew that today would be fun.,"I know, it'll be fun today.",8.286571670851008e-155,0.20605902438792512
769,"Я знала, що сьогодні буде весело.",I knew that today would be fun.,I knew it would be fun today.,6.608446987146148e-78,0.20605902438792512
770,"Це може здатися притягнутим за волосся, але це реальна проблема.","It might sound far-fetched, but this is a real problem.","It may seem like a haircut, but it's a real problem.",3.603235312613151e-78,0.20605902438792512
771,Коли ми їмо? Я зголоднів!,When are we eating? I'm hungry!,I'm hungry!,2.306810775188903e-78,0.20605902438792512
772,Коли ми будемо їсти? Я голодний!,When are we eating? I'm hungry!,Will we eat? I am hungry!,7.183445846156676e-155,0.20605902438792512
773,У мене завтра заняття.,I have class tomorrow.,I'll be in class tomorrow.,8.38826642100846e-155,0.20605902438792512
774,Не можу в це повірити!,I can't believe it!,I can't believe this!,0.668740304976422,0.20605902438792512
775,"«Дякую», — «Нема за що».","""Thank you."" ""You're welcome.""",I'm not doing anything.,0.0,0.20605902438792512
776,"«Дякую», — «На здоров'я».","""Thank you."" ""You're welcome.""","I'm fine, I'm fine, I'm fine, I'm fine, I'm fine, I'm fine, I'm fine, I'm fine, I'm fine, I'm fine, I'm all right, I'm all right, I'm all right",0.0,0.20605902438792512
777,"""Дякую."" ""Будь ласка.""","""Thank you."" ""You're welcome.""","""I'll take care of it"". ""Listen to me"".",5.969061643530969e-155,0.20605902438792512
778,"""Дякую."" ""Прошу.""","""Thank you."" ""You're welcome.""","""I'll take care of it"".",1.1368587676511996e-231,0.20605902438792512
779,"""Дякую."" ""Дуже прошу.""","""Thank you."" ""You're welcome.""",I beg you.,1.8734367966736672e-232,0.20605902438792512
780,"""Спасибi."" ""Прошу.""","""Thank you."" ""You're welcome.""","""Spacy."" ""I'm going to die"".",6.8489908526642754e-155,0.20605902438792512
781,"""Дякую"". — ""Прошу"".","""Thank you."" ""You're welcome.""","""I'll take care of it"".",1.1368587676511996e-231,0.20605902438792512
782,"""Спасибі"". — ""Нема за що"".","""Thank you."" ""You're welcome.""","""I'm sorry"". ""I'm not going to do that"".",5.74340400309589e-155,0.20605902438792512
783,"""Дякую"". — ""Нема за що"".","""Thank you."" ""You're welcome.""","""I'll take care of it"".",1.1368587676511996e-231,0.20605902438792512
784,"Як вимовляється ""pronounce""?","How do you pronounce ""pronounce""?",How do you pronounce it?,0.38498150077635496,0.20605902438792512
785,Зима — моя улюблена пора року.,Winter is my favorite season.,Winter is my favorite time of year.,0.41113361690051975,0.20605902438792512
786,"Факти вказують, що оптимальною тривалістю лекції є 30, а не 60 хвилин.",The data suggest that the optimum length of a lecture may be 30 instead of 60 minutes.,"In fact, the optimal duration of the lecture is 30 minutes, not 60 minutes.",5.331700866328894e-155,0.20605902438792512
787,Я багато чому навчився від тебе.,I learned a lot from you.,I learned a lot from you.,1.0,0.20605902438792512
788,Я багато чому від тебе навчився.,I learned a lot from you.,I learned a lot from you.,1.0,0.20605902438792512
789,Я багато чому від вас навчився.,I learned a lot from you.,I learned a lot from you.,1.0,0.20605902438792512
790,Я від тебе багато чому навчився.,I learned a lot from you.,I've learned a lot from you.,0.6434588841607617,0.20605902438792512
791,Я від вас багато чому навчився.,I learned a lot from you.,I've learned a lot from you.,0.6434588841607617,0.20605902438792512
792,Ми багато гуляли.,We walked a lot.,We walked a lot.,1.0,0.20605902438792512
