Unnamed: 0,UK,EN,TRANSLATION,BLEU_Score,avg
332,Ти не хотів би чогось випити?,Would you like something to drink?,Didn't you want to ask?,1.4740564900137075e-231,0.20605902438792512
333,Ви бажаєте щось випити?,Would you like something to drink?,Do you want to do something?,1.583976781977924e-231,0.20605902438792512
334,Ти бажаєш щось випити?,Would you like something to drink?,Do you want to do something?,1.583976781977924e-231,0.20605902438792512
335,"""Хто це?"" - ""Це твоя мати"".","""Who is it?"" ""It's your mother.""","""Who is this?"" ""This is yours"".",5.438673648150892e-78,0.20605902438792512
336,"""Хто це?"" - ""Твоя мати"".","""Who is it?"" ""It's your mother.""","""Who is this?"" - ""Your mother"".",6.123597259598246e-78,0.20605902438792512
337,"""Хто це?"" - ""Це мама"".","""Who is it?"" ""It's your mother.""","""Who is this?"" ""This is Mom"".",5.438673648150892e-78,0.20605902438792512
338,"""Коли повернешся?"" ""Все залежить від погоди""","""When will you be back?"" ""It all depends on the weather.""","""Will you come back?"" ""Everyone depends on the weather"".",0.42893079197732625,0.20605902438792512
339,"""У чому справа?"" - запитав маленький білий кролик.","""What's the matter?"" asked the little white rabbit.","""Why is that?"" asked the little rabbit.",0.3498330125272252,0.20605902438792512
340,"""Що відбувається в печері? Мені цікаво"". — ""Я не маю уяви"".","""What's going on in the cave? I'm curious."" ""I have no idea.""","""What's going on in the cave?"" ""I don't know"".",0.5096772803089438,0.20605902438792512
341,Е... Як це працює?,Uh... How's that working?,Well... how does it work?,1.384292958842266e-231,0.20605902438792512
342,"«Вірте мені», — сказав він.","""Trust me,"" he said.","I'm sorry, he said.",6.867731683891005e-155,0.20605902438792512
343,"""Здається, це дуже цікаво"", каже Хіросі.","""This looks pretty interesting,"" Hiroshi says.","""It's very interesting"", says Hiroshi.",8.15394372921771e-155,0.20605902438792512
344,«Дякую за допомогу.» «Нема за що.»,"""Thank you for helping me."" ""Don't mention it.""",Thank you for your help.,1.3866438722948334e-78,0.20605902438792512
345,"«Дякую, що ви допомогли мені.» «Нема за що.»","""Thank you for helping me."" ""Don't mention it.""","I'm sorry, what did you help me with?",9.025629002083406e-232,0.20605902438792512
346,«Спасибі за вашу допомогу.» «Нема за що.»,"""Thank you for helping me."" ""Don't mention it.""",Thank you for your help.,1.3866438722948334e-78,0.20605902438792512
347,«Дякую за вашу допомогу.» «Нема за що.»,"""Thank you for helping me."" ""Don't mention it.""",Thank you for your help.,1.3866438722948334e-78,0.20605902438792512
348,"Будь ласка, не плач.",Please don't cry.,Please don't cry.,1.0,0.20605902438792512
349,"Не плач, будь ласка.",Please don't cry.,"Dont cry, please.",1.1795617510369435e-231,0.20605902438792512
350,"Дай мені знати, якщо є щось, що я можу зробити.",Let me know if there is anything I can do.,Let me know if there's something I can do.,0.5253819788848316,0.20605902438792512
351,Заняття не пончеться до половини на восьму.,Class doesn't begin until eight-thirty.,Don't worry about the eighth half.,1.1200407237786664e-231,0.20605902438792512
352,Урок не пончеться до половини на восьму.,Class doesn't begin until eight-thirty.,Lesson not to be missed until half past eight.,1.0518351895246305e-231,0.20605902438792512
353,"Я хочу човен, який забере мене дуже далеко звідси.",I want a boat that will take me far away from here.,I want a boat that will take me far away.,0.8187307530779819,0.20605902438792512
354,Японець ніколи б не зробив такого.,A Japanese would never do such a thing.,Japan never did that.,4.739132419722992e-232,0.20605902438792512
355,Японець ніколи б так не вчинив.,A Japanese would never do such a thing.,Japan never did that.,4.739132419722992e-232,0.20605902438792512
356,Аллен — поет.,Allen is a poet.,Alen is a poet.,8.636168555094496e-78,0.20605902438792512
357,Стрілець вбив оленя.,The archer killed the deer.,I killed a wolf.,1.0032743411283238e-231,0.20605902438792512
358,На моєму віці комунізму точно не буде досягнуто.,Communism will never be reached in my lifetime.,"At my age, the communism will not be achieved.",7.241926111174567e-155,0.20605902438792512
359,Жито називали зерном злидарів.,Rye was called the grain of poverty.,They called me a bear.,8.166726842395623e-232,0.20605902438792512
360,"Якщо ти бачиш помилку, виправ її, будь ласка.","If you see a mistake, then please correct it.","If you miss it, please correct it.",4.744822399347669e-78,0.20605902438792512
361,"Якщо ви бачите помилку, виправте її, будь ласка.","If you see a mistake, then please correct it.","If you see a mistake, correct it, please.",0.5425486407251953,0.20605902438792512
362,"Якщо побачиш помилку, виправ її, будь ласка.","If you see a mistake, then please correct it.","If you see a flower, please pick it up.",0.3303164318013807,0.20605902438792512
363,"Якщо побачите помилку, виправте її, будь ласка.","If you see a mistake, then please correct it.","If you see it, correct it, please.",4.966097853332116e-78,0.20605902438792512
364,"Якщо не їсти, то помреш.","If you don't eat, you die.","If you don't eat, you'll die.",0.7071067811865475,0.20605902438792512
365,"Якщо не їси, то вмираєш.","If you don't eat, you die.","If you don't eat, you die.",1.0,0.20605902438792512
366,Якщо ти не будеш їсти - помреш.,"If you don't eat, you die.","If you don't eat, you'll die.",0.7071067811865475,0.20605902438792512
367,"Як пишеться ""pretty""?","How do you spell ""pretty""?","How do you spell ""pretty""?",1.0,0.20605902438792512
368,"Як пишеться слово ""pretty""?","How do you spell ""pretty""?","How do you spell ""pretty""?",1.0,0.20605902438792512
369,Чому ми не йдемо додому?,Why don't we go home?,Why don't we go home?,1.0,0.20605902438792512
370,Чому б нам не піти додому?,Why don't we go home?,Why don't we have a drink?,0.3655552228545123,0.20605902438792512
371,"Вибачте, я не можу залишитися надовго.","I'm sorry, I can't stay long.",I can't stay long.,0.5488116360940264,0.20605902438792512
372,"""Чому ти не йдеш?"" - ""Бо не хочу"".","""Why aren't you going?"" ""Because I don't want to.""","""Why don't you go?"" - ""I don't want to go"".",0.312680725516269,0.20605902438792512
373,"""Чому ви не йдете?"" - ""Бо не хочу"".","""Why aren't you going?"" ""Because I don't want to.""","""Why don't you go?"" - ""I don't want to go"".",0.312680725516269,0.20605902438792512
374,Один мільйон осіб втратили життя на війні.,One million people lost their lives in the war.,One million people have lost their lives in war.,0.4463236137853328,0.20605902438792512
375,"Демократія — найгірша форма правління за винятком усіх інших, які людство спробувало до цього часу.","Democracy is the worst form of government, except all the others that have been tried.",Democracy is the most widespread form of rule except for all the others that people have tried so far.,0.21951524426618454,0.20605902438792512
376,"Коли ти починаєш ставати схожим на своє паспортне фото, тобі треба у відпустку.","When you're beginning to look like the photo in your passport, you should go on a holiday.","When you start to get your passport photo, you have to leave.",5.163135240385173e-155,0.20605902438792512
377,Мої білі штани! І вони ж були нові.,"Oh, my white pants! And they were new.",My pants are white! They were new.,5.176479838379355e-78,0.20605902438792512
378,Ти ангел!,You're an angel!,You angel!,6.702145341854094e-232,0.20605902438792512
379,"Ну добре, ніч дуже довга, чи не так?","Well, the night is quite long, isn't it?","Well, not very well, is it?",5.3981964394227255e-155,0.20605902438792512
380,Ти сумуєш за мною?,Did you miss me?,Are you mad at me?,8.38826642100846e-155,0.20605902438792512
381,Ти сумував за мною?,Did you miss me?,Did you miss me?,1.0,0.20605902438792512
382,Вони всі однакові?,Are they all the same?,They're all one?,1.3127657569660467e-231,0.20605902438792512
383,Вони всі такі самі?,Are they all the same?,Are they all like that?,6.206021746903507e-78,0.20605902438792512
384,Вони всі ідентичні?,Are they all the same?,Are they all identical?,6.042433724643145e-78,0.20605902438792512
385,Дуже дякую!,Thank you very much!,I'm sorry!,0.0,0.20605902438792512
386,Щиро дякую!,Thank you very much!,I'll be right back!,0.0,0.20605902438792512
387,Вельми дякую!,Thank you very much!,I'll take care of it!,0.0,0.20605902438792512
388,Величезне спасибі!,Thank you very much!,Save me!,0.0,0.20605902438792512
389,Велике спасибі!,Thank you very much!,Great save!,0.0,0.20605902438792512
390,Ґречно вдячна.,Thank you very much!,It's very sweet.,1.2882297539194154e-231,0.20605902438792512
391,"Скажіть, будь ласка, де яйця?","Where are the eggs, please?","Say, please, de egg?",1.1862177682648818e-231,0.20605902438792512
392,Я візьму його.,I'll take him.,I'll take it.,8.636168555094496e-78,0.20605902438792512
393,Я відвезу його.,I'll take him.,I'll take it off.,6.86809206056511e-78,0.20605902438792512
394,Це сюрприз.,It's a surprise.,It's a surprise.,1.0,0.20605902438792512
395,Це гарна ідея!,That's a good idea!,It's a good idea!,0.668740304976422,0.20605902438792512
396,Гарна думка!,That's a good idea!,A good idea!,6.2705618118895185e-78,0.20605902438792512
397,"Шкода, коли хтось помирає.",It's a pity when somebody dies.,"Shkod, when someone dies.",7.236523273960503e-232,0.20605902438792512
398,Чорт забирай! Це непогано!,Damn! It's not bad!,That's not bad!,6.725854833444237e-78,0.20605902438792512
399,Не відчиняти до повної зупинки потяга.,Don't open before the train stops.,Don't turn off the power to stop the fire.,6.373704167435469e-155,0.20605902438792512
400,"Ті, що живуть у скляних будинках, не повинні кидатися камінням.",Those who live in glass houses should not throw stones.,"They live in cottages, they don't have to go to the bathroom.",5.019362538473707e-155,0.20605902438792512
401,"Тим, хто живе у скляних будинках, не треба кидатися камінням.",Those who live in glass houses should not throw stones.,"Tim, who lives in cottages, shouldn't be in the bathroom.",1.3165594234639305e-231,0.20605902438792512
402,"Тим, хто живе у скляних домівках, не варто кидатись камінцями.",Those who live in glass houses should not throw stones.,"Tim, who lives in the basement, shouldn't be a cashier.",1.3165594234639305e-231,0.20605902438792512
403,"Кажуть, що любов сліпа.",They say love is blind.,They say that love is a snake.,9.85444998995587e-155,0.20605902438792512
404,"О, мені дуже шкода.","Oh, I'm sorry.","Oh, I'm sorry about that.",0.5081327481546147,0.20605902438792512
405,"О, перепрошую.","Oh, I'm sorry.","Oh, I'm going to die.",5.775353993361614e-78,0.20605902438792512
406,"Ох, пробачте.","Oh, I'm sorry.","Oh, please.",5.635809992474887e-232,0.20605902438792512
407,"Ох, пробач.","Oh, I'm sorry.","Oh, try it.",9.918892480173173e-232,0.20605902438792512
408,"Ой, вибачаюся.","Oh, I'm sorry.","Oh, I'm going to die.",5.775353993361614e-78,0.20605902438792512
409,"Ох, мені дуже шкода.","Oh, I'm sorry.","Oh, I'm sorry about that.",0.5081327481546147,0.20605902438792512
410,"Ох, мені шкода.","Oh, I'm sorry.","Oh, I'm sorry about that.",0.5081327481546147,0.20605902438792512
411,"Математика подібна коханню - ідея проста, але можуть бути ускладнення.","Math is like love - a simple idea, but it can get complicated.","A mathematical puzzle is a simple idea, but it can be complicated.",0.41249148923121126,0.20605902438792512
412,"Бідний це не той, хто має замало, але той хто хоче забагато.","Poor is not the one who has too little, but the one who wants too much.","It's not that, it's that, but it's that.",7.551114723170368e-232,0.20605902438792512
413,Ви говорите італійською?,Do you speak Italian?,Do you speak Italian?,1.0,0.20605902438792512
414,Ти говориш італійською?,Do you speak Italian?,Are you speaking Italian?,9.283142785759642e-155,0.20605902438792512
415,"Кажуть, що ""Гамлет"" - найцікавіша з усіх будь-коли написаних п'єс.","It is said that ""Hamlet"" is the most interesting play ever written.","They say that ""Hamlet"" is the most beautiful thing I've ever written.",0.4428500142691474,0.20605902438792512
416,"Вважається, що ""Гамлет"" — одна з найцікавіших п'єс, що коли-небудь була написана.","It is said that ""Hamlet"" is the most interesting play ever written.","It's considered one of the most famous plays in Hamlet, but it's been written.",5.667113443314699e-155,0.20605902438792512
417,Можу я поставити питання?,May I ask a question?,Can I ask a question?,0.7598356856515925,0.20605902438792512
418,Я можу поставити запитання?,May I ask a question?,Can I put a question?,6.206021746903507e-78,0.20605902438792512
419,Можна запитати?,May I ask a question?,Can I ask?,6.397495320955232e-155,0.20605902438792512
420,Опанувати французьку мову за 2-3 роки доволі важко.,It's quite difficult to master French in 2 or 3 years.,It's hard to master French for two or three years.,4.2559921313859375e-78,0.20605902438792512
421,"Було б цікаво подивитися, як усе міняється протягом років.",It would be fun to see how things change over the years.,"It was interesting to see, as it has been for years.",5.94781875096292e-155,0.20605902438792512
422,Я би ніколи до цього не здогадався би.,I would never have guessed that.,I would never have guessed that.,1.0,0.20605902438792512
423,Ти мене коли-небудь забудеш.,You'll forget about me someday.,You'll forget about me.,0.8187307530779819,0.20605902438792512
424,Це досить неочікувано.,That is rather unexpected.,It's not cooked.,0.0,0.20605902438792512
425,"Цікаво, як довго це триватиме.",I wonder how long it's going to take.,It's like a long-term thing.,4.597292750167502e-155,0.20605902438792512
426,Я не можу жити без телевізора.,I can't live without a TV.,I can't live without a TV.,1.0,0.20605902438792512
427,Я не зміг би цього зробити без тебе. Дякую.,I couldn't have done it without you. Thank you.,I didn't do it without you.,3.7166792038564594e-78,0.20605902438792512
428,Я не зміг би цього зробити без вас. Дякую.,I couldn't have done it without you. Thank you.,I didn't do it without you.,3.7166792038564594e-78,0.20605902438792512
429,Я не змогла би цього зробити без тебе. Дякую.,I couldn't have done it without you. Thank you.,I couldn't do this without you.,4.1131816762341247e-78,0.20605902438792512
430,Я не змогла би цього зробити без вас. Дякую.,I couldn't have done it without you. Thank you.,I couldn't do this without you.,4.1131816762341247e-78,0.20605902438792512
431,Без зусиль нічого не добитися.,Nothing is achieved without effort.,Nothing can be done without effort.,8.38826642100846e-155,0.20605902438792512
432,Життя без любові не має сенсу.,Life without love is just totally pointless.,Life without love doesn't make sense.,5.021333847570327e-78,0.20605902438792512
433,Життя без кохання не має сенсу.,Life without love is just totally pointless.,Life without love doesn't make sense.,5.021333847570327e-78,0.20605902438792512
434,"Дайте мені знати, якщо мені потрібно зробити будь-які зміни.",Let me know if I need to make any changes.,"Give me knowledge, if I need to make any changes.",0.6606328636027614,0.20605902438792512
435,"Я думаю, що іспити псують освіту.",I think exams are ruining education.,I think they're going to get an education.,6.7393716283177006e-155,0.20605902438792512
436,"Я думаю, що екзамени руйнують освіту.",I think exams are ruining education.,I think that exams are ruining education.,0.488923022434901,0.20605902438792512
437,Ми не можемо спати через шум.,We can't sleep because of the noise.,We can't sleep through the noise.,0.42383656282787796,0.20605902438792512
438,Ми не можемо спати через галас.,We can't sleep because of the noise.,We can't sleep through the hall.,0.3768499164492419,0.20605902438792512
439,Ти маєш презерватив?,Do you have a condom?,Do you have a preserve?,0.537284965911771,0.20605902438792512
440,"Роби все, що він тобі каже.",Do whatever he tells you.,"Robby, what do you say?",1.384292958842266e-231,0.20605902438792512
441,"Робіть все, що він вам каже.",Do whatever he tells you.,Do everything he says.,1.1931009847695213e-231,0.20605902438792512
442,"Зроби все, що він тобі скаже.",Do whatever he tells you.,Do everything he tells you.,7.380245217279165e-78,0.20605902438792512
443,"Зробіть все, що він вам скаже.",Do whatever he tells you.,Do everything he tells you.,7.380245217279165e-78,0.20605902438792512
444,Я можу дійти до школи за 10 хвилин.,I can walk to school in 10 minutes.,I can go to school in 10 minutes.,0.5946035575013605,0.20605902438792512
445,"Мені було потрібно більше двох годин, щоб перекласти кілька сторінок англійської мови.",It took me more than two hours to translate a few pages of English.,I needed more than two hours to translate several English words.,0.3653314643045625,0.20605902438792512
446,Вже одинадцята година.,It is already eleven.,It's been a year.,1.2183324802375697e-231,0.20605902438792512
447,Чи я можу поговорити з пані Браун?,May I talk to Ms. Brown?,Can I talk to Mrs. Brown?,6.313993041533344e-78,0.20605902438792512
448,"""Так, будь ласка помаранчовий сік,"" сказав Майк.","""Yes, orange juice please,"" says Mike.","""Thank you, please, Orange Syc"", said Mike.",1.5728604687011317e-231,0.20605902438792512
449,"""Ах!"" — це вигук.","""Ah!"" is an interjection.","""Ah!"" is a whistle.",0.5081327481546147,0.20605902438792512
450,Чого ти хочеш?,What do you want?,What do you want?,1.0,0.20605902438792512
451,Що вам треба?,What do you want?,What do you need?,7.380245217279165e-78,0.20605902438792512
452,Чого ви хочете?,What do you want?,What do you want?,1.0,0.20605902438792512
453,Що хочете?,What do you want?,What do you want?,1.0,0.20605902438792512
454,"Вам необхідно, щоб я дав вам гроші?",Do you need me to give you some money?,Do you need me to give you money?,0.7189393375176814,0.20605902438792512
455,"Тобі необхідно, щоб я дав тобі гроші?",Do you need me to give you some money?,Do you need me to give you money?,0.7189393375176814,0.20605902438792512
456,У мене є мрія.,I have a dream.,I'm the one who's dead.,1.1200407237786664e-231,0.20605902438792512
457,Я маю мрію.,I have a dream.,I have a dream.,1.0,0.20605902438792512
458,"Але все ж таки, супротивне також завжди істинно.","And yet, the contrary is always true as well.","But all of them, they're always true.",5.722633035689358e-155,0.20605902438792512
459,Ти схожий на дурня.,You look stupid.,You look like a fool.,8.38826642100846e-155,0.20605902438792512
460,Ти схожа на ідіотку.,You look stupid.,You're going to die.,1.2183324802375697e-231,0.20605902438792512
461,"Я, мабуть, піду спати.",I think I'm gonna go to sleep.,I must be sleeping.,3.690840039559348e-232,0.20605902438792512
462,"Я, мабуть, пішов спати.",I think I'm gonna go to sleep.,I must have spat.,3.690840039559348e-232,0.20605902438792512
463,"Я, мабуть, пішла спати.",I think I'm gonna go to sleep.,I must have fallen asleep.,5.474320712955125e-232,0.20605902438792512
464,Мене звуть Джек.,My name is Jack.,I'm the Jack.,1.2882297539194154e-231,0.20605902438792512
465,Мене звати Джек.,My name is Jack.,Call me Jack.,9.918892480173173e-232,0.20605902438792512
466,Моє ім'я - Джек.,My name is Jack.,My name is Jack.,1.0,0.20605902438792512
467,Мене кличуть Джеком.,My name is Jack.,I'm called Jack.,1.2882297539194154e-231,0.20605902438792512
468,Мені це дуже подобається.,I like it very much.,I like it very much.,1.0,0.20605902438792512
469,Вона мені дуже подобається.,I like it very much.,She likes me very much.,8.38826642100846e-155,0.20605902438792512
470,Ми зустрічаємося завтра?,We're meeting up tomorrow?,Are we meeting tomorrow?,8.167155382413152e-155,0.20605902438792512
471,Ми завтра зустрінемося?,We're meeting up tomorrow?,Will we meet tomorrow?,7.600394483915427e-155,0.20605902438792512
472,Як це сказати італійською?,How do you say that in Italian?,How do I say Italian?,8.121328445417258e-155,0.20605902438792512
473,"Мушу йти за покупками, повернуся за годину.",I have to go shopping. I'll be back in an hour.,"I have to go shopping, turn around for an hour.",0.3699033744491308,0.20605902438792512
474,Це далеко звідси?,Is it far from here?,Is that far from it?,9.53091075863908e-155,0.20605902438792512
475,Ці речі не мої!,These things aren't mine!,These things are not mine!,7.380245217279165e-78,0.20605902438792512
476,"Дякую, це все.","Thanks, that's all.",I'll give it all.,1.2183324802375697e-231,0.20605902438792512
477,Ти не хотів би зі мною потанцювати?,Would you like to dance with me?,Didn't you want to dance with me?,0.4671379777282001,0.20605902438792512
478,Ти не хотіла би зі мною потанцювати?,Would you like to dance with me?,Didn't you want to dance with me?,0.4671379777282001,0.20605902438792512
479,Італія - дуже гарна країна.,Italy is a very beautiful country.,Italy is a beautiful country.,7.070696784820904e-78,0.20605902438792512
480,Італія - це дуже красива країна,Italy is a very beautiful country.,Italy is a very beautiful country.,1.0,0.20605902438792512
481,Італія - дуже красива країна.,Italy is a very beautiful country.,Italy is a very beautiful country.,1.0,0.20605902438792512
482,Італія — дуже гарна країна.,Italy is a very beautiful country.,Italy is a beautiful country.,7.070696784820904e-78,0.20605902438792512
483,Це не моя провина.,It's not my fault!,It's not my fault.,1.0,0.20605902438792512
484,Я хотів би залишитись на одну ніч.,I'd like to stay for one night.,I wanted to stay on the same page.,7.176381577237209e-155,0.20605902438792512
485,Можете набрати мені номер? Для мене телефон зависоко.,Could you dial for me? The telephone is too high.,Can you pick me up?,6.657922819542466e-232,0.20605902438792512
486,"Наберіть мені номер, бо телефон занадто високо для мене.",Could you dial for me? The telephone is too high.,"I don't have a number, because the phone is too high for me.",3.6799428630948515e-78,0.20605902438792512
487,Де душова?,Where are the showers?,De Duchowa?,7.107197028258987e-232,0.20605902438792512
488,Рот відкрий!,Open your mouth!,Open up!,9.291879812217675e-232,0.20605902438792512
489,Відкрий рота.,Open your mouth!,The rotary wing.,0.0,0.20605902438792512
