Unnamed: 0,UK,EN,TRANSLATION,chrf_score
200,"Потім я пішов звідти, але зрозумів, що забув сумку.","After that, I left, but then I realized that I forgot my backpack at their house.","Then I wrote a note, but I forgot a note.",18.180500890207107
201,Я сьогодні не запитаю тебе більше ні про що.,I won't ask you anything else today.,I won't ask you anything today.,77.27877367282302
202,Наступного тижня очікуються заморозки.,It may freeze next week.,The next week is expected to be cold.,36.96638852165755
203,"Хоч він і вибачився, я все ще розлючений.","Even though he apologized, I'm still furious.","Although he was angry, I was still angry.",26.661768988112627
204,"Хоч він і вибачився, я все ще розлючена.","Even though he apologized, I'm still furious.","Although he was and I was, I'll be all right.",25.232880552664522
205,"Дякую, що ви мені нарешті пояснили, чому мене приймають за ідіота.",Thanks for having explained to me at last why people take me for an idiot.,I'm the one who finally explained to me why I'm accepting the idea.,30.10476640712604
206,Я не мав такого наміру.,That wasn't my intention.,I didn't mean that.,19.22216647884029
207,Я не мала такого наміру.,That wasn't my intention.,I don't have that intention.,44.28659053238573
208,Дякую за пояснення.,Thanks for your explanation.,I'll give you a hint.,9.815344315039589
209,"Теоретично, я займаюся математикою.","Theoretically, I'm doing math.","Theoretically, I do math.",62.569669492867575
210,"Якщо ти не знав мене з цього боку, ти взагалі мене не знав.",If you didn't know me that way then you simply didn't know me.,"If you don't know me from this side, you don't know me at all.",43.37376917730191
211,"Якщо ви не знали мене з цього боку, ви взагалі мене не знали.",If you didn't know me that way then you simply didn't know me.,"If you didn't know me from this side, you didn't know me at all.",57.924764360934574
212,"Я не знаю, що ти маєш на увазі.",I don't know what you mean.,I don't know what you mean.,100.0
213,Ти хотів розказати мені про свободу?,You wanted to tell me about freedom?,Did you want to talk to me about freedom?,60.840223303120766
214,Ти хотів мені розказати про свободу?,You wanted to tell me about freedom?,Did you want me to talk about freedom?,56.136140113347
215,"Гм, а тепер це дійсно дивно...","Uh, now it's really weird...","Well, now it's really weird...",86.46969582428306
216,"Якби я хотів тебе налякати, я би розповів тобі, що мені снилося кілька тижнів тому.","If I wanted to scare you, I would tell you what I dreamt about a few weeks ago.","If I wanted to tell you, I'd tell you, that I've had a few days.",37.40975173753661
217,"Є багато слів, яких я не розумію.",There are many words that I don't understand.,There are many I don't understand.,69.98382561597131
218,Мені потрібно поставити тобі дурне питання.,I need to ask you a silly question.,I need to ask you a few questions.,69.93296007984807
219,Чи можна це перефразувати якось інакше?,Can it be phrased in another way?,Can it be interpreted differently?,27.924676653641118
220,Ніхто не дізнається.,No one will know.,No one learns.,25.135960053099986
221,"Я знайшов рішення, але я зробив це так швидко, що воно не може бути вірним.","I found a solution, but I found it so fast that it can't be the right solution.","I found a solution, but I did it so quickly, that it can't be true.",55.93198884848536
222,Це здається мені цікавим.,It seems interesting to me.,I think that's interesting.,50.867658081003064
223,"Це не так просто, за винятком оцього.","Except that here, it's not so simple.","It's not that simple, except for that.",46.37518331812561
224,Мені подобається світло свічок.,I like candlelight.,I like lightning.,43.103012297401854
225,Що ти відповів?,What did you answer?,What did you say?,56.29958364067783
226,Що ти відповіла?,What did you answer?,What did you say?,56.29958364067783
227,Що ви відповіли?,What did you answer?,What did you answer?,100.0
228,"Ні, це не мій новий хлопець.","No, he's not my new boyfriend.","No, it's not my new guy.",42.240659014148186
229,Ти ніколи не займався чи що?,You never have class or what?!,You never took care of anything?,30.531660854379684
230,У чому проблема?,Where is the problem?,Why the problem?,60.21922627678994
231,Я можу тільки чекати.,I can only wait.,I can only wait.,100.0
232,Я можу лише чекати.,I can only wait.,I can only wait.,100.0
233,"Це зовсім не дивно, чи не так?","It's not much of a surprise, is it?","It's not weird, is it?",32.82920912770654
234,Я люблю тебе.,I love you.,I love you.,100.0
235,Я кохаю тебе.,I love you.,I love you.,100.0
236,Я тебе кохаю.,I love you.,I love you.,100.0
237,Я кохаю тебе!,I love you.,I love you!,100.0
238,Я тебе люблю.,I love you.,I love you.,100.0
239,Я люблю вaс.,I love you.,I love you.,100.0
240,Я вaс кохаю.,I love you.,I was cooking.,5.813953488372093
241,Я кохаю вaс.,I love you.,I am in the kitchen.,3.546099290780141
242,Я вaс люблю.,I love you.,I loved it.,39.107142857142854
243,Я вас люблю.,I love you.,I love you.,100.0
244,Я вас кохаю.,I love you.,I love you.,100.0
245,Ти мені вже не подобаєшся.,I don't like you anymore.,You don't like me anymore.,63.360926064073155
246,Ти мені більше не подобаєшся.,I don't like you anymore.,You don't like me anymore.,63.360926064073155
247,Мені цікаво.,I am curious.,I'm curious.,73.47883597883599
248,Хочу знати.,I am curious.,I want to know.,4.901960784313725
249,Хочу дізнатися.,I am curious.,I want to know.,4.901960784313725
250,Я допитливий.,I am curious.,I'm a whistle.,8.169934640522875
251,Вітаю!,Congratulations!,I'll see you!,4.761904761904763
252,Вiтаємо.,Congratulations!,We are going.,8.42508377213978
253,Поздоровляю!,Congratulations!,I'm going to get better!,9.564985158817288
254,Мої привітання!,Congratulations!,My welcome!,2.415458937198068
255,Вітаємо!,Congratulations!,We are here!,2.415458937198068
256,Вітаю.,Congratulations!,I'll see.,2.487562189054726
257,Не хочу чекати так довго.,I don't want to wait that long.,I don't want to wait that long.,100.0
258,Я не хочу так довго чекати.,I don't want to wait that long.,I don't want to wait that long.,100.0
259,Чого ти до нас приходиш?,Why don't you come visit us?,What do you come to us for?,30.772942009848098
260,Але ймовірність невелика.,But the possibility seems unlikely.,But the unfortunate one.,17.52610562803282
261,Мені не слід було виходити з системи.,I shouldn't have logged off.,I shouldn't have come from the system.,54.4627105210594
262,"Я не знаю, що ще можна зробити.",I don't know what to do anymore.,I don't know what else to do.,60.03969932749822
263,"Я не знаю більше, що робити.",I don't know what to do anymore.,I don't know what to do.,73.29495424094358
264,"Я більш не знаю, що мені робить.",I don't know what to do anymore.,"I don't know, I do.",39.12968183239832
265,"Я неодмінно колись поїду у Францію, але ще не знаю, коли саме.","It is inevitable that I go to France someday, I just don't know when.","I don't want to go to France, but I don't know when.",41.1668882602598
266,Я не люблю хімію.,I hate chemistry.,I don't like chemistry.,61.47588263302771
267,Я ненавиджу хімію.,I hate chemistry.,I don't like chemistry.,61.47588263302771
268,"Я не бажав, щоб так трапилось.",I didn't want this to happen.,I didn't want to get caught like that.,49.95346058014696
269,Які в мене є ще варіанти?,What other options do I have?,Which ones are there?,17.265794032035114
270,Я - невеликий мандрiвник.,I am not much of a traveller.,I'm a small businessman.,9.296718348442488
271,Я не занадто сильно люблю подорожувати.,I am not much of a traveller.,I don't like to travel too much.,30.47657865845883
272,Мені більше нема чим зайнятися.,I have nothing better to do.,I don't have much to do.,21.299815828284512
273,Я теж не можу це пояснити.,I can't explain it either.,I can't explain it either.,100.0
274,Я теж не знаходжу пояснення цьому.,I can't explain it either.,I don't know about that either.,30.504549301855256
275,Кожен має сильні та слабкі сторони.,Everyone has strengths and weaknesses.,Everyone has a weak side.,38.64622859905938
276,"Це лише показує, що ти не робот.",It only shows you're not a robot.,It just shows that you're not a robot.,62.93049181181316
277,Як я можу бути роботом? Роботи не бачать снів.,How could I be a robot? Robots don't dream.,How can I be a robot?,33.39246671265934
278,Як я можу бути роботом? Роботи не мріють.,How could I be a robot? Robots don't dream.,How can I be a robot?,33.39246671265934
279,"Це не те, що може зробити кожен.",It's not something anyone can do.,"It's not you, it's everyone.",28.60171864272815
280,"Я не знаю, чи я все ще це маю.",I don't know if I still have it.,"I don't know, I'll have it all.",60.8298208335239
281,"Як ти гадаєш, що я робив?",What do you think I've been doing?,"How are you doing, what did I do?",23.352303869036035
282,"А що, на твою думку, я робив?",What do you think I've been doing?,"What, in your opinion, did I do?",19.427513348171015
283,"А що, на твою думку, я роблю?",What do you think I've been doing?,"What, in your opinion, am I doing?",27.17908455949666
284,Не недооцінюй моєї сили.,Don't underestimate my power.,Don't underestimate my strength.,76.92697293473388
285,Не недооцінюй моєї влади.,Don't underestimate my power.,Don't underestimate my power.,100.0
286,Мама не дуже добре говорить англійською.,My mom doesn't speak English very well.,Mom's not very good at speaking English.,36.91715160558559
287,Я недостатньо добре говорю французькою!,I don't speak French well enough!,I'm not very good at French!,21.517572458101604
288,Саме в цьому й полягає проблема.,Therein lies the problem.,That's the problem.,50.62517869186658
289,У цьому і є проблема.,Therein lies the problem.,That's the problem.,50.62517869186658
290,Як ти знайдеш їжу в космосі?,How do you find food in outer space?,How do you find food in space?,73.94482013836738
291,Як можна знайти їжу в космосі?,How do you find food in outer space?,How do you find food in space?,73.94482013836738
292,"Все, що ви можете робити, — це довіряти один одному.",All you can do is trust one another.,"Everything you can do, you can trust one.",47.5820211199423
293,Усі хочуть зустрітись з вами. Ви знаменитий!,Everyone wants to meet you. You're famous!,They want to meet you.,29.582465302338452
294,"Всі хочуть з тобою познайомитися, ти знаменитий!",Everyone wants to meet you. You're famous!,"They want to know you, you celebrity!",16.451963888492074
295,"Чому ти жалкуєш за тим, чого не робив?",Why are you sorry for something you haven't done?,Why don't you regret what you didn't do?,21.580807306857825
296,"Чому ти вибачаєшся за те, чого ти не робив?",Why are you sorry for something you haven't done?,Why don't you watch what you did?,16.392830422403563
297,Іноземці цікаві.,Foreign people intrigue me.,I don't know.,4.084967320261438
298,Іноземці мене інтригують.,Foreign people intrigue me.,I'm intrigued by the land.,29.782347627016165
299,"Щоб я не робив, вона каже, що я можу зробити краще.","Whatever I do, she says I can do better.","To not do it, she says, that I can do better.",54.64308680121033
300,Чого ти ще не спиш так пізно?,What keeps you up so late?,Why don't you sleep so late?,43.09122190895926
301,Що тримає тебе так пізно?,What keeps you up so late?,What's so late for you?,33.776391649406776
302,Чому ти ще не спиш у таку пізню годину?,What keeps you up so late?,Why don't you sleep at this late hour?,24.59519362870113
303,Мені нема з ким їхати.,I don't have anyone who'd travel with me.,I don't know who to go to.,18.451637610084106
304,Ти недостатньо швидкий.,You're not fast enough.,You're short.,26.313131253165544
305,"Життя жорстке, але я жорсткіший.","Life is hard, but I am harder.","Life is hard, but I'm hard.",72.27225739004915
306,Зносити може бути незносним.,Bearing can be unbearable.,To be unconscious can be.,22.03806319292984
307,"Нічого так не гарне, як істина.",Nothing is beautiful but the truth.,Nothing is as good as the truth.,46.60224170450985
308,Завтра він висадиться на Місяці.,"Tomorrow, he will land on the moon.",He'll be in the moon tomorrow.,44.891252533341344
309,Я не розмовляю японською.,I don't speak Japanese.,I don't talk Japanese.,60.68496837313061
310,Це гра слів.,This is a pun.,It's a graph.,10.37037037037037
311,Ніхто мене не розуміє.,Nobody understands me.,No one understands me.,67.6153620882031
312,Я навчився жити без неї.,I learned to live without her.,I started living without her.,45.06888102997942
313,Я навчилася жити без неї.,I learned to live without her.,I learned to live without her.,100.0
314,Немає сенсу продовжувати розмірковувати.,It's useless to keep on thinking any more.,There's no point in continuing to count.,15.976419168449171
315,В цi днi у своïй головi я тримаю дуже багато справ.,I have too many things on my mind these days.,I have a lot of friends in my head.,20.031783561560896
316,Останнім часом у мене в голові занадто багато всього різного.,I have too many things on my mind these days.,"The last time I was in my head, it was too much.",17.848309778456837
317,Я лише хотів перевірити свою скриньку електронної пошти.,I just wanted to check my email.,I just wanted to check my e-mail.,88.29133640288799
318,"Тобі справді потрібно спитати, щоб дізнатись відповідь?",Do you really need to ask the question to know the answer?,To be asked to know?,16.053429248358817
319,"Припускаю, що за кожною річчю, яку ми повинні зробити, є щось, що ми хочемо зробити.","I suppose that behind each thing we have to do, there's something we want to do...","I admit, for every thing, I have to do something, something we want to do.",47.51139830444411
320,"Припускаю, що за кожною річчю, яку потрібно зробити, є щось, що хочеться зробити.","I suppose that behind each thing we have to do, there's something we want to do...","I let everything I need to do, something I want to do.",32.77343094800657
321,"Не чекай, щоб інші подумали за тебе.",Don't expect others to think for you!,Don't wait for others to think of you.,54.05794843725879
322,У тебе ніколи немає часу на важливі речі!,You never have time for important things!,You never have time for important things!,100.0
323,"Я витрачу надто багато часу на пояснення, чому це не спрацює.",It would take me too much time to explain to you why it's not going to work.,I spend a lot of time explaining why it doesn't work.,26.951053822819965
324,"Я такий дурний... Я намагаюся тобі пояснити те, що сам не розумію.",I'm so dumb... I'm trying to explain things to you that I don't understand myself.,I'm trying to explain to you what I don't understand.,61.46564483245495
325,"Припини в менi бачити ""нормальну"" людину!","Stop seeing me as a ""normal"" person!",Stop seeing the normal person!,55.92827102600479
326,"Перестань бачити в мені ""нормальну"" людину!","Stop seeing me as a ""normal"" person!",Stop seeing me as a normal person!,73.74113703676328
327,Ви маєте на увазі мене?,Are you referring to me?,Do you have respect for me?,18.404175895762307
328,Неможливо!,It can't be!,Nemo is nice!,5.434782608695651
329,Це неможливо!,It can't be!,It is impossible!,8.519078201737814
330,Цього не може бути!,It can't be!,This can't be!,62.879769601914006
331,Ви б хотіли чогось випити?,Would you like something to drink?,Would you like to know what?,43.30467111107973
332,Ти не хотів би чогось випити?,Would you like something to drink?,Didn't you want to ask?,11.25563818339727
333,Ви бажаєте щось випити?,Would you like something to drink?,Do you want to do something?,34.52714624808021
334,Ти бажаєш щось випити?,Would you like something to drink?,Do you want to do something?,34.52714624808021
335,"""Хто це?"" - ""Це твоя мати"".","""Who is it?"" ""It's your mother.""","""Who is this?"" ""This is yours"".",33.41684967663737
336,"""Хто це?"" - ""Твоя мати"".","""Who is it?"" ""It's your mother.""","""Who is this?"" - ""Your mother"".",50.929812146925876
337,"""Хто це?"" - ""Це мама"".","""Who is it?"" ""It's your mother.""","""Who is this?"" ""This is Mom"".",25.526763329523188
338,"""Коли повернешся?"" ""Все залежить від погоди""","""When will you be back?"" ""It all depends on the weather.""","""Will you come back?"" ""Everyone depends on the weather"".",62.08593023868869
339,"""У чому справа?"" - запитав маленький білий кролик.","""What's the matter?"" asked the little white rabbit.","""Why is that?"" asked the little rabbit.",53.76297355572049
340,"""Що відбувається в печері? Мені цікаво"". — ""Я не маю уяви"".","""What's going on in the cave? I'm curious."" ""I have no idea.""","""What's going on in the cave?"" ""I don't know"".",54.347824145723536
341,Е... Як це працює?,Uh... How's that working?,Well... how does it work?,20.645503653861503
342,"«Вірте мені», — сказав він.","""Trust me,"" he said.","I'm sorry, he said.",30.40702826911033
343,"""Здається, це дуже цікаво"", каже Хіросі.","""This looks pretty interesting,"" Hiroshi says.","""It's very interesting"", says Hiroshi.",49.1355133207292
344,«Дякую за допомогу.» «Нема за що.»,"""Thank you for helping me."" ""Don't mention it.""",Thank you for your help.,34.22714510092813
345,"«Дякую, що ви допомогли мені.» «Нема за що.»","""Thank you for helping me."" ""Don't mention it.""","I'm sorry, what did you help me with?",14.973156538343064
346,«Спасибі за вашу допомогу.» «Нема за що.»,"""Thank you for helping me."" ""Don't mention it.""",Thank you for your help.,34.22714510092813
347,«Дякую за вашу допомогу.» «Нема за що.»,"""Thank you for helping me."" ""Don't mention it.""",Thank you for your help.,34.22714510092813
348,"Будь ласка, не плач.",Please don't cry.,Please don't cry.,100.0
349,"Не плач, будь ласка.",Please don't cry.,"Dont cry, please.",37.09457196877647
350,"Дай мені знати, якщо є щось, що я можу зробити.",Let me know if there is anything I can do.,Let me know if there's something I can do.,74.17293711090095
351,Заняття не пончеться до половини на восьму.,Class doesn't begin until eight-thirty.,Don't worry about the eighth half.,17.185152667053835
352,Урок не пончеться до половини на восьму.,Class doesn't begin until eight-thirty.,Lesson not to be missed until half past eight.,25.224714656663966
353,"Я хочу човен, який забере мене дуже далеко звідси.",I want a boat that will take me far away from here.,I want a boat that will take me far away.,81.61973922489777
354,Японець ніколи б не зробив такого.,A Japanese would never do such a thing.,Japan never did that.,27.99541424553556
355,Японець ніколи б так не вчинив.,A Japanese would never do such a thing.,Japan never did that.,27.99541424553556
356,Аллен — поет.,Allen is a poet.,Alen is a poet.,82.91360088975661
357,Стрілець вбив оленя.,The archer killed the deer.,I killed a wolf.,20.071774847234185
358,На моєму віці комунізму точно не буде досягнуто.,Communism will never be reached in my lifetime.,"At my age, the communism will not be achieved.",41.8984484389337
359,Жито називали зерном злидарів.,Rye was called the grain of poverty.,They called me a bear.,19.757696733858463
360,"Якщо ти бачиш помилку, виправ її, будь ласка.","If you see a mistake, then please correct it.","If you miss it, please correct it.",52.4717781636852
361,"Якщо ви бачите помилку, виправте її, будь ласка.","If you see a mistake, then please correct it.","If you see a mistake, correct it, please.",76.15064078297547
362,"Якщо побачиш помилку, виправ її, будь ласка.","If you see a mistake, then please correct it.","If you see a flower, please pick it up.",35.89952784757654
363,"Якщо побачите помилку, виправте її, будь ласка.","If you see a mistake, then please correct it.","If you see it, correct it, please.",51.04741895684409
364,"Якщо не їсти, то помреш.","If you don't eat, you die.","If you don't eat, you'll die.",84.02767274151635
365,"Якщо не їси, то вмираєш.","If you don't eat, you die.","If you don't eat, you die.",100.0
366,Якщо ти не будеш їсти - помреш.,"If you don't eat, you die.","If you don't eat, you'll die.",84.02767274151635
367,"Як пишеться ""pretty""?","How do you spell ""pretty""?","How do you spell ""pretty""?",100.0
368,"Як пишеться слово ""pretty""?","How do you spell ""pretty""?","How do you spell ""pretty""?",100.0
369,Чому ми не йдемо додому?,Why don't we go home?,Why don't we go home?,100.0
370,Чому б нам не піти додому?,Why don't we go home?,Why don't we have a drink?,51.185607392213065
371,"Вибачте, я не можу залишитися надовго.","I'm sorry, I can't stay long.",I can't stay long.,63.942807887870345
372,"""Чому ти не йдеш?"" - ""Бо не хочу"".","""Why aren't you going?"" ""Because I don't want to.""","""Why don't you go?"" - ""I don't want to go"".",47.63502021492504
373,"""Чому ви не йдете?"" - ""Бо не хочу"".","""Why aren't you going?"" ""Because I don't want to.""","""Why don't you go?"" - ""I don't want to go"".",47.63502021492504
374,Один мільйон осіб втратили життя на війні.,One million people lost their lives in the war.,One million people have lost their lives in war.,81.25374192907127
375,"Демократія — найгірша форма правління за винятком усіх інших, які людство спробувало до цього часу.","Democracy is the worst form of government, except all the others that have been tried.",Democracy is the most widespread form of rule except for all the others that people have tried so far.,55.437384631326715
