Unnamed: 0,UK,EN,TRANSLATION,chrf_score
733,Але ти мені ніколи про це не казав!,But you've never told me about this!,But you never told me about it!,67.25649808242808
734,Я змінив розмітку свого сайту.,I've changed my website's layout.,I changed the size of my website.,46.11536758776001
735,Я змінила розмітку свого сайту.,I've changed my website's layout.,I changed the size of my website.,46.11536758776001
736,В тебе було повно часу.,You had plenty of time.,You were full of time.,29.61443703019254
737,В тебе було багато часу.,You had plenty of time.,You had a lot of time.,46.24294464734523
738,Припини мене критикувати!,Stop criticizing me!,Stop criticizing me!,100.0
739,Перестань мене критикувати!,Stop criticizing me!,Stop criticizing me!,100.0
740,Перестаньте мене критикувати!,Stop criticizing me!,Stop criticizing me!,100.0
741,"Ну ж бо, поговори зі мною, Транґу.","Come on! Talk to me, Trang.","Well, talk to me, Trans.",53.15099184754758
742,Я майже закінчив.,I'm almost done.,I almost quit.,34.015667765148585
743,Я майже закінчила.,I'm almost done.,I almost finished.,35.34753158685254
744,Я майже скінчив.,I'm almost done.,I almost quit.,34.015667765148585
745,Я майже скінчила.,I'm almost done.,I almost got rid of it.,34.26697030758684
746,Візьми інший стілець!,Take the other chair!,The other one is standing!,33.19803312865141
747,Скільки залишилося бутербродів?,How many sandwiches are there left?,What's left of the bread?,15.70286942515854
748,Скільки канапок лишилось?,How many sandwiches are there left?,How many canals were lost?,29.603605158135814
749,Я не буду опускатися до його рівня.,I won't lower myself to his level.,I won't let him down.,26.519170890845032
750,З вікна нам було видно захід сонця.,We could see the sunset from the window.,We were told the sun was shining.,23.501173079659342
751,Це зводить мене з глузду.,It's driving me crazy.,It's the same with me.,14.694751750660362
752,"Ти сказав, що я ніколи не зможу виграти?",Did you say that I could never win?,You said I'd never win?,40.487671777589654
753,"Ти сказала, що я ніколи не зможу перемогти?",Did you say that I could never win?,You said I could never win?,59.56148999864135
754,"Ти сказав, що мені ніколи не виграти?",Did you say that I could never win?,Did you say I never won?,44.57962859363721
755,"Ти сказала, що мені ніколи не перемогти?",Did you say that I could never win?,You said I'd never win?,40.487671777589654
756,На вулиці темно як у льоху.,It's all dark outside.,In the dark like a leaf.,17.30119825708061
757,Що сталося? Вода по всій хаті!,What happened? There's water all over the apartment.,What happened?,29.60471382316019
758,"Ви будете говорити і робити те, що ваші батьки говорили і робили, навіть якщо ви присягнетеся, що ніколи не зробили би це.","You will say and do things your parents said and did, even if you swore you would never do them.","You will talk and do what your parents said and did, even if you never did.",56.644386463592944
759,Я застарий для цього світу.,I am too old for this world.,I'm stuck in this world.,37.75996558917599
760,"Життя починається тоді, коли ви готові його жити.",Life begins when you're ready to live it.,"Life starts then, when you're ready to live.",66.89249115694686
761,Вчитися ніколи не пізно.,It is never too late to learn.,Never be late.,17.867406626224618
762,"Зараз лише п'ята година ранку, але вже світло.","It's just five in the morning, but nevertheless it is light out.","It's only a few years old, but it's light.",18.060128744250864
763,Він розповів мені історію свого життя.,He told me the story of his life.,He told me about his life.,47.64874346068355
764,"Навіть не знаю, чи створений я для цього світу.",I wonder if I am made for this world.,"I don't know, I'm made for this world.",60.38521493889976
765,Про що ви говорите!?,What are you talking about?,What are you talking about?,100.0
766,Я хочу цукерку.,I want a piece of candy.,I want sugar.,17.741639519272656
767,Хочу цукерку.,I want a piece of candy.,I want sugar.,17.741639519272656
768,"Я знав, що сьогодні буде весело.",I knew that today would be fun.,"I know, it'll be fun today.",30.26036388948073
769,"Я знала, що сьогодні буде весело.",I knew that today would be fun.,I knew it would be fun today.,58.3530301338426
770,"Це може здатися притягнутим за волосся, але це реальна проблема.","It might sound far-fetched, but this is a real problem.","It may seem like a haircut, but it's a real problem.",35.38666491375974
771,Коли ми їмо? Я зголоднів!,When are we eating? I'm hungry!,I'm hungry!,33.228376341100855
772,Коли ми будемо їсти? Я голодний!,When are we eating? I'm hungry!,Will we eat? I am hungry!,36.012381109288626
773,У мене завтра заняття.,I have class tomorrow.,I'll be in class tomorrow.,66.61426200252288
774,Не можу в це повірити!,I can't believe it!,I can't believe this!,83.2290730310455
775,"«Дякую», — «Нема за що».","""Thank you."" ""You're welcome.""",I'm not doing anything.,6.3332502531796075
776,"«Дякую», — «На здоров'я».","""Thank you."" ""You're welcome.""","I'm fine, I'm fine, I'm fine, I'm fine, I'm fine, I'm fine, I'm fine, I'm fine, I'm fine, I'm fine, I'm all right, I'm all right, I'm all right",4.105090311986864
777,"""Дякую."" ""Будь ласка.""","""Thank you."" ""You're welcome.""","""I'll take care of it"". ""Listen to me"".",16.34440211619003
778,"""Дякую."" ""Прошу.""","""Thank you."" ""You're welcome.""","""I'll take care of it"".",8.505847922990958
779,"""Дякую."" ""Дуже прошу.""","""Thank you."" ""You're welcome.""",I beg you.,5.611063937541216
780,"""Спасибi."" ""Прошу.""","""Thank you."" ""You're welcome.""","""Spacy."" ""I'm going to die"".",10.304288733436492
781,"""Дякую"". — ""Прошу"".","""Thank you."" ""You're welcome.""","""I'll take care of it"".",8.505847922990958
782,"""Спасибі"". — ""Нема за що"".","""Thank you."" ""You're welcome.""","""I'm sorry"". ""I'm not going to do that"".",10.228617169598051
783,"""Дякую"". — ""Нема за що"".","""Thank you."" ""You're welcome.""","""I'll take care of it"".",8.505847922990958
784,"Як вимовляється ""pronounce""?","How do you pronounce ""pronounce""?",How do you pronounce it?,59.12622106859462
785,Зима — моя улюблена пора року.,Winter is my favorite season.,Winter is my favorite time of year.,72.04449262764359
786,"Факти вказують, що оптимальною тривалістю лекції є 30, а не 60 хвилин.",The data suggest that the optimum length of a lecture may be 30 instead of 60 minutes.,"In fact, the optimal duration of the lecture is 30 minutes, not 60 minutes.",36.18578353793248
787,Я багато чому навчився від тебе.,I learned a lot from you.,I learned a lot from you.,100.0
788,Я багато чому від тебе навчився.,I learned a lot from you.,I learned a lot from you.,100.0
789,Я багато чому від вас навчився.,I learned a lot from you.,I learned a lot from you.,100.0
790,Я від тебе багато чому навчився.,I learned a lot from you.,I've learned a lot from you.,91.40290676289241
791,Я від вас багато чому навчився.,I learned a lot from you.,I've learned a lot from you.,91.40290676289241
792,Ми багато гуляли.,We walked a lot.,We walked a lot.,100.0
793,Я провів у потязі дванадцять годин.,I spent twelve hours on the train.,I spent twelve hours in the bathroom.,67.49314778256203
794,Я дванадцять годин провів у потязі.,I spent twelve hours on the train.,I spent twelve hours in the bathroom.,67.49314778256203
795,Я дванадцять годин провела у потязі.,I spent twelve hours on the train.,I spent twelve hours in the bathroom.,67.49314778256203
796,Я провела у потязі дванадцять годин.,I spent twelve hours on the train.,I spent twelve hours in the car.,69.01594954750281
797,Вона захворіла у ці вихідні.,She got sick this weekend.,She was sick this weekend.,72.21184087670154
798,"Зачекай, хтось стукає до мене у двері.","Hold on, someone is knocking at my door.","Wait, someone knocks on my door.",41.36653758605681
799,Він багатий. Йому не потрібні гроші!,He's rich. He doesn't need money!,He's rich. You don't need money!,65.60634012257495
800,Він спить як немовля.,He's sleeping like a baby.,He sleeps like a baby.,52.78354809249414
801,Він спить як дитина.,He's sleeping like a baby.,He sleeps like a child.,30.469238932827864
802,"Він спить, як немовля.",He's sleeping like a baby.,He sleeps like a baby.,52.78354809249414
803,Він спить як дитя.,He's sleeping like a baby.,He sleeps like a child.,30.469238932827864
804,"Вони надто шумлять, я не можу сконцентруватися.",They're making too much noise. I can't concentrate.,"They're overwhelmed, I can't concentrate.",51.208722225888906
805,Хочу масаж. Мені треба розслабитися.,I want a massage. I need to relax.,I want to massage. I need to relax.,83.03577345649956
806,Ти хворий. Тобі потрібно відпочити.,You're sick. You have to rest.,You need to rest.,24.7408375243499
807,Ти хвора. Тобі потрібно відпочити.,You're sick. You have to rest.,You're sick. You need to rest.,68.0920928804224
808,Ви хвора. Вам потрібно відпочити.,You're sick. You have to rest.,You need to rest.,24.7408375243499
809,Ви хворі. Вам потрібно відпочити.,You're sick. You have to rest.,You need to rest.,24.7408375243499
810,Ви хворий. Вам потрібно відпочити.,You're sick. You have to rest.,You need to rest.,24.7408375243499
811,Вона вимагає неможливого.,She's asking for the impossible.,She demands the impossible.,49.8415509178589
812,Вона просить про неможливе.,She's asking for the impossible.,She asked for help.,16.64194491235342
813,Він зник без сліду.,He disappeared without a trace.,He's gone without a trace.,49.72012597520668
814,Він зник безслідно.,He disappeared without a trace.,He's a winner.,8.070267381877223
815,Він безслідно зник.,He disappeared without a trace.,He's a wretch.,9.519569847421531
816,"Я можу покласти долоні на підлогу, не згинаючи коліна.",I can place the palms of my hands on the floor without bending my knees.,"I can put the bottom on the floor, not the collar.",26.76743775669474
817,Не може бути прогресу без спілкування.,There cannot be progress without communication.,There can be no progress without communication.,83.17392483636061
818,"Кожен хотів би вірити, що мрії можуть збутися.",Everyone would like to believe that dreams can come true.,"I wanted to be free, but they can be.",13.328941896407448
819,Кращий спосіб реалізувати свої мрії - це прокинутися.,The best way to make your dreams come true is to wake up.,The best way to realize your dreams is to move on.,51.26666495025658
820,Світ не крутиться довкола тебе.,The world doesn't revolve around you.,Don't go around like that.,19.2515646615281
821,Світ повний дурнів.,The world is full of fools.,I'm all right.,5.312059187609752
822,У світі повно дурнів.,The world is full of fools.,I'm at the mall.,5.303913746189569
823,"Ви хочете сказати, що моє життя у небезпеці?",Are you saying my life is in danger?,You want to say that my life is in danger?,58.620890048784105
824,"У тебе є ідея щодо того, на що схоже моє життя?",Do you have any idea what my life is like?,Do you have any idea what my life is like?,100.0
825,"Ти хоч уявляєш собі, на що схоже моє життя?",Do you have any idea what my life is like?,"You're even thinking about yourself, what's my life like?",30.139332935792417
826,"Ви хоч уявляєте собі, на що схоже моє життя?",Do you have any idea what my life is like?,Do you want to be like me?,19.814055650184873
827,В цьому місці панує таємнича атмосфера.,This place has a mysterious atmosphere.,There's a secret atmosphere in this place.,48.13492478775365
828,Це місце має таємничу атмосферу.,This place has a mysterious atmosphere.,This place has a secret atmosphere.,62.213537173245136
829,Я з нетерпінням очікую почути ваші думки щодо цієї теми.,I look forward to hearing your thoughts on this matter.,I can't wait to hear your thoughts on this topic.,49.94452675963918
830,"Ну й що, що я ґей? Це що, злочин?",So what if I am gay? Is it a crime?,"What, what, what, what, what, what, what?",9.653480345465232
831,"Ну то й що, що я голубий? Це що, злочин?",So what if I am gay? Is it a crime?,"What am I, a criminal?",21.509623386091786
832,Я не хочу потерпіти невдачу на іспитах.,I don't want to fail my exams.,I don't want to lose my education.,51.370955553002794
833,Я не хочу провалити екзамени.,I don't want to fail my exams.,I don't want to fail the exams.,76.4496569889536
834,Моя мати купила дві пляшки апельсинового соку.,My mother bought two bottles of orange juice.,My mother bought two bottles of orange juice.,100.0
835,Вона була в чорному капелюсі.,She was wearing a black hat.,She was in a black hat.,55.21838596773099
836,На ній був чорний капелюх.,She was wearing a black hat.,There was a black hat.,46.14832595555093
837,Ми зробили млинці на сніданок.,We made pancakes for breakfast.,We made a breakfast.,46.240429825443414
838,На сніданок ми зробили млинці.,We made pancakes for breakfast.,They made me a snack.,14.990920200373722
839,"Я провів увесь день, спілкуючись із друзями.",I spent the whole afternoon chatting with friends.,I spent the whole day talking to my friends.,46.234324563070494
840,"Я провела весь день, спілкуючись із друзями.",I spent the whole afternoon chatting with friends.,I spent the whole day talking to my friends.,46.234324563070494
841,Я хочу бути більш незалежним.,I want to be more independent.,I want to be more independent.,100.0
842,Я хочу бути більш незалежною.,I want to be more independent.,I want to be more independent.,100.0
843,"Ти що, так весь день там і стоятимеш?",Are you just going to stand there all day?,"What, are you standing there all day?",52.678094567330255
844,"Ви що, так весь день там і стоятимете?",Are you just going to stand there all day?,"What, is the whole day standing there?",27.82983579074465
845,У кроликів довгі вуха та коротий хвіст.,A rabbit has long ears and a short tail.,The crows are long and crowned.,14.86074609430543
846,Твій секрет буде зі мною у безпеці.,Your secret will be safe with me.,Your secret will be with me.,77.94622194366177
847,Я нікому не розкрию твого секрету.,Your secret will be safe with me.,I don't reveal your secret to anyone.,30.11595488135171
848,Ваш секрет буде зі мною у безпеці.,Your secret will be safe with me.,Your secret will be with me.,77.94622194366177
849,Я нікому не розкрию вашого секрету.,Your secret will be safe with me.,I don't want to reveal your secret.,31.265802735595194
850,Я не хочу більше чути жодних скарг.,I don't want to hear any more of your complaining.,I dont want to hear more complaints.,48.34998793377438
851,Математика - це не лише запам'ятовування формул.,Mathematics is not just the memorization of formulas.,Mathematics is not just a form of mathematics.,55.33291362231255
852,Я не хотів справити на тебе таке враження.,I didn't mean to give you that impression.,I didn't want to make such a fuss about you.,27.983563634777404
853,Я не хотів справити на вас таке враження.,I didn't mean to give you that impression.,I didn't want to make such a fuss about you.,27.983563634777404
854,Я втомився від фаст-фуду.,I'm tired of eating fast food.,I was in fast food.,31.48599319238515
855,Я втомилася від фаст-фуду.,I'm tired of eating fast food.,I was tired of fast food.,49.17100166531683
856,Я втомилася їсти фаст-фуд.,I'm tired of eating fast food.,I was tired of fast food.,49.17100166531683
857,Я втомився їсти фаст-фуд.,I'm tired of eating fast food.,I ate fast food.,32.1423276055378
858,Суть математики - свобода.,The essence of mathematics is liberty.,Mathematics is freedom.,38.76385259392903
859,Де туалет?,Where is the bathroom?,The toilet?,8.780989020807384
860,Де прибиральня?,Where is the bathroom?,The cleaning?,6.685942916383193
861,Де знаходиться туалет?,Where is the bathroom?,Where's the toilet?,27.644627795034403
862,Сутність свободи — у математиці.,The essence of liberty is mathematics.,The freedom of mathematics.,37.71282351435628
863,"Те, що він розповів, було занадто смішним, щоб йому хтось повірив.",His story was too ridiculous for anyone to believe.,"They, what he told, was too smashed, so that he could be someone else.",21.174165581779945
864,Скільки годин сну тобі потрібно?,How many hours of sleep do you need?,How much do you need?,38.55609847798336
865,Скільки годин сну вам потрібно?,How many hours of sleep do you need?,How much do you need?,38.55609847798336
866,Скільки тобі потрібно годин сну?,How many hours of sleep do you need?,How much do you need?,38.55609847798336
867,Скільки вам потрібно годин сну?,How many hours of sleep do you need?,How much do you need?,38.55609847798336
868,Кожна людина - це окремий світ.,Each person is a world.,Every man is a stranger.,16.187609240444075
869,"Як ти думаєш, люди колись колонізують Місяць?",Do you think mankind will someday colonize the Moon?,How do you think people colonize the moon?,43.90035707758137
870,Життя у в'язниці є гіршим за життя тварини.,Life in prison is worse than the life of an animal.,Life in prison is a beast of life.,41.18634984908402
871,"Я пишаюся тим, що я - частина цього проекту.",I am proud to be a part of this project.,"I'm writing this, that I'm part of this project.",52.838099725899156
872,Чому ми не можемо самі себе полоскотати?,Why can't we tickle ourselves?,Why can't we just throw ourselves away?,56.76236099912114
873,У тебе вже є борода?,Have you got a beard already?,Are you already bored?,33.34470689651083
874,"Я відчуваю, що я вільний.",I feel that I am free.,I feel what I am.,44.403024614358884
875,Я хочу MP3-плеєр!,I want an MP3 player!,I want MP3-player!,49.108556898093894
876,"Їдячи піцу, він набридав своїй сестрі.",While eating a pizza he was annoying his sister.,"He's eating pizza, he's eating his sister.",50.029385174428754
877,Що?! Ти з'їв мого шоколадного ведмедя?!,What?! You ate my chocolate bear?!,What?! Did you eat my chocolate bear?!,67.38223134112053
878,Що?! Ти з'їв мого шоколадного ведмедика?!,What?! You ate my chocolate bear?!,What?! Did you eat my chocolate bear?!,67.38223134112053
879,Що?! Ти з'їла мого шоколадного ведмедика?!,What?! You ate my chocolate bear?!,What?! You took my chocolate bear?!,76.94260292419735
880,Де ти?,Where are you?,Where are you?,100.0
881,Де ви?,Where are you?,Where are you from?,83.37220329770263
882,Ти де?,Where are you?,You?,15.541258547403439
883,Ви де?,Where are you?,Do you?,17.226799653078924
884,Він нещодавно опублікував низку цікавих статей.,He has just published an interesting series of articles.,He recently published a number of interesting articles.,54.47191193329567
885,Ти мене бісиш!,You piss me off!,You are crazy!,10.436889467672767
886,Неможливо!,No way!,Nemo is nice!,6.666666666666667
887,Це неможливо!,No way!,It is impossible!,2.941176470588235
888,Ні в якому разі!,No way!,"No, not at all!",14.008908685968818
889,В жодному разі!,No way!,In the middle!,0.0
890,Ніколи!,No way!,"No, not at all!",14.008908685968818
891,Дзуськи!,No way!,Dzuśki!,0.0
892,Цього не може бути!,No way!,This can't be!,3.225806451612903
893,Не може бути!,No way!,It can't be!,3.4482758620689653
894,Це глухий кут.,It's a dead end.,This is a stupid corner.,8.807024281995478
895,Я не завжди довіряю перекладам.,I don't necessarily trust translations.,I don't always translate.,33.75555707742784
896,"Позавчора ти вразив усіх, але я вже знав тебе.","The day before yesterday you impressed everyone, but I already knew you.","You were all enemies yesterday, but I already know you.",41.2438541033614
897,"Життя не довге, воно широке!","Life is not long, it is wide!","Life is not long, it's wide!",80.05243910429668
898,"Коли я був у твоєму віці, Плутон був планетою.","When I was your age, Pluto was a planet.","When I was your age, Pluto was a planet.",100.0
899,Вона на межі нервового зриву.,She is on the verge of a nervous breakdown.,She's on the edge of nervousness.,36.47543817358422
900,"Слони - найбільші наземні тварини, що існують у наші дні.",Elephants are the largest land animals alive today.,The biggest animals on earth exist in our days.,25.302520054088774
901,Фрукти та овочі важливі для збалансованого харчування.,Fruits and vegetables are essential to a balanced diet.,Fruits and vegetables are important for balanced eating.,61.05674061670337
902,"Сир - це тверда їжа, яку роблять із коров'ячого, козячого, овечого молока й молока інших ссавців.","Cheese is a solid food made from the milk of cows, goats, sheep, and other mammals.","Sir - it's hard food, you make it from cow's milk, cow's milk and other dairy products.",25.9318592811495
903,"Мені, як і раніше, не подобаються ці Кавал’єрі, Тонеллі та Фубіні... і взавтра у мене знов усний іспит з матаналізу.","I still don't like Cavalieri, Tonelli, or Fubini... and my oral calculus exam is already tomorrow.",I don't like this Kavalli and Fubini... and tomorrow I'll have a test with you.,34.43069557058573
904,Я зазвичай приймаю душ ввечері.,I usually take a shower in the evening.,I usually take in the shower.,56.64060739355302
905,"Він провів вечір, читаючи книжку.",He spent the evening reading a book.,He spent the night reading a book.,68.13516943422593
906,"Ти думаєш про це питання увесь ранок. Зроби перерву, поїж.",You have been thinking about this problem the whole morning. Take a break; go eat lunch.,"You think about this whole thing, you're gonna run, you're gonna run.",26.06590631349983
907,"Якщо я не зроблю цього зараз, то не зроблю ніколи.","If I don't do it now, I never will.","If I don't do this now, I'll never do it.",55.71179131326228
