Unnamed: 0,de,uk,TRANSLATION,BLEU_Score,avg
0,12 ist eine gerade Zahl.,Дванадцять - це парне число.,12 це просто число.,1.1931009847695213e-231,0.12098807491951687
1,1 ist keine Primzahl.,Одиниця не є простим числом.,1 - це не просте число.,1.1640469867513693e-231,0.12098807491951687
2,3 hoch 3 ist 27.,Три в кубі дорівнює двадцять сім.,3 у кубі дорівнює 27.,6.867731683891005e-155,0.12098807491951687
3,"7 Dollar, bitte.","Сім доларів, будь ласка.","Сім доларів, будь ласка.",1.0,0.12098807491951687
4,Aber der Bauer lächelte ihn an.,Але фермер йому посміхнувся.,Але фермер усміхнувся до нього.,8.38826642100846e-155,0.12098807491951687
5,Aber die Leute haben wenig Hoffnung.,Але в людей замало надії.,Але люди не мають надії.,1.4488496539373276e-231,0.12098807491951687
6,Aber ich hatte keine Angst.,Але я не боявся.,Але я не боявся.,1.0,0.12098807491951687
7,Aber sicher!,Звичайно!,"Звичайно, що так.",1.384292958842266e-231,0.12098807491951687
8,Aber sicher!,Ну звичайно ж!,"Звичайно, що так.",1.384292958842266e-231,0.12098807491951687
9,Aber warum?,Але чому?,Але чому?,1.2213386697554703e-77,0.12098807491951687
10,Ach nein! Wirklich?,Не може бути! Серйозно?,Справді?,3.418291552750845e-232,0.12098807491951687
11,"Ach, nur das Übliche.","А, все як завжди.","Ну, це просто типова річ.",0.0,0.12098807491951687
12,"Ach richtig, ich hatte ja morgen etwas vor.","А так, завтра я збирався щось робити.","Так, я мав щось на завтра.",1.3934875572055278e-231,0.12098807491951687
13,Acht Hobbits bilden ein Hobbyte.,Вісім гобітів складають один гобайт.,Вісім хоббітів - це хобі.,1.2183324802375697e-231,0.12098807491951687
14,Affen sind intelligent.,Людиноподібні мавпи розумні.,Мавпи розумні.,9.047424648113057e-155,0.12098807491951687
15,Ah! Melkt man so eine Kuh?,"А, то он воно як доять корову...",А як щодо корови?,9.711929667259895e-232,0.12098807491951687
16,"Ah, so melkt man also eine Kuh?","А, то он воно як доять корову...","Ну, як ви смієте корову?",1.171778691554733e-231,0.12098807491951687
17,A ist der erste Buchstabe des Alphabets.,«А» - перша літера алфавіту.,А — це перша літера алфавіту.,5.253283993027542e-78,0.12098807491951687
18,Akzeptieren Sie Kreditkarten?,Ви приймаєте кредитні картки?,Ви приймаєте кредитні картки?,1.0,0.12098807491951687
19,Alice lächelte.,Аліса посміхнулася.,Аліса посміхнулася.,1.491668146240062e-154,0.12098807491951687
20,Alle auf der Fotografie lächeln.,На фотографії всі усміхаються.,Всі на фотографії посміхаються.,1.0547686614863434e-154,0.12098807491951687
21,Alle Bälle sind gelb.,Усі м'ячі жовті.,Всі кульки жовті.,1.384292958842266e-231,0.12098807491951687
22,Alle Bänke sind besetzt.,Всі лавки зайняті.,Всі лавки зайняті.,1.2213386697554703e-77,0.12098807491951687
23,Alle Blätter des Baums sind gelb geworden.,Усе листя на дереві стало жовтим.,Усі листя дерева стали жовтими.,9.97486269044271e-232,0.12098807491951687
24,Alle blieben.,Всі залишилися.,Усі залишилися.,1.5319719891192393e-231,0.12098807491951687
25,Alle Frauen sind schön.,Всі жінки гарні.,Всі жінки прекрасні.,1.133422688662942e-154,0.12098807491951687
26,Alle haben geschlafen.,Усі спали.,Всі спали.,1.5319719891192393e-231,0.12098807491951687
27,Alle haben wir ein Interesse an Geschichte. In gewissem Sinn sind wir alle Historiker.,Ми всі цікавимося історією. У певному сенсі ми всі історики.,"Усі ми зацікавлені в історії, і в певному розумінні всі ми є істориками.",1.3568676344828118e-231,0.12098807491951687
28,Alle halten Tom für etwas verrückt.,"Усі вважають, що Том трохи божевільний.",Усі вважають Том божевільним.,6.397495320955232e-155,0.12098807491951687
29,Alle hassen mich.,Усі мене ненавидять.,Всі мене ненавидять.,1.133422688662942e-154,0.12098807491951687
30,Alle hassen Tom.,Всі ненавидять Тома.,Усі ненавидять Тома.,1.133422688662942e-154,0.12098807491951687
31,Alle hatten ein gutes Jahr.,У кожного був гарний рік.,У всіх був гарний рік.,7.380245217279165e-78,0.12098807491951687
32,Alle hatten ein gutes Jahr.,Усі вони мали гарний рік.,У всіх був гарний рік.,8.38826642100846e-155,0.12098807491951687
33,Alle hatten Hunger.,Усі хотіли їсти.,Усі голодували.,9.291879812217675e-232,0.12098807491951687
34,Alle Hunde sind am Leben.,Всі собаки живі.,Усі собаки живі.,1.133422688662942e-154,0.12098807491951687
35,Alle Hunde sind lebendig.,Всі собаки живі.,Всі собаки живі.,1.2213386697554703e-77,0.12098807491951687
36,"Alle Hunde sind Tiere. Jedoch bedeutet das nicht, dass alle Tiere Hunde sind.","Усі собаки - тварини. Але це не значить, що усі тварини - собаки.","Усі собаки - тварини, але це не означає, що всі тварини - це собаки.",0.5031747626530138,0.12098807491951687
37,Alle ihre Bemühungen waren vergebens.,Всі їхні зусилля були марні.,Усі їхні зусилля були даремними.,6.86809206056511e-78,0.12098807491951687
38,Alle Jungen spielen gerne Baseball.,Всі хлопці полюбляють грати у бейсбол.,Усі хлопці люблять грати в бейсбол.,1.5319719891192393e-231,0.12098807491951687
39,Alle Jungen tanzten.,Усі хлопці танцювали.,Усі хлопці танцювали.,1.2213386697554703e-77,0.12098807491951687
40,Alle kannten das.,Усі це знали.,Всі знали це.,1.646211035903463e-231,0.12098807491951687
41,Alle Kinder erhielten ein Geschenk.,Всі діти отримали подарунок.,Усі діти отримали подарунок.,8.636168555094496e-78,0.12098807491951687
42,Alle lächelten.,Всі посміхнулися.,Всі усміхнулися.,1.5319719891192393e-231,0.12098807491951687
43,Alle lachten über ihn.,Всі сміялися з нього.,Усі сміялися з нього.,8.636168555094496e-78,0.12098807491951687
44,Alle lieben ihn.,Його всі люблять.,Усі люблять його.,1.646211035903463e-231,0.12098807491951687
45,Alle lieben mich.,Усі люблять мене.,Усі люблять мене.,1.2213386697554703e-77,0.12098807491951687
46,Alle meine Freunde lieben American Football.,Всі мої друзі люблять американський футбол.,Всі мої друзі люблять американський футбол.,1.0,0.12098807491951687
47,Alle meine Freunde lieben Fußball.,Всі мої друзі люблять футбол.,Усі мої друзі люблять футбол.,0.668740304976422,0.12098807491951687
48,Alle meine Freunde mögen Computerspiele.,Всі мої друзі люблять комп'ютерні ігри.,Усі мої друзі люблять комп'ютерні ігри.,0.7598356856515925,0.12098807491951687
49,Alle meine Freunde werden da sein.,Там будуть усі мої друзі.,Там будуть усі мої друзі.,1.0,0.12098807491951687
50,Alle Menschen müssen sterben.,Всі люди повинні померти.,Усі люди мусять померти.,1.5319719891192393e-231,0.12098807491951687
51,Alle Menschen sind gleich.,Всі люди рівні.,Усі люди однакові.,1.384292958842266e-231,0.12098807491951687
52,Alle mögen große Pizzas.,Усі люблять великі піци.,Всі люблять велику піцу.,1.2882297539194154e-231,0.12098807491951687
53,Alle müssen es wissen.,Усі мають знати.,Всі повинні знати.,1.384292958842266e-231,0.12098807491951687
54,Alle mussten Französisch lernen.,Всі мали вивчити французьку.,Всім потрібно було вивчити французьку.,8.38826642100846e-155,0.12098807491951687
55,Alle nennen ihn Mac.,Усі називають його Маком.,Усі називають його Мак.,8.636168555094496e-78,0.12098807491951687
56,Alle reden über Tom.,Усі говорять про Тома.,Усі говорять про Тома.,1.0,0.12098807491951687
57,Aller guten Dinge sind drei.,Бог любить трійцю.,Все добре - це три речі.,0.0,0.12098807491951687
58,Alle schlafen.,Всі сплять.,Всі сплять.,1.491668146240062e-154,0.12098807491951687
59,Alle schlafen.,Усі сплять.,Всі сплять.,1.5319719891192393e-231,0.12098807491951687
60,Alles gut bei euch?,У всіх усе гаразд?,З вами все гаразд?,8.38826642100846e-155,0.12098807491951687
61,Alles Gute zum Geburtstag!,З днем народження!,З днем народження!,1.2213386697554703e-77,0.12098807491951687
62,Alles hängt von deiner Entscheidung ab.,Усе залежить від твого рішення.,Все залежить від твого вибору.,6.86809206056511e-78,0.12098807491951687
63,Alles hier gehört mir.,Тут все моє.,Все це моє.,1.646211035903463e-231,0.12098807491951687
64,Alle sind bereit.,Усі готові.,Усі готові.,1.491668146240062e-154,0.12098807491951687
65,Alle sind geschockt.,Всі в шоці.,Всі були шоковані.,1.384292958842266e-231,0.12098807491951687
66,Alle sind sehr beschäftigt.,Усі дуже зайняті.,Усі дуже зайняті.,1.2213386697554703e-77,0.12098807491951687
67,Alles in Ordnung?,Все добре?,Ти в порядку?,1.2882297539194154e-231,0.12098807491951687
68,Alles ist gut.,Все в порядку.,Все добре.,9.291879812217675e-232,0.12098807491951687
69,Alles ist gut.,Все гаразд.,Все добре.,1.5319719891192393e-231,0.12098807491951687
70,Alles ist gut.,Усе гаразд.,Все добре.,0.0,0.12098807491951687
71,Alles ist in Butter.,Все в шоколаді.,Все в маслі.,1.133422688662942e-154,0.12098807491951687
72,Alles ist möglich.,Можливо все.,Все можливо.,1.821831989445342e-231,0.12098807491951687
73,Alles ist vorbei.,Все скінчилося.,Все скінчилося.,1.491668146240062e-154,0.12098807491951687
74,Alles oder nichts.,Все чи нічого.,Все або нічого.,1.646211035903463e-231,0.12098807491951687
75,Alles war nur ein Scherz.,Усе було лише жартом.,Все було просто жартома.,1.2882297539194154e-231,0.12098807491951687
76,"Alles, was du tun musst, ist diesen roten Knopf zu drücken.","Все, що тобі треба зробити, - це натиснути на червону кнопку.","Все, що тобі потрібно, це натиснути цю червону кнопку.",4.747971426744689e-78,0.12098807491951687
77,"Alles, was einen Anfang hat, hat auch ein Ende.","Все, що має початок, має і кінець.","Все, що має початок, теж має кінець.",0.45499414040480374,0.12098807491951687
78,"Alles, was ich habe, ist ein Buch.","Все, що я маю, - це книжка.","Все, що в мене є, це книга.",7.711523862191631e-155,0.12098807491951687
79,"Alles, was Tom gesagt hat, stimmt.","Все, що сказав Том, - правда.","Все, що Том сказав, правда.",8.635715405417689e-155,0.12098807491951687
80,Alles wird gut sein.,Все буде в порядку.,Все буде добре.,8.121328445417258e-155,0.12098807491951687
81,Alles wird gut werden.,Все буде в порядку.,Все буде добре.,8.121328445417258e-155,0.12098807491951687
82,Alles wird gut.,Все буде добре.,Все буде добре.,1.2213386697554703e-77,0.12098807491951687
83,Alle überlebten.,Всі вижили.,Усі пережили.,0.0,0.12098807491951687
84,Alle Vögel haben Federn.,Всі птахи мають пір'я.,У всіх птахів пір'я.,5.775353993361614e-78,0.12098807491951687
85,Alle waren auf meinen Erfolg neidisch.,Усі заздрили моєму успіху.,Усі заздрили моєму успіху.,1.0,0.12098807491951687
86,Alle waren zufrieden.,Усі були задоволені.,Усі були задоволені.,1.2213386697554703e-77,0.12098807491951687
87,Alle Wege führen nach Rom.,Всі дороги ведуть до Риму.,Всі шляхи ведуть до Риму.,7.380245217279165e-78,0.12098807491951687
88,Alle Wege führen nach Rom.,Усі шляхи ведуть до Риму.,Всі шляхи ведуть до Риму.,0.668740304976422,0.12098807491951687
89,Almaty ist meine Lieblingsstadt!,Алмати - моє улюблене місто!,Алмати - моє улюблене місто!,1.0,0.12098807491951687
90,"Als ich aufwachte, fiel Schnee.","Коли я прокинулася, йшов сніг.","Прокинувшись, впав сніг.",7.107197028258987e-232,0.12098807491951687
91,Als Jugendlicher schrieb Tom gerne Gedichte.,"Коли Том був підлітком, він любив віршувати.",У підлітковому віці Том любив писати вірші.,1.331960397810445e-231,0.12098807491951687
92,Als Jugendlicher schrieb Tom gerne Gedichte.,"Коли Том був підлітком, він любив писати вірші.",У підлітковому віці Том любив писати вірші.,4.677477553605556e-78,0.12098807491951687
93,"Also, sagen wir Feierabend?","Отож, на сьогодні досить?","Ну що, з роботи?",1.2183324802375697e-231,0.12098807491951687
94,Also sprach Zarathustra.,Так казав Заратустра.,"Отже, царська атмостра говорила.",0.0,0.12098807491951687
95,Alte Teppiche sind wertvoller als neue.,Старі килими коштовніші за нові.,Старі килими цінніші за нові.,1.1862800137389335e-154,0.12098807491951687
96,Alte Teppiche sind wertvoller als neue.,Старі килими цінніші за нові.,Старі килими цінніші за нові.,1.0,0.12098807491951687
97,Aluminium ist ein Metall.,Алюміній - метал.,Алюміній - це метал.,1.0547686614863434e-154,0.12098807491951687
98,Am 24. Dezember ist Heiligabend.,24 грудня - канун Різдва.,24 грудня - Різдво.,6.725854833444237e-78,0.12098807491951687
99,Am Anfang schuf Gott Himmel und Erde.,На початку Бог створив Небо та землю.,На початку Бог створив небо і землю.,0.6434588841607617,0.12098807491951687
100,Amerikaner sind überaus freundliche Leute.,Американці - дуже дружелюбні люди.,Американці дуже добрі люди.,1.3203832882211142e-231,0.12098807491951687
101,Am Tage ihrer Hochzeit sind alle Bräute schön.,У день весілля всі наречені красиві.,У день весілля всі наречені гарні.,0.7598356856515925,0.12098807491951687
102,Am Wochenende arbeite ich nie.,Я ніколи не працюю у вихідні.,Я ніколи не працюю на вихідних.,0.5081327481546147,0.12098807491951687
103,An Deck sind 48 Seeleute.,На борту сорок вісім моряків.,На палубі — 48 моряків.,1.4488496539373276e-231,0.12098807491951687
104,An deiner Stelle ginge ich sofort nach Hause.,На твоєму місці я би відразу пішов додому.,На твоєму місці я негайно пішов додому.,0.42383656282787796,0.12098807491951687
105,An deiner Stelle würde ich das nicht machen.,На твоєму місці я би не став цього робити.,На твоєму місці я б цього не зробив.,0.3376459109063278,0.12098807491951687
106,An der Wand hängt eine Karte.,На стіні висить географічна карта.,На стіні висить карта.,7.227401369829121e-78,0.12098807491951687
107,An der Wand hängt eine Karte.,На стіні висить мапа.,На стіні висить карта.,8.636168555094496e-78,0.12098807491951687
108,Angelica Pickles ist sehr egoistisch.,Анжеліка Піклз дуже егоїстична.,Анжеліка Пікс дуже егоїстка.,1.5319719891192393e-231,0.12098807491951687
109,Angenehm!,Приємно познайомитися!,Як приємно!,1.5319719891192393e-231,0.12098807491951687
110,Anja lebt in Danzig.,Аня живе у Гданьску.,Аня живе в Данці.,9.53091075863908e-155,0.12098807491951687
111,Ankara ist die Hauptstadt der Türkei.,Анкара - столиця Туреччини.,Анкара — столиця Туреччини.,1.0547686614863434e-154,0.12098807491951687
112,An meinem Mantel ist ein Knopf abgegangen.,В мене на плащі один ґудзик відірвався.,На моє пальто вийшла кнопка.,8.166726842395623e-232,0.12098807491951687
113,"Anna Achmatowa, Maxim Gorki, Arkadi Gaidar, Mark Twain, O. Henry, George Sand, Stendhal, Molière, Voltaire – diese alle tragen nicht ihren richtigen Familiennamen, sondern ein Pseudonym.","Анна Ахматова, Максим Горький, Аркадій Гайдар, Марк Твен, О. Генрі, Жорж Санд, Стендаль, Мольєр, Вольтер... У них у всіх не справжні прізвища, а псевдоніми.","Анна Аматова, Максим Ґоркі, Аркаді Ґайдар, Марк Твен, О. Генрі, Джордж Сандель, Мір'є, Вольтер, вони всі носять не свої справжні імена, а псевдоніми.",0.13048038402447693,0.12098807491951687
114,Ann mag Schokolade sehr.,Ганна дуже любить шоколад.,Енн дуже любить шоколад.,8.636168555094496e-78,0.12098807491951687
115,"Anstatt zur Schule zu gehen, blieb er zuhause.","Замість того, щоб іти до школи, він лишився вдома.","Замість ходити до школи, він залишився вдома.",4.2874310268234296e-78,0.12098807491951687
116,Antworte mir.,Дай мені відповідь.,Відповідай мені.,9.291879812217675e-232,0.12098807491951687
117,Antworten Sie auf Englisch.,Відповідайте англійською.,Відповідайте на англійську.,1.384292958842266e-231,0.12098807491951687
118,Antworten Sie auf Englisch.,Дайте відповідь англійською.,Відповідайте на англійську.,0.0,0.12098807491951687
119,Antwortet auf Englisch.,Відповідайте англійською.,Відповісте англійською.,1.5319719891192393e-231,0.12098807491951687
120,Äpfel sind rot.,Яблука червоні.,Яблука червоні.,1.491668146240062e-154,0.12098807491951687
121,Äpfel wachsen auf Bäumen.,Яблука ростуть на деревах.,Яблуки ростуть на деревах.,8.636168555094496e-78,0.12098807491951687
122,Araber verfolgen mich.,Араби мене переслідують.,Араби переслідують мене.,1.821831989445342e-231,0.12098807491951687
123,Arbeit adelt.,Праця облагороджує.,Працюйте.,0.0,0.12098807491951687
124,"Arbeite schnell, iss langsam!","Працюй швидко, їж повільно.","Працюй швидко, їж повільно!",1.0,0.12098807491951687
125,Arbeitest du morgen früh im Hotel?,Ти працюватимеш в готелі завтра вранці?,Ти працюєш у готелі завтра вранці?,0.4347208719449914,0.12098807491951687
126,"Argentinien, Chile, Uruguay, Paraguay und Südbrasilien sind Teil des Südkegels.","Аргентина, Чилі, Уругвай, Парагвай та Південна Бразилія є частиною Південного Конуса.","Аргентина, Чілі, Уругваю, Парагваю та південна Бразилія є частиною південного узбережжя Бразилії.",0.43361890903486755,0.12098807491951687
127,Ärgere dich nicht.,Не злостися!,Не засмучуйся.,1.5319719891192393e-231,0.12098807491951687
128,Astana ist die Hauptstadt von Kasachstan.,Астана - столиця Казахстану.,Аскана — столиця Казахстану.,9.53091075863908e-155,0.12098807491951687
129,Atmen Sie tief ein und entspannen Sie sich.,Глибоко зітхніть і розслабтеся.,Глибоко вдихніть і розслабтеся.,1.0547686614863434e-154,0.12098807491951687
130,Atmen Sie tief ein.,Глибоко вдихніть.,Глибоко вдихніть.,1.491668146240062e-154,0.12098807491951687
131,Atmet ein.,Вдихніть.,Дихай.,0.0,0.12098807491951687
132,Atmet sie?,Вона дихає?,Вона дихає?,1.2213386697554703e-77,0.12098807491951687
133,Auch das noch!,Лише цього не вистачало!,І це теж!,0.0,0.12098807491951687
134,Auch die schwärzeste Kuh gibt nur weiße Milch.,Навіть найчорніша корова дає лише біле молоко.,Також найкрихіша корова дає тільки біле молоко.,9.85444998995587e-155,0.12098807491951687
135,Auch er ist Schriftsteller.,Він теж письменник.,Він також письменник.,1.646211035903463e-231,0.12098807491951687
136,Auch Gott versteht Esperanto.,Бог теж розуміє есперанто.,Бог також розуміє Есперанто.,1.0547686614863434e-154,0.12098807491951687
137,Auch ich liebe euch.,Я вас теж кохаю.,Я теж вас люблю.,1.6954057018456463e-231,0.12098807491951687
138,Auch ich mag Süßigkeiten.,Мені також подобаються цукерки.,Я теж люблю солодощі.,0.0,0.12098807491951687
139,Auch meine Mutter ist Lehrerin.,Моя мати теж вчителька.,Моя мати також є вчителькою.,8.38826642100846e-155,0.12098807491951687
140,Auch sie liebt Schokolade.,Вона теж обожнює шоколад.,Вона теж любить шоколад.,1.0547686614863434e-154,0.12098807491951687
141,"Auch wenn Amerika ein entwickeltes Land ist, findet man dort nicht wenige sehr arme Menschen.","Хоча Сполучені Штати й розвинена країна, проте там є дуже бідні люди.","Америка — це розвинена країна, але там живуть бідні люди.",7.051032102388049e-155,0.12098807491951687
142,Auf dem Dokument stand seine Unterschrift.,На документі стояв його підпис.,На цьому документі був підпис.,1.6034157163765524e-231,0.12098807491951687
143,Auf dem Mond gibt es keine Luft.,На Місяці немає повітря.,На Місяці немає повітря.,1.0,0.12098807491951687
144,Auf dem Tisch befindet sich eine Blume.,На столі квітка.,На столі є квітка.,1.0547686614863434e-154,0.12098807491951687
145,Auf dem Tisch liegt ein Apfel.,На столі є яблуко.,На столі лежить яблуко.,1.0547686614863434e-154,0.12098807491951687
146,Auf dem Tisch liegt eine Melone.,На столі лежить диня.,На столі лежить кавун.,8.636168555094496e-78,0.12098807491951687
147,Auf dem Tisch steht eine Vase.,На столі стоїть ваза.,На столі стоїть ваза.,1.0,0.12098807491951687
148,Auf dem Weg zur Schule habe ich mein Portemonnaie verloren.,Я загубив гаманець по дорозі до школи.,По дорозі до школи я втратив гаманець.,0.45499414040480374,0.12098807491951687
149,Auf der Insel ist es das ganze Jahr über warm.,На цьому острові тепло цілий рік.,На острові тепло цілий рік.,0.5789300674674098,0.12098807491951687
150,Auf der Insel ist es ganzjährig warm.,На цьому острові тепло цілий рік.,На острові тепло цілий рік.,0.5789300674674098,0.12098807491951687
151,Auf der Straße ist niemand zu sehen.,На вулиці нікого не видно.,На вулиці нікого немає.,6.725854833444237e-78,0.12098807491951687
